Main Theme,Sub Theme,Ticker,Preis,52W High,52W Low,Name,Description,Trend Score,Momentum
AI / Tech,AI Compute,NVDA,201.37010192871094,212.1667169482571,97.2570779520085,NVIDIA Corporation,"NVIDIA Corporation operates as a data center scale AI infrastructure company. The company operates through two segments, Compute & Networking, and Graphics segments. The Compute & Networking segment provides data center accelerated computing and networking platforms and artificial intelligence solutions and software, and automotive platforms and autonomous and electric vehicle solutions, including software. The Graphics segment offers GeForce GPUs for gaming and PCs; Quadro/NVIDIA RTX GPUs for enterprise workstation graphics. The company's products are used in gaming, professional visualization, data center, and automotive markets. The company sells its products to original equipment manufacturers, original device manufacturers, system integrators and distributors, independent software vendors, cloud service providers, add-in board manufacturers, distributors, automotive manufacturers and tier-1 automotive suppliers, and other ecosystem participants worldwide. It has a collaboration with Tech Mahindra Limited to develop artificial intelligence powered telco network operations reasoning agent. The company has a strategic partnership with Lumentum Holdings Inc. to develop optics technologies for AI and data centers. It also has a strategic partnership with Nebius Group N.V. to develop and deploy hyperscale cloud for the artificial intelligence market. NVIDIA Corporation was incorporated in 1993 and is headquartered in Santa Clara, California.",0.91,0.81
AI / Tech,AI Compute,MRVL,155.4600067138672,155.89869689941406,49.645785110251566,"Marvell Technology, Inc.","Marvell Technology, Inc., together with its subsidiaries, provides data infrastructure semiconductor solutions and spanning the data center core to network edge in the United States, Argentina, China, India, Israel, Japan, Singapore, South Korea, Taiwan, Vietnam, and internationally. The company develops and scales system-on-a-chip architectures, integrating analog, mixed-signal, and digital signal processing functionality. It offers a portfolio of ethernet solutions, including spanning controllers, network adapters, physical transceivers, and switches; single or multiple core processors; and custom application specific integrated circuits, interconnects, fibre channel adapters, and processors. The company also provides interconnect products, including pulse amplitude modulation, coherent and coherent-lite digital signal processors (DSPs), laser drivers, trans-impedance amplifiers, silicon photonics, co-packaged optics, linear pluggable optics chipsets, data center interconnect, active electrical cable DSPs and peripheral component interconnect express retimer solutions; fibre channel products comprising host bus adapters and controllers for server and storage system connectivity; storage controllers for hard disk drives and solid-state-drives; host system interfaces, including serial advanced technology attachment and serial attached SCSI, peripheral component interconnect express, compute express link switches, non-volatile memory express (NVMe), and NVMe over fabrics; and develops ultra accelerator linkTM switches and ethernet for scale-up networking switches. The company serves data centers, communications, and other markets. It offers its products through direct customers and distributors. Marvell Technology, Inc. was incorporated in 1995 and is headquartered in Wilmington, Delaware.",1.0,0.99
AI / Tech,AI Compute,AVGO,416.07000732421875,416.6700134277344,163.89206805514885,Broadcom Inc.,"Broadcom Inc. designs, develops, and supplies various semiconductor devices and infrastructure software solutions internationally. The company operates in two segments: Semiconductor Solutions and Infrastructure Software. The company offers networking connectivity, such as custom silicon solutions, ethernet switching & routing, ethernet NIC controllers, physical layer devices, and fiber optic components; wireless device connectivity, including RF semiconductor devices, connectivity solutions, custom touch controllers, and inductive charging ASICS; servers and storage system solutions, such as PCIE switches, SAS & raid products, fibre channel products, and HDD & SSD solutions; broadband solutions, includes set-top box, and broadband access; and industrial. The company also offers a private cloud software portfolio, including the VMware Cloud Foundation, Edge, vSphere foundation, telco cloud platform, private AI, live recovery, application networking and security, application development and data services; mainframe software, such as AIOPS & automation, database & data management, DEVX & DEVOPS, cybersecurity & compliance management, beyond code programs, foundational & open mainframe solutions; cybersecurity, such as endpoint, network, information, application security, and identity & access management; enterprise software; and fc san management. Its products are used in various applications in enterprise and data center networking, including artificial intelligence networking and connectivity, home connectivity, set-top boxes, broadband access, telecommunication equipment, wireless device and base stations, data center servers and storage systems, factory automation, power generation and alternative energy systems, and electronic displays. Broadcom Inc. was founded in 1961 and is headquartered in Palo Alto, California.",1.0,1.0
AI / Tech,AI Compute,INTC,66.13500213623047,70.33000183105469,18.969999313354492,Intel Corporation,"Intel Corporation designs, develops, manufactures, markets, sells, and services computing and related end products and services in the United States, Ireland, Israel, and internationally. It operates through three segments: CCG, DCAI, and Intel Foundry. The company offers client computing group products, including client and commercial CPUs, discrete client GPUs, edge computing, and connectivity products; data center and AI products, such as server CPUs, discrete GPUs, and networking products; and semiconductors comprising wafer fabrication, substrates, and other related products and services. It also provides driving assistance and self-driving solutions; and develops and manufactures multi-beam mask writing tools. The company sells its products through sales organizations, distributors, resellers, retailers, and OEM partners. It serves original equipment manufacturers, original design manufacturers, cloud service providers, and other manufacturers and service providers. Intel Corporation has a strategic collaboration with Infosys Limited to develop a multi-layer AI fabric that unifies infrastructure, models, data, applications, and workflows into a composable and agent-ready ecosystem. The company was incorporated in 1968 and is headquartered in Santa Clara, California.",0.92,0.84
AI / Tech,AI Compute,TSM,377.2900085449219,389.11354545099755,145.6362152565363,Taiwan Semiconductor Manufactur,"Taiwan Semiconductor Manufacturing Company Limited, together with its subsidiaries, manufactures, packages, tests, and sells integrated circuits and other semiconductor devices in Taiwan, China, Europe, the Middle East, Africa, Japan, the United States, and internationally. It provides various wafer fabrication processes, such as processes to manufacture complementary metal- oxide-semiconductor (CMOS) logic, mixed-signal, radio frequency, embedded memory, bipolar CMOS mixed-signal, and others. The company also involved in providing customer and engineering support services; manufacturing of masks; investment in technology start-up companies; research, designing, developing, manufacturing, packaging, testing, and sale of color filters; and investment activities. Its products are used in high performance computing, smartphones, Internet of things, automotive, and digital consumer electronics. Taiwan Semiconductor Manufacturing Company Limited was incorporated in 1987 and is headquartered in Hsinchu City, Taiwan.",0.95,0.9
AI / Tech,AI Compute,ARM,192.07000732421875,192.3699951171875,97.90399932861328,Arm Holdings plc,"Arm Holdings plc architects, develops, and licenses central processing unit products and related technologies for semiconductor companies and original equipment manufacturers. The company is involved in the licensing, marketing, research, and development of microprocessors, systems intellectual property (IPs), graphics processing units, physical IP and associated systems IPs, software, tools, and other related services. It also offers arm central processing units, accelerators, system IP products, and compute platform products, as well as development tools and software. The company's products are used in various markets, such as automotive, computing infrastructure, consumer technologies, and Internet of things. It operates in the United States, the People's Republic of China, Taiwan, the Republic of Korea, and internationally. Arm Holdings plc has a strategic collaboration with International Business Machines Corporation to develop dual-architecture hardware that helps enterprises run future AI and data intensive workloads. The company was founded in 1990 and is headquartered in Cambridge, the United Kingdom. Arm Holdings plc operates as a subsidiary of SoftBank Group Corp.",1.0,0.99
AI / Tech,AI Compute,SMCI,29.079999923706055,62.36000061035156,19.479999542236328,"Super Micro Computer, Inc.","Super Micro Computer, Inc., together with its subsidiaries, develops and sells server and storage solutions based on modular and open-standard architecture in the United States, Asia, Europe, and internationally. The company provides liquid and air-cooled AI servers for training and inferencing with integrated graphics processing units (GPUs) or PCIe based architectures; SuperBlade, MicroBlade, FlexTwin, GrandTwin, and BigTwin blade and multi-node systems; SuperStorage systems; Hyper, CloudDC, and WIO and rackmount systems; embedded (5G/IoT/Edge) systems; and MicroCloud server systems. It also offers workstations and networking devices; and modular server subsystems and accessories, including server boards, chassis, power supplies, and other accessories. In addition, the company provides remote system management solutions, such as Server Management suite comprising Supermicro Server Manager, Supermicro Power Management software, Supermicro Update Manager, SuperCloud Composer, and SuperDoctor 5. Further, the company identifies service requirements; creates and executes project plans; conducts verification testing; offers training; and provides technical documentation. Additionally, it offers rack level services from design to deployment for full rack and cluster level deployments of AI and HPC datacenters; help desk services and on-site product support; and warranties, maintenance, and technical support services. The company serves enterprise data centers, cloud computing, artificial intelligence, 5G, and edge computing markets through direct and indirect sales force, distributors, value-added resellers, system integrators, and original equipment manufacturers. Super Micro Computer, Inc. was incorporated in 1993 and is headquartered in San Jose, California.",0.22,-0.55
AI / Tech,AI Compute,ASML,1463.6240234375,1547.219970703125,625.5239510117115,ASML Holding N.V. - New York Re,"ASML Holding N.V. provides lithography solutions for the development, production, marketing, sales, upgrading, and servicing of advanced semiconductor equipment systems. The company offers lithography, metrology, and inspection systems. It also provides extreme ultraviolet lithography systems; and deep ultraviolet lithography systems comprising immersion and dry lithography systems solutions to manufacture various range of semiconductor nodes and technologies. In addition, the company offers metrology and inspection systems, including YieldStar optical metrology systems, a diffraction-based wafer metrology platform to assess the quality of patterns on the wafers; and HMI electron beam solutions to locate and analyze individual chip defects. Further, it provides computational lithography solutions, and lithography systems and control software solutions; and refurbishes and upgrades lithography systems, as well as offers customer support and related services. Additionally, the company offers hardware, software, and services to chipmakers to produce the patterns of integrated circuits. It operates in Japan, South Korea, Singapore, Taiwan, China, rest of Asia, the Netherlands, rest of Europe, the Middle East, Africa, and the United States. The company was formerly known as ASM Lithography Holding N.V. and changed its name to ASML Holding N.V. in 2001. ASML Holding N.V. was founded in 1984 and is headquartered in Veldhoven, the Netherlands.",0.91,0.82
AI / Tech,AI Compute,KLAC,1806.3900146484375,1823.27001953125,621.1404886180534,KLA Corporation,"KLA Corporation, together with its subsidiaries, designs, manufactures, and markets process control, process-enabling, and yield management solutions for the semiconductor and related electronics industries worldwide. The company operates through three segments: Semiconductor Process Control; Specialty Semiconductor Process; and PCB and Component Inspection. It offers inspection and review tools to identify, locate, characterize, review, and analyze defects on various surfaces of patterned and unpatterned wafers; metrology systems to measure pattern dimensions, film thickness, film stress, layer-to-layer alignment, pattern placement, surface topography, and electro-optical properties for wafers; chemical process control equipment; wired and wireless sensor wafers and reticles; wafer defect inspection, review, and metrology systems; reticle inspection and metrology systems; wafer inspection and metrology systems; and semiconductor software solutions that provide run-time process control, defect excursion identification, process corrections, and defect classification to accelerate yield learning rates and reduce production risk. The company also provides etch, plasma dicing, deposition, and other wafer processing technologies and solutions for the semiconductor and microelectronics industry. In addition, it offers direct imaging, inspection, optical shaping, inkjet and additive printing, and computer-aided manufacturing and engineering solutions for the PCB market and inspection and metrology systems for quality control and yield improvement in advanced and traditional semiconductor packaging markets. The company was formerly known as KLA-Tencor Corporation and changed its name to KLA Corporation in July 2019. KLA Corporation was incorporated in 1975 and is headquartered in Milpitas, California.",0.99,0.97
AI / Tech,AI Compute,MU,476.4100036621094,479.5,67.27896835866437,"Micron Technology, Inc.","Micron Technology, Inc. designs, develops, manufactures, and sells memory and storage products in the United States, Taiwan, Japan, Mainland China, Hong Kong, Europe, and internationally. It operates through the Cloud Memory Business Unit; Core Data Center Business Unit; Mobile and Client Business Unit; and Automotive and Embedded Business Unit segments. The company provides memory products, including dynamic random access memory components and modules, CXL-based memory, LPDDR components and modules, graphics memory, high-bandwidth memory, and data center memory products; multichip packages (MCP) comprising embedded multimedia card-based, universal flash storage-based, and NAND-based MCPs; and technology leadership products that include 1y DRAM and G9 NAND technologies. It also offers storage products, such as data center solid-state drives (SSD), client SSD storage, and auto and industrial SSD storage; managed NAND; NAND flash; NOR flash; and memory cards. In addition, the company provides design tools, including FBGA and part decoders; DRAM power calculators; NAND power calculators; simulation models; chipset compatibility guides; serial presence-detection tools; cross-reference tools; UFSparm; SSD firmware; software and drivers; storage executive software; and obsolete part catalogs. It markets its semiconductor memory and storage products under the Micron and Crucial brands. The company serves the data center, PC, graphics, networking, automotive, industrial, and consumer embedded markets, as well as the smartphone and other mobile-device markets. It sells its products through its direct sales force, independent sales representatives, distributors, and retailers; web-based customer direct sales channel; and channel and distribution partners. Micron Technology, Inc. was founded in 1978 and is headquartered in Boise, Idaho.",0.99,0.99
AI / Tech,AI Compute,AMD,297.17498779296875,298.17999267578125,85.16999816894531,"Advanced Micro Devices, Inc.","Advanced Micro Devices, Inc. operates as a semiconductor company internationally. It operates in three segments: Data Center, Client and Gaming, and Embedded. The company offers artificial intelligence (AI) accelerators, microprocessors, and graphics processing units (GPUs) as standalone devices or as incorporated into accelerated processing units, chipsets, and data center and professional GPUs; and embedded processors and semi-custom system-on-chip (SoC) products, microprocessor and SoC development services and technology, data processing units, field programmable gate arrays (FPGA), system on modules, AI network interface cards, and adaptive SoC products. It provides processors under the AMD Ryzen, AMD Ryzen AI, AMD Ryzen PRO, AMD Ryzen Threadripper, AMD Ryzen Threadripper PRO, AMD Athlon, and AMD PRO A-Series brands; graphics under the AMD Radeon graphics and AMD Embedded Radeon graphics; professional graphics under the AMD Radeon Pro graphics brand; and AI and general-purpose compute infrastructure for hyperscale providers. The company offers data center graphics under the AMD Instinct accelerators and Radeon PRO V-series brands; server microprocessors under the AMD EPYC brand; low power solutions under the AMD Athlon, AMD Geode, AMD Ryzen, AMD EPYC, and AMD R-Series and G-Series brands; FPGA products under the Virtex-6, Virtex-7, Virtex UltraScale+, Kintex-7, Kintex UltraScale, Kintex UltraScale+, Artix-7, Artix UltraScale+, Spartan-6, and Spartan-7 brands; adaptive SOCs under the Zynq-7000, Zynq UltraScale+ MPSoC, Zynq UltraScale+ RFSoCs, Versal HBM, Versal Premium, Versal Prime, Versal AI Core, Versal AI Edge, Vitis, and Vivado brands; and compute and network acceleration board products under the Alveo and Pensando brands. It serves original equipment and design manufacturers, public cloud service providers, system integrators, distributors, and add-in-board manufacturers. The company was incorporated in 1969 and is headquartered in Santa Clara, California.",1.0,0.99
AI / Tech,AI Compute,QCOM,136.0399932861328,203.59584897530524,121.98999786376953,QUALCOMM Incorporated,"QUALCOMM Incorporated engages in the development and commercialization of foundational technologies for the wireless industry worldwide. It operates through three segments: Qualcomm CDMA Technologies (QCT); Qualcomm Technology Licensing (QTL); and Qualcomm Strategic Initiatives (QSI). The QCT segment develops and supplies integrated circuits and system software with connectivity and computing technologies for use in mobile devices; automotive systems for connectivity, digital cockpit, and ADAS/AD; and IoT, including consumer electronic devices, industrial devices, and edge networking products. The QTL segment grants licenses or provides rights to use portions of its intellectual property portfolio, which include various patent rights useful in the manufacture and sale of wireless products comprising products implementing LTE, and/or OFDMA-based 5G products and derivatives; to use cellular standard-essential patents, including 3G, 4G and 5G for cellular devices. The QSI segment invests in early-stage companies in various industries, including 5G, artificial intelligence, automotive, consumer, enterprise, cloud, IoT, and extended reality, and investments, including non-marketable equity securities and, to a lesser extent, marketable equity securities, and convertible debt instruments. It also provides development, and other services and sells related products to the United States government agencies and their contractors. In addition, the company is also involved in Qualcomm government technologies and data center businesses. QUALCOMM Incorporated was incorporated in 1985 and is headquartered in San Diego, California.",0.17,-0.66
AI / Tech,AI Compute,TXN,235.03500366210938,238.17999267578125,140.6389356684501,Texas Instruments Incorporated,"Texas Instruments Incorporated designs, manufactures, and sells semiconductors to electronics designers and manufacturers in the United States, China, the rest of Asia, Europe, the Middle East, Africa, Japan, and internationally. It operates through Analog and Embedded Processing segments. The Analog segment offers power products to manage power requirements across various voltage levels, including battery-management solutions, DC/DC switching regulators, AC/DC and isolated controllers and converters, power switches, linear regulators, voltage references, multiphase controllers and power stages, and lighting products. This segment also provides signal chain products that sense, condition, and measure real-world signals and convert them into data to be transferred or converted for further processing and control, such as amplifiers, data converters, interface products, motor drives, clocks, and logic and sensing products. The Embedded Processing segment offers microcontrollers, processors, wireless connectivity, and radar products; and applications processors for specific computing activity. It also provides DLP products primarily for use in projecting high-definition images; calculators; and application-specific integrated circuits. Its products are used in various markets, such as industrial, automotive, personal electronics, communications equipment, enterprise systems, calculators, and others. The company markets and sells its semiconductor products through direct sales and distributors, as well as through its website. Texas Instruments Incorporated was founded in 1930 and is headquartered in Dallas, Texas.",0.97,0.94
AI / Tech,AI Networking,ANET,174.52000427246094,175.0,67.16000366210938,"Arista Networks, Inc.","Arista Networks, Inc. engages in the development, marketing, and sale of data-driven, client to cloud networking solutions for AI, data center, campus, and routing environments in the Americas, Europe, the Middle East, Africa, and the Asia-Pacific. Its cloud networking solutions consist of Extensible Operating System (EOS), a publish-subscribe state-sharing networking operating system offered in combination with a set of network applications. The company offers data center, cloud and AI networking, cognitive adjacencies, and cognitive network software and services. It also provides post contract customer support services, such as technical support, hardware repair and replacement parts beyond standard warranty, bug fixes, patches, and upgrade services. The company serves a range of industries comprising internet companies, cloud service providers, financial services organizations, government agencies, media and entertainment, healthcare, oil and gas, education, manufacturing, industrial, and others. It markets and sells its products through distributors, system integrators, value-added resellers, and original equipment manufacturer partners, as well as through its direct sales force. Arista Networks, Inc. was formerly known as Arastra, Inc. and changed its name to Arista Networks, Inc. in October 2008. The company was incorporated in 2004 and is headquartered in Santa Clara, California.",1.0,0.99
