Main Theme,Sub Theme,Ticker,Preis,52W High,52W Low,Name,Description,PE,Forward PE,Revenue Growth,Earnings Growth,Profit Margin,Market Cap,3M Momentum,Trend Score,Momentum
Finance,Banks,LLOY.L,105.0999984741211,114.57273471641537,72.82237610434846,LLOYDS BANKING GROUP PLC ORD 10,"Lloyds Banking Group plc bietet zusammen mit seinen Tochtergesellschaften eine Reihe von Bank- und Finanzprodukten und -dienstleistungen für Privat- und Geschäftskunden im Vereinigten Königreich an. Das Unternehmen ist in drei Segmenten tätig: Einzelhandel; Geschäftsbankwesen; und Versicherungen, Renten und Investitionen. Das Einzelhandelssegment bietet eine Reihe von Finanzdienstleistungsprodukten an, darunter Girokonten, Ersparnisse, Hypotheken, Kreditkarten, ungesicherte Kredite, Kfz-Finanzierung und Leasinglösungen für Privatkunden. Das Segment Commercial Banking bietet Kreditvergabe, Transaktionsbanking, Betriebskapitalmanagement, Fremdfinanzierung und Risikomanagementdienstleistungen für kleine und mittlere Unternehmen, Konzerne und Institutionen. Das Segment Versicherungen, Altersvorsorge und Kapitalanlagen bietet Versicherungs-, Kapitalanlage- und Rentenmanagementprodukte und -dienstleistungen an. Es bietet auch Lebensversicherung; und digitale Bankdienstleistungen. Das Unternehmen bietet seine Produkte und Dienstleistungen unter den Marken Lloyds Bank, Halifax, Bank of Scotland, Scottish Widows, MBNA, Schroders Personal Wealth, Black Horse, Lex Autolease, Birmingham Midshires, LDC, AMC, Embark Group, Lloyds Living, Cavendish Online, Tusker und HGP an. Das Unternehmen war früher als Lloyds TSB Group plc bekannt und änderte seinen Namen im Januar 2009 in Lloyds Banking Group plc. Lloyds Banking Group plc wurde 1695 gegründet und hat seinen Hauptsitz in London, Vereinigtes Königreich.",13.1375,8.740125,0.115,0.447,0.26495,61193547776.0,0.13,0.77,0.55
Finance,Banks,8306.T,3278.0,3394.0,1858.3303290001047,MITSUBISHI UFJ FINANCIAL GROUP ,"Mitsubishi UFJ Financial Group, Inc. ist eine Bankholdinggesellschaft, die in einer Reihe von Finanzgeschäften in Japan, den Vereinigten Staaten, Europa, Asien/Ozeanien und international tätig ist. Das Unternehmen ist in sieben Segmenten tätig: Digital Services, Retail & Commercial Banking, Japanese Corporate & Investment Banking, Global Commercial Banking, Asset Management & Investor Services, Global Corporate & Investment Banking und Global Markets. Das Unternehmen bietet Privatkunden sowie kleinen und mittleren Unternehmen Produkte und Dienstleistungen im Bereich Commercial Banking, Trust Banking sowie Wertpapiere an. Darüber hinaus bietet das Unternehmen Fusionen und Übernahmen, die Emission von Schuldtiteln und Aktien, Finanzberatung und immobilienbezogene Dienstleistungen an. Kreditkarten; und Treuhandbank- und Wertpapierprodukte und -dienstleistungen und ist in den Bereichen Kreditvergabe, Fondsabwicklung, Erbschaften, Vermögensverwaltung, Unternehmens- und Vermögensnachfolgelösungen sowie Devisengeschäfte tätig. Darüber hinaus bietet das Unternehmen Firmenkundendienstleistungen wie Projektfinanzierung, Finanzierung durch Exportkreditagenturen und Finanzierung durch Asset-Backed Commercial Paper an; Investment- und Transaktionsbankdienstleistungen für Unternehmen, Finanzinstitute, staatliche und multinationale Organisationen sowie institutionelle Anleger; sowie Vermögensverwaltungs- und Anlegerdienstleistungen, einschließlich Pensionsfondsmanagement und -verwaltung, Rentenstrukturberatung, Zahlungen an Begünstigte und Investmenttreuhanddienstleistungen für Privatkunden. Darüber hinaus bietet es Kredite, Einlagen, Geldtransfers, Absicherungs- und Anlagedienstleistungen sowie Firmenkunden an; Finanzen für Automobile und Konsumgüter; verkauft und handelt mit festverzinslichen Instrumenten, Währungen, Aktien und Aktien; bietet Anlageprodukte an, die Investmentfonds, strukturierte Anleihen und Schuldverschreibungen umfassen; entwickelt und vertreibt Finanzprodukte; und bietet Versicherungs- und Treasury-Dienstleistungen an. Mitsubishi UFJ Financial Group, Inc. wurde 1880 gegründet und hat seinen Hauptsitz in Tokio, Japan.",15.4331455,21.611288,,,0.28508,36965588140032.0,0.22,0.92,0.85
Industrials,Defense,SAF.PA,329.3999938964844,346.9021998728238,253.74889559647193,SAFRAN,"Safran SA ist zusammen mit seinen Tochtergesellschaften im Luft- und Raumfahrt- und Verteidigungsgeschäft in Frankreich, dem übrigen Europa, Amerika, der Asien-Pazifik-Region, Afrika und dem Nahen Osten tätig. Das Unternehmen ist in drei Segmenten tätig: Luft- und Raumfahrtantriebe; Flugzeugausrüstung, Verteidigung und Luftfahrtsysteme; und Flugzeuginnenräume. Das Segment Aerospace Propulsion entwirft, entwickelt, produziert und vermarktet Antriebs- und mechanische Kraftübertragungssysteme für Verkehrsflugzeuge, militärische Transportflugzeuge, Trainings- und Kampfflugzeuge, zivile und militärische Hubschrauber sowie Drohnen. und bietet Wartungs-, Reparatur- und Überholungsdienste (MRO) sowie den Verkauf von Ersatzteilen an. Das Segment Flugzeugausrüstung, Verteidigung und Aerosysteme bietet Fahrwerke und Bremsen; Gondeln und Reversierer; Avionik, wie Flugsteuerungen und Bordinformationssysteme; Sicherheitssysteme, einschließlich Evakuierungsrutschen und Sauerstoffmasken; Bordcomputer und Kraftstoffsysteme; elektrische Energiemanagementsysteme und damit verbundene Ingenieurdienstleistungen; optronische Ausrüstung und Visiere, Navigationsausrüstung und Sensoren, Infanterie und Drohnen; MRO-Dienstleistungen; und verkauft Ersatzteile. Das Segment Aircraft Interiors entwirft, entwickelt, produziert und vermarktet Flugzeugsitze für Passagiere und Besatzung; Kabinenausrüstung, Gepäckfächer, Klassenteiler, Passagierserviceeinheiten, Kabineninnenlösungen, Kühlsysteme, Bordküchen, elektrische Einsätze und Trolleys; sowie Kabinenausstattung und passagierkomfortorientierte Lösungen wie Wasserverteilung, Toiletten, Luftsysteme sowie Bordunterhaltungs- und Konnektivitätslösungen (IFEC). Die Produkte und Dienstleistungen des Unternehmens werden in kommerziellen zivilen und militärischen Flugzeugen sowie Hubschraubern eingesetzt. Safran SA wurde 1896 gegründet und hat seinen Hauptsitz in Paris, Frankreich.",19.184624,26.810612,0.125,,0.23010999,136813838336.0,0.18,0.81,0.62
Industrials,Defense,RR.L,1408.199951171875,1424.199951171875,873.9254521565182,ROLLS-ROYCE HOLDINGS PLC ORD SH,"Rolls-Royce Holdings plc entwirft und verwaltet geschäftskritische Energiesysteme im Vereinigten Königreich und international. Das Unternehmen ist in drei Segmenten tätig: Zivile Luft- und Raumfahrt, Verteidigung und Energiesysteme. Das Segment Zivile Luft- und Raumfahrt entwickelt, produziert, vermarktet und verkauft Flugtriebwerke für große Verkehrsflugzeuge, Regionalflugzeuge und Geschäftsluftfahrtmärkte und bietet Aftermarket-Dienstleistungen an. Das Verteidigungssegment befasst sich mit der Entwicklung, Herstellung, Vermarktung und dem Verkauf von militärischen Flugmotoren, Schiffsmotoren und U-Boot-Kernkraftwerken und bietet Aftermarket-Dienstleistungen an. Das Segment Power Systems beschäftigt sich unter der Marke mtu mit der Entwicklung, Herstellung, Vermarktung und dem Vertrieb integrierter Lösungen für die Onsite-Stromversorgung und den Antrieb. Rolls-Royce Holdings plc wurde 1884 gegründet und hat seinen Hauptsitz in London, Vereinigtes Königreich.",20.408695,32.540726,0.166,0.041,0.27543,116751179776.0,0.18,0.97,0.94
Industrials,Aerospace,AIR.PA,189.4199981689453,217.28503984305604,154.56398910495966,AIRBUS SE,"Airbus SE beschäftigt sich zusammen mit seinen Tochtergesellschaften weltweit mit der Entwicklung, Herstellung und Lieferung von Produkten, Dienstleistungen und Lösungen für die Luft- und Raumfahrt. Das Unternehmen ist in drei Segmenten tätig: Airbus, Airbus Helicopters und Airbus Defence and Space. Das Segment Airbus entwickelt, produziert, vermarktet und verkauft Verkehrsflugzeuge für Passagierflugzeuge, Frachtflugzeuge, regionale Turboprop-Flugzeuge und Flugzeugkomponenten und bietet Flugzeugumrüstungen und damit verbundene Dienstleistungen an. Das Segment Airbus Helicopters entwickelt, produziert, vermarktet und verkauft zivile und militärische Hubschrauber; und bietet unbemannte Flugsysteme und die damit verbundenen Dienstleistungen an. Das Segment Airbus Defence and Space entwirft, entwickelt, liefert und unterstützt bemannte und unbemannte militärische Luftsysteme und damit verbundene Dienstleistungen. Dieses Segment bietet auch zivile und militärische Raumfahrtsysteme für Telekommunikation, Erdbeobachtung, Navigation sowie Wissenschaft und Orbitalsysteme an; und Dienstleistungen rund um die Datenverarbeitung von Plattformen, sichere Kommunikation und Cybersicherheit. Das Unternehmen hieß früher Airbus Group SE und änderte im April 2017 seinen Namen in Airbus SE. Das Unternehmen wurde 1998 gegründet und hat seinen Hauptsitz in Leiden, Niederlande.",29.87697,22.09812,-0.066,-0.265,0.06913,149116747776.0,0.2,0.56,0.11
Consumer & Retail,Luxury & Brands,MC.PA,499.25,643.802043116836,425.8698627878484,LVMH,"LVMH Moët Hennessy – Louis Vuitton, Société Européenne ist zusammen mit seinen Tochtergesellschaften weltweit als Luxusgüterunternehmen tätig. Es bietet Wein- und Spirituosenprodukte unter den Marken Ao Yun, Ardbeg, Armand de Brignac, Belvedere, Bodega Numanthia, Chandon, Cheval des Andes, Château Cheval Blanc, Château Galoupet, Château d'Yquem, Château d'Esclans, Cloudy Bay, Colgin Cellars, Dom Pérignon, Domaine des Lambrays, Eminente, Glenmorangie, Hennessy, Joseph Phelps, Krug, Mercier, Marken Minuty, Moët & Chandon, Newton Vineyard, Ruinart, SirDavis, Terrazas de los Andes, Veuve Clicquot, Volcan de mi Tierra und Woodinville; Mode- und Lederprodukte der Marken Barton Perreira, Berluti, Celine, Christian Dior, Fendi, Givenchy, Kenzo, Loewe, Loro Piana, Louis Vuitton, Marc Jacobs, Moynat, Patou, Pucci, Rimowa und Vuarnet; sowie Parfüme und Kosmetikprodukte der Marken Acqua di Parma, Benefit Cosmetics, Fenty Beauty by Rihanna, Fresh, Givenchy Parfums, Guerlain, Kenzo Parfums, Loewe Perfumes, Maison Francis Kurkdjian, Make Up For Ever, OLEHENRIKSEN, Officine Universelle Buly und Parfums Christian Dior. Das Unternehmen bietet außerdem Uhren und Schmuck unter den Marken Bvlgari, Chaumet, DANIEL ROTH, Fred, Gérald Genta, Hublot, L'Epée 1839, Repossi, TAG Heuer, Tiffany & Co. und Zenith an; und selektiver Einzelhandel unter den Marken 24S, DFS, La Grande Épicerie de Paris, Le Bon Marché Rive Gauche, Samaritaine und Sephora. Darüber hinaus bietet es unter der Gruppenmarke Les Echos französische Wirtschafts- und Kulturpublikationen an; maßgeschneiderte Yachten unter der Marke Feadship; Hotels unter den Marken Cheval Blanc und Belmond; und andere Aktivitäten unter den Marken Connaissance des Arts, Cova, Investir, Jardin d'Acclimatation, Le Parisien, Paris Match und Radio Classique. LVMH Moët Hennessy – Louis Vuitton, Société Européenne wurde 1365 gegründet und hat seinen Hauptsitz in Paris, Frankreich.",22.84897,19.488274,-0.047,-0.014,0.13462,246415933440.0,0.11,0.34,-0.33
Consumer & Retail,Luxury & Brands,RMS.PA,1721.5,2457.2395278079525,1517.280053539375,HERMES INTL,"Hermès International Société en commandite par actions beschäftigt sich mit der Produktion, dem Groß- und Einzelhandel verschiedener Waren. Das Unternehmen bietet Lederwaren und Sattlerwaren wie Taschen für Damen und Herren, Reiseartikel, Kleinlederwaren und Accessoires, Sättel, Zaumzeug sowie verschiedene Produkte und Bekleidung für den Reitsport an; Konfektionsbekleidung für Damen und Herren; und Accessoires, darunter Schmuck, Gürtel, Hüte, Handschuhe, Produkte für das Internet der Dinge und Schuhe. Darüber hinaus werden Seide und Textilien für Männer und Frauen angeboten. Kunst- und Tischkulturprodukte; Schönheits- und Parfümprodukte; und Uhren. Darüber hinaus ist das Unternehmen in den Bereichen Weben, Gravieren, Drucken, Färben, Veredeln und Herstellen von Textilien tätig; Kauf, Gerben, Färben, Veredeln und Verkauf von Gerbereien und Edelledern; und Herstellung und Produktion von Metallteilen. Das Unternehmen vertreibt seine Produkte über ein Filialnetz in Frankreich, im übrigen Europa, Japan, im asiatisch-pazifischen Raum, auf dem amerikanischen Kontinent und im Nahen Osten. Darüber hinaus verkauft es Uhren, Parfüms und Geschirr über ein Netz von Fachgeschäften. Das Unternehmen wurde 1837 gegründet und hat seinen Hauptsitz in Paris, Frankreich. Hermès International Société en commandite par actions ist eine Tochtergesellschaft von H51 SAS.",39.997677,33.353733,0.039,0.018,0.28271,180309573632.0,0.05,0.22,-0.57
Consumer & Retail,Luxury & Brands,CFR.SW,183.64999389648438,186.0,125.46450898117243,RICHEMONT N,"Compagnie Financière Richemont SA, eine Investmentholdinggesellschaft, ist im Luxusgütergeschäft tätig. Das Unternehmen ist in den Segmenten Schmuckhäuser, Spezialuhrmacher und Sonstige tätig. Das Unternehmen beschäftigt sich mit dem Design, der Herstellung und dem Vertrieb von Schmuckprodukten, Präzisionsuhren, Uhren, Schreibgeräten, Kleidung sowie Lederwaren und Accessoires. Das Unternehmen bietet seine Produkte unter den Marken Cartier, Van Cleef & Arpels, Vhernier, Buccellati, A. Lange & Söhne, Baume & Mercier, IWC Schaffhausen, Jaeger-LeCoultre, Panerai, Piaget, Roger Dubuis, Vacheron Constantin, Alaïa, Chloé, Delvaux, dunhill, G/FORE, Gianvito Rossi, Montblanc, Peter Millar, Purdey, Serapian, Watchfinder&Co., TIMEVALLEE und Markennamen über den Online-Einzelhandel und Großhandelsvertriebskanäle. Das Unternehmen bietet seine Produkte in Frankreich, dem Vereinigten Königreich, Italien, der Schweiz, dem übrigen Europa, den Vereinigten Arabischen Emiraten, dem übrigen Nahen Osten, Afrika, China, Hongkong, Macao, Japan, Südkorea, dem übrigen Asien, den Vereinigten Staaten und dem übrigen amerikanischen Kontinent an. Das Unternehmen wurde 1979 gegründet und hat seinen Hauptsitz in Bellevue, Schweiz.",33.946396,24.958405,0.042,-0.272,0.1554,107975229440.0,0.34,0.96,0.92
Consumer & Retail,Luxury & Brands,KER.PA,271.95001220703125,348.8751930543694,169.69003973815305,KERING,"Kering SA verwaltet die Entwicklung einer Sammlung renommierter Häuser in den Bereichen Mode, Lederwaren und Schmuck im asiatisch-pazifischen Raum, Westeuropa, Nordamerika, Japan und international. Das Unternehmen bietet Konfektionsprodukte, Accessoires und Schönheitsprodukte für Männer und Frauen an. Es bietet auch Lederwaren und Schuhe an; Uhren und Schmuck; Brillenprodukte; sowie Düfte und Kosmetika. Das Unternehmen bietet seine Produkte unter den Marken Gucci, Saint Laurent, Bottega Veneta, Balenciaga, Alexander McQueen, Brioni, Boucheron, Pomellato, DoDo, Qeelin und Ginori 1735 sowie unter den Marken Kering Eyewear und Kering Beauté an. Kering SA war früher als PPR SA bekannt. und änderte im Mai 2013 seinen Namen in Kering SA. Das Unternehmen wurde 1963 gegründet und hat seinen Sitz in Paris, Frankreich.",,27.69732,,,0.00491,33346226176.0,0.17,0.57,0.14
Consumer & Retail,Luxury & Brands,MONC.MI,52.84000015258789,57.72709756062137,44.17969211361888,MONCLER,"Moncler S.p.A. beschäftigt sich zusammen mit seinen Tochtergesellschaften mit der Produktion und dem Vertrieb von Bekleidung, Kinderbekleidung, Schuhen, Brillen und anderen zugehörigen Accessoires unter den Marken Moncler und Stone Island. Es bietet auch Lederwaren an; Taschen, Rucksäcke und Accessoires; und Brillen. Das Unternehmen ist über direkt betriebene Geschäfte, E-Konzessionen, Mehrmarken-Verkaufsstellen, Shop-in-Shops in Luxuskaufhäusern, Flughafenstandorten und Online-Einzelhändler für Luxusmehrmarken tätig. Das Unternehmen verkauft seine Produkte auch über moncler.com, einen Online-Shop. Das Unternehmen ist in Italien, dem übrigen Europa, Asien, dem Nahen Osten, Afrika und den Vereinigten Staaten tätig. Moncler S.p.A. wurde 1952 gegründet und hat seinen Hauptsitz in Mailand, Italien.",22.87446,20.30652,0.015,0.029,0.20007999,14371737600.0,0.04,0.64,0.28
Consumer & Retail,Food & Beverages,NESN.SW,78.77999877929688,81.72304028065018,67.15778239946611,NESTLE N,"Nestlé S.A. produziert und vertreibt zusammen mit seinen Tochtergesellschaften Lebensmittel und Getränke sowie ernährungswissenschaftliche Produkte in den Vereinigten Staaten, Brasilien, Mexiko, Großchina, den Philippinen, Indien, dem Vereinigten Königreich, Frankreich, Deutschland, der Schweiz und international. Das Unternehmen bietet Cerealien, Schokolade und Süßwaren, Kaffee, kulinarische, gekühlte und gefrorene Lebensmittel, Milchprodukte, Getränke, Gastronomie, Eiscreme, Ernährung und Gesundheit, Tierpflege, Wasser, pflanzliches Portfolio und Rezeptprodukte. Es verkauft seine Produkte unter den Marken Nesquik Cereal, Fitness, Cheerios, Lion Cereals, Cini Minis, KitKat Cereal, Chocapic, Koko Krunch, Shreddies, Shredded Wheat Original, Corn Flakes, Trix Cereal, Aero, Baci Perugina, KitKat, Milkybar, Smarties, Cailler, Quality Street, Garoto, Nestlé Toll House, Munch, Damak, Hsu Fu Chi, Sahne Nuss, Nachhaltig angebauter Kakao von Nestlé, Blue Bottle Coffee, Nescafé, Nescafé Dolce Gusto, Nespresso, Starbucks Coffee At Home, DiGiorno, Garden Gourmet, Maggi, Thomy, Stouffer's, Hot Pockets, Lean Cuisine, Life Cuisine, Buitoni, Nestlé Nelken, Nestlé Coffee Mate und Nestea. Das Unternehmen bietet seine Produkte auch unter den Marken Roastelier by Nescafé, Plant-based and so good!, Milo, Chef, Maggi Professional, La Lechera, Minor's, Antica Gelateria Del Corso, Drumstick, Extrême, Häagen-Dazs, Maxibon, Mövenpick, Nancare, Gerber, Cerelac, Nestum, Alfaré HMO, Athéra HMO, Alfamino HMO, Bear Brand, Nido, Orgain, Nestlé Vital, Garden of Life, Pure Encapsulations, Solgar, Compleat, Impact, Peptamen, Vitaflo, Resource, Cat Chow, Dentalife, Dog Chow, Fancy Feast, Felix, Friskies, Gourmet, Purina, Purina ONE, Purina Pro Plan, Purina Pro Plan Veterinary Diets, Acqua Panna, Nestlé Pure Life, Perrier, S.Pellegrino, Sanpellegrino, Buxton, Erikli, Marken Levissima, Vittel, Contrex, HENNIEZ, Hépar, La Vie, Naleczowianka und Essentia. Das Unternehmen wurde 1866 gegründet und hat seinen Hauptsitz in Vevey, Schweiz. Aimmune Therapeutics, Inc. ist eine Tochtergesellschaft von Nestlé S.A.",22.444445,16.787598,-0.022,-0.24,0.1005,202639474688.0,0.05,0.8,0.6
Mobility & Transport Tech,Electric Vehicles,BMW.DE,59.97999954223633,92.58111409007054,58.7599983215332,BAYERISCHE MOTOREN WERKE AG   S,"Die Bayerische Motoren Werke Aktiengesellschaft entwickelt, produziert und vertreibt weltweit Automobile und Motorräder, Ersatzteile und Zubehör. Das Unternehmen ist in den Segmenten Automobil, Motorräder und Finanzdienstleistungen tätig. Das Unternehmen bietet Automobile der Marken BMW, MINI und Rolls-Royce an. Darüber hinaus entwickelt, produziert und vertreibt das Unternehmen unter der Marke BMW Motorrad Motorroller und Motorräder für den Privatgebrauch sowie Sonderfahrzeuge für den betrieblichen Einsatz. Darüber hinaus bietet das Unternehmen Autovermietungen an; Kreditfinanzierung; Leasing, das Versicherungs- und Serviceprodukte umfasst; Finanzierung von Händler- und Kundeneinlagen; Fahrzeugflottenfinanzierungsdienstleistungen für Firmenwagenflotten unter der Marke Alphabet; und Finanzdienstleistungen für die Automobilbranche. Das Unternehmen vertreibt seine Produkte über Einzelhandelsgeschäfte, Vertreter und unabhängige Händler. Die Bayerische Motoren Werke Aktiengesellschaft wurde 1916 gegründet und hat ihren Hauptsitz in München, Deutschland.",5.360143,4.910613,-0.081,,0.05217,36415553536.0,-0.16,0.04,-0.93
Mobility & Transport Tech,Electric Vehicles,VOW3.DE,80.44000244140625,102.3232634007609,77.49006881472692,VOLKSWAGEN AG                 V,"Die Volkswagen AG produziert Automobile und Nutzfahrzeuge in Europa, Deutschland, Nordamerika, Südamerika, im asiatisch-pazifischen Raum und international. Das Unternehmen ist in drei Segmenten tätig: Personenkraftwagen und leichte Nutzfahrzeuge; Nutzfahrzeuge; und Finanzdienstleistungen. Das Segment Pkw und leichte Nutzfahrzeuge entwickelt Fahrzeuge, Motoren, Fahrzeugsoftware und Fahrzeugbatterien; produziert und vertreibt Personenkraftwagen und leichte Nutzfahrzeuge sowie deren Teile. In diesem Segment werden auch Kleinwagen, Luxusfahrzeuge und Motorräder sowie Mobilitätslösungen angeboten. Das Segment Nutzfahrzeuge beschäftigt sich mit der Entwicklung von Fahrzeugen, Motoren und Motoren; Produktion und Verkauf von Lastkraftwagen und Bussen, Teilen und damit verbundenen Dienstleistungen. Das Segment Finanzdienstleistungen ist in den Bereichen Händler- und Kundenfinanzierung, Leasing, Direktbanking und Versicherungen tätig. und Bereitstellung von Flottenmanagement- und Mobilitätsdiensten. Darüber hinaus ist das Unternehmen in den Bereichen Großdieselmotoren, Turbomaschinen und Antriebskomponenten tätig. Das Unternehmen vertreibt seine Produkte unter den Marken Volkswagen Pkw, Skoda, SEAT/CUPRA, Volkswagen Nutzfahrzeuge, Audi, Lamborghini, Bentley, Ducati, Porsche, Scania, MAN, Volkswagen Truck & Bus, TRATON und Bugatti Rimac sowie internationale Nutzfahrzeuge an Privat-, Firmen- und Flottenkunden. Das Unternehmen wurde 1937 gegründet und hat seinen Hauptsitz in Wolfsburg, Deutschland. Die Volkswagen AG fungiert als Tochtergesellschaft der Porsche Automobil Holding SE.",6.5880427,3.204135,-0.025,-0.295,0.0212,40324194304.0,0.0,0.12,-0.76
