Main Theme,Sub Theme,Ticker,Preis,52W High,52W Low,Name,Description,PE,Forward PE,Revenue Growth,Earnings Growth,Profit Margin,Market Cap,3M Momentum,1M Momentum,20D Momentum,MA50,MA200,MA50 Abstand,MA200 Abstand,Preis ueber MA50,Preis ueber MA200,Volume,Avg Volume,Volume Ratio,Trend Score,Momentum
AI / Tech,AI Compute,NVDA,194.8300018310547,236.26463268418732,157.1307137305003,NVIDIA Corporation,"Die NVIDIA Corporation ist als KI-Infrastrukturunternehmen im Rechenzentrumsmaßstab in den USA, Taiwan, China, Hongkong, Europa und international tätig. Das Unternehmen ist in den Segmenten Compute & Networking und Graphics tätig. Das Segment Compute & Networking bietet Rechenzentrums-beschleunigte Rechen- und Netzwerkplattformen sowie Lösungen und Software für künstliche Intelligenz sowie Automobilplattformen und Lösungen für autonome und elektrische Fahrzeuge, einschließlich Software. Das Grafiksegment bietet GeForce-GPUs für Spiele und PCs; Quadro/NVIDIA RTX-GPUs für Enterprise-Workstation-Grafiken. Die Produkte des Unternehmens werden in den Bereichen Gaming, professionelle Visualisierung, Rechenzentren und Automobil eingesetzt. Das Unternehmen verkauft seine Produkte an Erstausrüster, Originalgerätehersteller, Systemintegratoren und -vertreiber, unabhängige Softwareanbieter, Cloud-Service-Anbieter, Add-In-Board-Hersteller, Händler, Automobilhersteller und Tier-1-Automobilzulieferer sowie andere Ökosystemteilnehmer. Die NVIDIA Corporation wurde 1993 gegründet und hat ihren Hauptsitz in Santa Clara, Kalifornien.",29.83614,15.26351,0.852,2.145,0.62966,4718977351680.0,0.1,-0.09,-0.11,209.65,190.82,-0.07,0.02,False,True,142068700.0,157270100.0,0.9,0.48,-0.05
AI / Tech,AI Compute,MRVL,245.2899932861328,329.8800048828125,61.32450038161137,"Marvell Technology, Inc.","Marvell Technology, Inc. bietet zusammen mit seinen Tochtergesellschaften Dateninfrastruktur-Halbleiterlösungen vom Rechenzentrumskern bis zum Netzwerkrand in den Vereinigten Staaten, Argentinien, China, Indien, Israel, Japan, Singapur, Südkorea, Taiwan, Vietnam und international. Das Unternehmen entwickelt und skaliert System-on-a-Chip-Architekturen und integriert analoge, Mixed-Signal- und digitale Signalverarbeitungsfunktionen. Es bietet ein Portfolio an Ethernet-Lösungen, darunter Spanning-Controller, Netzwerkadapter, physische Transceiver und Switches; Einzel- oder Mehrkernprozessoren; und kundenspezifische anwendungsspezifische integrierte Schaltkreise, Verbindungen, Fibre-Channel-Adapter und Prozessoren. Das Unternehmen bietet auch Verbindungsprodukte an, darunter Pulsamplitudenmodulation, kohärente und kohärente digitale Signalprozessoren (DSPs), Lasertreiber, Transimpedanzverstärker, Siliziumphotonik, gemeinsam verpackte Optik, linear steckbare optische Chipsätze, Rechenzentrumsverbindungen, aktive elektrische Kabel-DSPs und Express-Retimer-Lösungen für die Verbindung von Peripheriekomponenten; Fibre-Channel-Produkte, bestehend aus Host-Bus-Adaptern und Controllern für die Konnektivität von Servern und Speichersystemen; Speichercontroller für Festplattenlaufwerke und Solid-State-Laufwerke; Hostsystemschnittstellen, einschließlich Serial-Advanced-Technology-Anbindung und Serial-Attached-SCSI, Peripheral Component Interconnect Express, Compute Express Link Switches, Non-Volatile Memory Express (NVMe) und NVMe over Fabrics; und entwickelt Ultra Accelerator LinkTM-Switches und Ethernet für Scale-up-Netzwerk-Switches. Das Unternehmen bedient Rechenzentren, Kommunikation und andere Märkte. Es bietet seine Produkte über Direktkunden und Händler an. Marvell Technology, Inc. wurde 1995 gegründet und hat seinen Hauptsitz in Wilmington, Delaware.",84.00342,39.7043,0.276,-0.804,0.28986,214764421120.0,1.29,-0.19,-0.22,223.63,122.57,0.1,1.0,True,True,38435900.0,64171385.0,0.6,0.69,0.37
AI / Tech,AI Compute,AVGO,360.45001220703125,494.21781760890264,267.6191060163645,Broadcom Inc.,"Broadcom Inc. entwirft, entwickelt und liefert international verschiedene Halbleitergeräte und Infrastruktursoftwarelösungen. Das Unternehmen ist in zwei Segmenten tätig: Halbleiterlösungen und Infrastruktursoftware. Das Unternehmen bietet Netzwerkkonnektivität, wie kundenspezifische Siliziumlösungen, Ethernet-Switching und -Routing, Ethernet-NIC-Controller, Geräte der physikalischen Schicht und Glasfaserkomponenten; drahtlose Gerätekonnektivität, einschließlich HF-Halbleitergeräte, Konnektivitätslösungen, kundenspezifische Touch-Controller und induktives Laden von ASICS; Server und Speichersystemlösungen, wie PCIE-Switches, SAS- und RAID-Produkte, Fibre-Channel-Produkte sowie HDD- und SSD-Lösungen; Breitbandlösungen, einschließlich Set-Top-Box und Breitbandzugang; und industriell. Das Unternehmen bietet außerdem ein privates Cloud-Softwareportfolio an, darunter VMware Cloud Foundation, Edge, vSphere Foundation, Telekommunikations-Cloud-Plattform, private KI, Live-Wiederherstellung, Anwendungsnetzwerke und -sicherheit, Anwendungsentwicklung und Datendienste. Mainframe-Software, wie AIOPS und Automatisierung, Datenbank- und Datenmanagement, DEVX und DEVOPS, Cybersicherheit und Compliance-Management, Beyond-Code-Programme, grundlegende und offene Mainframe-Lösungen; Cybersicherheit, wie Endpunkt-, Netzwerk-, Informations-, Anwendungssicherheit sowie Identitäts- und Zugriffsmanagement; Unternehmenssoftware; und FC San Management. Seine Produkte werden in verschiedenen Anwendungen in der Vernetzung von Unternehmen und Rechenzentren eingesetzt, darunter Vernetzung und Konnektivität mit künstlicher Intelligenz, Heimkonnektivität, Set-Top-Boxen, Breitbandzugang, Telekommunikationsausrüstung, drahtlose Geräte und Basisstationen, Server und Speichersysteme für Rechenzentren, Fabrikautomation, Stromerzeugungs- und alternative Energiesysteme sowie elektronische Displays. Broadcom Inc. wurde 1961 gegründet und hat seinen Hauptsitz in Palo Alto, Kalifornien.",59.875416,18.583939,0.479,0.854,0.38848,1714869895168.0,0.15,-0.25,-0.14,408.89,360.2,-0.12,0.0,False,True,26749500.0,35360260.0,0.76,0.41,-0.18
AI / Tech,AI Compute,INTC,120.3499984741211,142.35000610351562,18.969999313354492,Intel Corporation,"Die Intel Corporation entwirft, entwickelt, produziert, vermarktet, verkauft und wartet Computer- und damit verbundene Endprodukte und Dienstleistungen in den Vereinigten Staaten, Irland, Israel und international. Das Unternehmen ist in drei Segmenten tätig: CCG, DCAI und Intel Foundry. Das Unternehmen bietet Produkte für Client-Computing-Gruppen an, darunter Client- und kommerzielle CPUs, diskrete Client-GPUs, Edge-Computing und Konnektivitätsprodukte. Rechenzentrums- und KI-Produkte wie Server-CPUs, diskrete GPUs und Netzwerkprodukte; und Halbleiter, einschließlich Waferherstellung, Substrate und andere damit verbundene Produkte und Dienstleistungen. Es bietet auch Fahrassistenz- und Selbstfahrlösungen; und entwickelt und produziert Mehrstrahl-Maskenschreibgeräte. Das Unternehmen vertreibt seine Produkte über Vertriebsorganisationen, Distributoren, Wiederverkäufer, Einzelhändler und OEM-Partner. Es bedient Erstausrüster, Hersteller von Originaldesigns, Cloud-Dienstanbieter und andere Hersteller und Dienstanbieter. Die Intel Corporation arbeitet strategisch mit Infosys Limited zusammen, um eine mehrschichtige KI-Struktur zu entwickeln, die Infrastruktur, Modelle, Daten, Anwendungen und Arbeitsabläufe in einem zusammensetzbaren und agentenbereiten Ökosystem vereint. Das Unternehmen wurde 1968 gegründet und hat seinen Hauptsitz in Santa Clara, Kalifornien.",,77.05605,0.072,,-0.05904,604879060992.0,1.39,0.07,0.08,113.38,60.33,0.06,0.99,True,True,124577600.0,131819850.0,0.95,0.82,0.64
AI / Tech,AI Compute,TSM,434.1600036621094,479.0,221.25304655666736,Taiwan Semiconductor Manufactur,"Taiwan Semiconductor Manufacturing Company Limited produziert, verpackt, testet und verkauft zusammen mit seinen Tochtergesellschaften integrierte Schaltkreise und andere Halbleiterbauelemente in Taiwan, China, Europa, dem Nahen Osten, Afrika, Japan, den Vereinigten Staaten und international. Es bietet verschiedene Wafer-Herstellungsprozesse, beispielsweise Prozesse zur Herstellung komplementärer Metalloxid-Halbleiter-Logik (CMOS), Mixed-Signal, Hochfrequenz, eingebetteter Speicher, bipolarer CMOS-Mixed-Signal und andere. Das Unternehmen ist auch an der Bereitstellung von Kunden- und technischen Supportdienstleistungen beteiligt; Herstellung von Masken; Investitionen in Technologie-Start-up-Unternehmen; Forschung, Design, Entwicklung, Herstellung, Verpackung, Prüfung und Verkauf von Farbfiltern; und Investitionstätigkeit. Seine Produkte werden in den Bereichen Hochleistungsrechnen, Smartphones, Internet der Dinge, Automobil und digitale Unterhaltungselektronik eingesetzt. Taiwan Semiconductor Manufacturing Company Limited wurde 1987 gegründet und hat seinen Hauptsitz in der Stadt Hsinchu, Taiwan.",37.72024,21.398586,0.351,0.584,0.46505,2251759550464.0,0.28,-0.0,-0.02,418.83,342.51,0.04,0.27,True,True,18375000.0,15146125.0,1.21,0.83,0.65
AI / Tech,AI Compute,ARM,315.2799987792969,452.70001220703125,100.0199966430664,Arm Holdings plc,"Arm Holdings plc erforscht, entwickelt, lizenziert und vermarktet geistiges Eigentum (IP) der Zentraleinheit (CPU), IP der Grafikverarbeitungseinheit, System-IP, Rechensubsysteme (CSS) sowie zugehörige Software, Tools und zugehörige Dienstleistungen. Das Unternehmen bietet ein Produktportfolio, das CPU-IP, GPU- und NPU-Beschleuniger (Neural Processing Unit), System-IP wie Verbindungen, Rechenplattformprodukte einschließlich vorintegrierter CSSs sowie Entwicklungstools und Software umfasst. Das Unternehmen beliefert Halbleiterunternehmen, Originalgerätehersteller (OEMs), Cloud-Service-Provider (CSPs) und Organisationen, die Chips für Endmärkte wie Smartphones, Unterhaltungselektronik, industrielles IoT, eingebettete Systeme, Cloud-Rechenzentren, Netzwerke, Automobil und Robotik entwickeln. Das Unternehmen bietet seine Produkte und Dienstleistungen in den Vereinigten Staaten, China, Japan, Taiwan, Korea und international an. Das Unternehmen wurde 1990 gegründet und hat seinen Sitz in Cambridge, Großbritannien. Arm Holdings plc ist eine Tochtergesellschaft der SoftBank Group Corp.",370.91763,102.33274,0.201,0.479,0.18374,336743890944.0,1.11,-0.23,-0.2,298.72,177.17,0.06,0.78,True,True,7553900.0,11326115.0,0.67,0.61,0.22
AI / Tech,AI Compute,SMCI,27.219999313354492,62.36000061035156,19.479999542236328,"Super Micro Computer, Inc.","Super Micro Computer, Inc. entwickelt und vertreibt zusammen mit seinen Tochtergesellschaften Server- und Speicherlösungen auf Basis einer modularen und offenen Standardarchitektur in den USA, Asien, Europa und international. Das Unternehmen bietet flüssigkeits- und luftgekühlte KI-Server für Training und Inferenz mit integrierten Grafikprozessoren (GPUs) oder PCIe-basierten Architekturen; SuperBlade-, MicroBlade-, FlexTwin-, GrandTwin- und BigTwin-Blade- und Multi-Node-Systeme; SuperStorage-Systeme; Hyper-, CloudDC- und WIO- und Rackmount-Systeme; eingebettete (5G/IoT/Edge) Systeme; und MicroCloud-Serversysteme. Es bietet auch Workstations und Netzwerkgeräte; und modulare Serversubsysteme und Zubehör, einschließlich Serverplatinen, Gehäuse, Netzteile und anderes Zubehör. Darüber hinaus bietet das Unternehmen Remote-Systemverwaltungslösungen an, beispielsweise die Server Management Suite bestehend aus Supermicro Server Manager, Supermicro Power Management-Software, Supermicro Update Manager, SuperCloud Composer und SuperDoctor 5. Darüber hinaus ermittelt das Unternehmen Serviceanforderungen; erstellt und führt Projektpläne aus; führt Verifizierungstests durch; bietet Schulungen an; und stellt technische Dokumentation bereit. Darüber hinaus bietet es Dienstleistungen auf Rack-Ebene vom Entwurf bis zur Bereitstellung für vollständige Bereitstellungen von KI- und HPC-Rechenzentren auf Rack- und Cluster-Ebene. Helpdesk-Dienste und Produktsupport vor Ort; und Garantien, Wartung und technische Supportleistungen. Das Unternehmen beliefert Unternehmens-Rechenzentren, Cloud Computing, künstliche Intelligenz, 5G und Edge-Computing-Märkte über direkte und indirekte Vertriebsmitarbeiter, Distributoren, Wiederverkäufer, Systemintegratoren und Originalgerätehersteller. Super Micro Computer, Inc. wurde 1993 gegründet und hat seinen Hauptsitz in San Jose, Kalifornien.",14.326316,8.582392,1.227,3.26,0.03701,17607882752.0,0.17,-0.43,-0.42,33.46,35.02,-0.19,-0.22,False,False,42742400.0,75412070.0,0.57,0.18,-0.64
AI / Tech,AI Compute,ASML,1769.3199462890625,1999.9599609375,679.8857573557855,ASML Holding N.V. - New York Re,"ASML Holding N.V. bietet Lithografielösungen für die Entwicklung, Produktion, Vermarktung, den Verkauf, die Modernisierung und Wartung fortschrittlicher Halbleiterausrüstungssysteme. Das Unternehmen bietet Lithographie-, Mess- und Inspektionssysteme an. Es bietet auch extreme Ultraviolett-Lithographiesysteme; und Tief-Ultraviolett-Lithographiesysteme, die Systemlösungen für Immersions- und Trockenlithographie zur Herstellung verschiedener Halbleiterknoten und -technologien umfassen. Darüber hinaus bietet das Unternehmen Mess- und Inspektionssysteme an, darunter die optischen Messsysteme YieldStar, eine beugungsbasierte Wafer-Messplattform zur Beurteilung der Qualität von Mustern auf den Wafern; und HMI-Elektronenstrahllösungen zur Lokalisierung und Analyse einzelner Chipdefekte. Darüber hinaus bietet es rechnergestützte Lithografielösungen sowie Lithografiesysteme und Steuerungssoftwarelösungen. und renoviert und aktualisiert Lithographiesysteme und bietet Kundensupport und damit verbundene Dienstleistungen an. Darüber hinaus bietet das Unternehmen Chipherstellern Hardware, Software und Dienstleistungen zur Herstellung von Mustern für integrierte Schaltkreise an. Das Unternehmen ist in Japan, Südkorea, Singapur, Taiwan, China, dem übrigen Asien, den Niederlanden, dem übrigen Europa, dem Nahen Osten, Afrika und den Vereinigten Staaten tätig. Das Unternehmen war früher als ASM Lithography Holding N.V. bekannt und änderte seinen Namen im Jahr 2001 in ASML Holding N.V.. ASML Holding N.V. wurde 1984 gegründet und hat seinen Hauptsitz in Veldhoven, Niederlande.",60.24242,35.813248,0.132,0.192,0.29713,681927180288.0,0.35,0.02,0.01,1646.96,1311.8,0.07,0.35,True,True,2699100.0,2409235.0,1.12,0.83,0.65
AI / Tech,AI Compute,KLAC,235.5500030517578,307.3699951171875,82.87100394695247,KLA Corporation,"Die KLA Corporation entwickelt, fertigt und vermarktet zusammen mit ihren Tochtergesellschaften Prozesssteuerungs-, Prozessaktivierungs- und Ertragsmanagementlösungen für die Halbleiter- und verwandte Elektronikindustrie weltweit. Das Unternehmen ist in drei Segmenten tätig: Halbleiterprozesskontrolle; Spezialhalbleiterprozess; und Leiterplatten- und Komponenteninspektion. Es bietet Inspektions- und Überprüfungswerkzeuge zum Identifizieren, Lokalisieren, Charakterisieren, Überprüfen und Analysieren von Defekten auf verschiedenen Oberflächen strukturierter und unstrukturierter Wafer. Messsysteme zur Messung von Musterabmessungen, Filmdicke, Filmspannung, Schicht-zu-Schicht-Ausrichtung, Musterplatzierung, Oberflächentopographie und elektrooptischen Eigenschaften für Wafer; Ausrüstung zur Steuerung chemischer Prozesse; drahtgebundene und drahtlose Sensorwafer und Retikel; Wafer-Defektinspektions-, Überprüfungs- und Messsysteme; Retikelinspektions- und Messsysteme; Wafer-Inspektion und Messsysteme; und Halbleiter-Softwarelösungen, die eine Laufzeit-Prozesskontrolle, Fehlerabweichungserkennung, Prozesskorrekturen und Fehlerklassifizierung ermöglichen, um die Ertragslernraten zu beschleunigen und das Produktionsrisiko zu reduzieren. Das Unternehmen bietet außerdem Ätz-, Plasma-Dicing-, Abscheidungs- und andere Waferverarbeitungstechnologien und -lösungen für die Halbleiter- und Mikroelektronikindustrie an. Darüber hinaus bietet es Direktbildgebung, Inspektion, optische Formgebung, Tintenstrahl- und additives Drucken sowie computergestützte Fertigungs- und Engineering-Lösungen für den PCB-Markt sowie Inspektions- und Messsysteme zur Qualitätskontrolle und Ertragsverbesserung in fortschrittlichen und traditionellen Halbleiterverpackungsmärkten. Das Unternehmen war früher als KLA-Tencor Corporation bekannt und änderte seinen Namen im Juli 2019 in KLA Corporation. Die KLA Corporation wurde 1975 gegründet und hat ihren Hauptsitz in Milpitas, Kalifornien.",66.72805,46.453976,0.115,0.118,0.35661998,307693125632.0,0.55,0.11,0.11,208.72,151.7,0.13,0.55,True,True,23622500.0,16404565.0,1.44,0.68,0.36
AI / Tech,AI Compute,MU,975.5599975585938,1255.0,103.23020834677516,"Micron Technology, Inc.","Micron Technology, Inc. entwirft, entwickelt, produziert und vertreibt Speicher- und Speicherprodukte in den Vereinigten Staaten, Taiwan, Japan, Festlandchina, Hongkong, Europa und international. Das Unternehmen ist über die Cloud Memory Business Unit tätig. Kerngeschäftseinheit Rechenzentrum; Geschäftseinheit Mobile und Client; sowie die Segmente Automotive und Embedded Business Unit. Das Unternehmen bietet Speicherprodukte an, darunter dynamische Direktzugriffsspeicherkomponenten und -module, CXL-basierten Speicher, LPDDR-Komponenten und -Module, Grafikspeicher, Speicher mit hoher Bandbreite und Speicherprodukte für Rechenzentren. Multichip-Pakete (MCP), bestehend aus eingebetteten MCPs auf Multimediakartenbasis, Universal-Flash-Speicherbasis und NAND-basierten MCPs; und technologisch führende Produkte, die 1-jährige DRAM- und G9-NAND-Technologien umfassen. Darüber hinaus werden Speicherprodukte wie Solid-State-Laufwerke (SSD) für Rechenzentren, SSD-Speicher für Clients sowie SSD-Speicher für Autos und Industrien angeboten. verwaltetes NAND; NAND-Flash; NOR-Blitz; und Speicherkarten. Darüber hinaus stellt das Unternehmen Designtools bereit, darunter FBGA- und Teiledecoder; DRAM-Leistungsrechner; NAND-Leistungsrechner; Simulationsmodelle; Anleitungen zur Chipsatz-Kompatibilität; serielle Tools zur Anwesenheitserkennung; Querverweis-Tools; UFSparm; SSD-Firmware; Software und Treiber; Speicherverwaltungssoftware; und veraltete Teilekataloge. Das Unternehmen vermarktet seine Halbleiterspeicher- und Speicherprodukte unter den Marken Micron und Crucial. Das Unternehmen bedient die Rechenzentrums-, PC-, Grafik-, Netzwerk-, Automobil-, Industrie- und Consumer-Embedded-Märkte sowie die Märkte für Smartphones und andere mobile Geräte. Das Unternehmen vertreibt seine Produkte über sein Direktvertriebsteam, unabhängige Handelsvertreter, Großhändler und Einzelhändler. webbasierter Direktvertriebskanal für Kunden; sowie Vertriebs- und Vertriebspartner. Micron Technology, Inc. wurde 1978 gegründet und hat seinen Hauptsitz in Boise, Idaho.",22.076488,6.519448,3.457,13.685,0.55906,1101790838784.0,1.66,-0.1,-0.02,852.09,444.22,0.14,1.2,True,True,61316900.0,59163880.0,1.04,0.76,0.51
AI / Tech,AI Compute,000660.KS,2425000.0,2987000.0,243980.453125,SK hynix,"SK hynix Inc. betreibt über seine Tochtergesellschaften Forschung, Entwicklung, Herstellung, Vertrieb und Verkauf von Halbleiterbauelementen in Korea, China, dem übrigen Asien, den Vereinigten Staaten, Europa und international. Es bietet DRAM, wie Serverspeicher, Grafikspeicher, mobiler Speicher, PC-Speicher, Verbraucherspeicher; NAND-Flash-Speicher; SSD; und MCP-Produkte. Darüber hinaus ist das Unternehmen im Gießereigeschäft tätig und produziert Nicht-Speicher-Halbleiter. Das Unternehmen bietet seine Produkte für Server-, Netzwerk-, Mobil-, Personalcomputer-, Verbraucher- und Automobilanwendungen an. Das Unternehmen war früher als Hynix Semiconductor Inc. bekannt und änderte seinen Namen im März 2012 in SK hynix Inc.. SK hynix Inc. wurde 1949 gegründet und hat seinen Hauptsitz in Icheon-si, Südkorea.",,5.4893136,1.981,3.966,0.5689,1721398196174848.0,1.92,0.17,0.27,2046908.13,1027839.74,0.18,1.36,True,True,7984914.0,5721853.0,1.4,0.8,0.59
AI / Tech,AI Compute,005930.KS,309500.0,374500.0,59519.47572175083,SamsungElec,"Samsung Electronics Co., Ltd. ist weltweit in den Bereichen Unterhaltungselektronik, Informationstechnologie und Mobilkommunikation sowie Gerätelösungen tätig. Das Unternehmen ist in vier Geschäftsbereichen tätig: Device eXperience (DX), Device Solutions (DS), SDC und Harman. Das Unternehmen bietet Smartphones, Tablets, Audio-Sounds, Uhren, Schalter und Zubehör; Fernseher und Tongeräte; Geräte, einschließlich Kühlschränke, Waschmaschinen und Trockner, Staubsauger, Kochgeräte, Geschirrspüler, Klimaanlagen und Luftreiniger; Monitore und Speicherprodukte; Displays sowie intelligente und LED-Beschilderungen; und anderes Zubehör. Darüber hinaus ist das Unternehmen in den Bereichen Risikokapitalinvestitionen, Cloud-Dienste, Installation von Netzwerkgeräten, Dienstleistungen für Halbleiterausrüstung, digitale Werbeplattformen, Marketing, Beratung, Anbieter vernetzter Dienste, Logistik, Finanzierung und Softwaredesign tätig. Darüber hinaus bietet das Unternehmen Lohnverarbeitung und Vertrieb von Halbleitern und Anzeigetafeln an; Entwicklung und Verkauf von Netzwerklösungen; Herstellung von Halbleitern und Lebensmitteln; die Erbringung von Reparaturdienstleistungen für elektronische Geräte; und Entwicklung und Lieferung von Software zur Fehler- und Qualitätskontrolle bei Halbleiterprozessen sowie von digitalen Fernsehgeräten, Gießereien und System-Großintegration (LSI). Darüber hinaus bietet das Unternehmen vernetzte Fahrzeugsysteme, Audio- und Videoprodukte, Unternehmensautomatisierungslösungen und vernetzte Dienste. Samsung Electronics Co., Ltd. wurde 1969 gegründet und hat seinen Sitz in Suwon-si, Südkorea.",,4.8738546,0.692,4.921,0.21459,2032351412486144.0,0.73,-0.06,0.05,296350.0,175546.93,0.04,0.76,True,True,31520538.0,30704080.0,1.03,0.79,0.59
AI / Tech,AI Compute,AMD,517.8200073242188,584.72998046875,133.5,"Advanced Micro Devices, Inc.","Advanced Micro Devices, Inc. ist als Halbleiterunternehmen international tätig. Das Unternehmen ist in drei Segmenten tätig: Rechenzentrum, Client und Gaming sowie Embedded. Das Unternehmen bietet Beschleuniger, Mikroprozessoren und Grafikprozessoren (GPUs) für künstliche Intelligenz (KI) als eigenständige Geräte oder integriert in beschleunigte Verarbeitungseinheiten, Chipsätze sowie Rechenzentrums- und professionelle GPUs an; und eingebettete Prozessoren und semi-kundenspezifische System-on-Chip (SoC)-Produkte, Mikroprozessor- und SoC-Entwicklungsdienstleistungen und -technologie, Datenverarbeitungseinheiten, Field Programmable Gate Arrays (FPGA), System-on-Modules, KI-Netzwerkschnittstellenkarten und adaptive SoC-Produkte. Es bietet Prozessoren der Marken AMD Ryzen, AMD Ryzen AI, AMD Ryzen PRO, AMD Ryzen Threadripper, AMD Ryzen Threadripper PRO, AMD Athlon und AMD PRO A-Series; Grafiken unter der AMD Radeon-Grafik und der AMD Embedded Radeon-Grafik; professionelle Grafik unter der Grafikmarke AMD Radeon Pro; und KI und allgemeine Recheninfrastruktur für Hyperscale-Anbieter. Das Unternehmen bietet Rechenzentrumsgrafiken unter den Marken AMD Instinct Beschleuniger und Radeon PRO V-Serie an; Server-Mikroprozessoren unter der Marke AMD EPYC; Low-Power-Lösungen unter den Marken AMD Athlon, AMD Geode, AMD Ryzen, AMD EPYC und AMD R-Series und G-Series; FPGA-Produkte der Marken Virtex-6, Virtex-7, Virtex UltraScale+, Kintex-7, Kintex UltraScale, Kintex UltraScale+, Artix-7, Artix UltraScale+, Spartan-6 und Spartan-7; adaptive SOCs unter den Marken Zynq-7000, Zynq UltraScale+ MPSoC, Zynq UltraScale+ RFSoCs, Versal HBM, Versal Premium, Versal Prime, Versal AI Core, Versal AI Edge, Vitis und Vivado; sowie Rechen- und Netzwerkbeschleunigungskartenprodukte unter den Marken Alveo und Pensando. Es bedient Erstausrüster und Designhersteller, Anbieter öffentlicher Cloud-Dienste, Systemintegratoren, Distributoren und Hersteller von Add-in-Boards. Das Unternehmen wurde 1969 gegründet und hat seinen Hauptsitz in Santa Clara, Kalifornien.",172.60667,39.297142,0.378,0.912,0.13374,844357632000.0,1.38,-0.05,-0.01,460.38,278.19,0.12,0.86,True,True,28142500.0,32082065.0,0.88,0.85,0.7
