Main Theme,Sub Theme,Ticker,Preis,52W High,52W Low,Name,Description,PE,Forward PE,Revenue Growth,Earnings Growth,Profit Margin,Market Cap,3M Momentum,Trend Score,Momentum
AI / Tech,Photonics,SIVE.ST,96.0,110.0,2.8499999046325684,Sivers Semiconductors AB,"Sivers Semiconductors AB (publ) entwickelt, produziert und vertreibt über seine Tochtergesellschaften Chips, Komponenten, Module und Subsysteme in Nordamerika, Europa und Asien. Das Unternehmen ist in den Segmenten Wireless und Photonics tätig. Es bietet Produkte auf Basis der Halbleitertechnologie für 5G-mmWave-Netzwerke sowie optische Halbleiter für Glasfasernetzwerke, drahtlose optische Netzwerke und Sensoren. Darüber hinaus bietet das Unternehmen integrierte Hochfrequenzschaltkreise, Evaluierungskits und 5G-RFICs für verschiedene Anwendungen an, wie z. B. festen drahtlosen Zugang, 5G Open RAN, Radar, Zugverfolgung und Satellitenkommunikation. Darüber hinaus III-V-Verbindungshalbleiterlaser für optische Kommunikation, Erfassung/Sensoren und drahtlose Netzwerke. Sivers Semiconductors AB (publ) hat eine Partnerschaftsvereinbarung mit LioniX International zur Entwicklung der Lasertechnologie. Darüber hinaus besteht eine strategische Partnerschaft mit O-Net Technologies und Enablence Technologies Inc. zur Entwicklung eines fortschrittlichen externen Lichtquellenmoduls für KI-Rechenzentren und HPC-Systeme; Tachyon Networks Inc. für die Entwicklung von 28-GHz- und 60-GHz-mmWave-Transceivern für den Markt für festen drahtlosen Zugang; und mit GLOBALFOUNDRIES Inc. zur Entwicklung von Silizium-Photonik-Lösungen für den KI-Infrastrukturmarkt. Das Unternehmen wurde 1951 gegründet und hat seinen Sitz in Kista, Schweden.",,-480.0,-0.215,,-0.74379,28360179712.0,9.76,0.87,0.74
AI / Tech,Photonics,IQE.L,50.79999923706055,72.9000015258789,4.65500020980835,IQE PLC ORD 1P,"IQE plc entwickelt, produziert und vertreibt zusammen mit seinen Tochtergesellschaften fortschrittliche Halbleitermaterialien. Das Unternehmen ist in drei Segmenten tätig: Wireless, Photonics und CMOS++. Das Unternehmen produziert und vertreibt Verbindungshalbleitermaterialien für den Mobilfunkmarkt, zu dem Hochfrequenzgeräte für die drahtlose Kommunikation gehören, sowie für den Photonikmarkt, zu dem Anwendungen gehören, die sichtbares und infrarotes Licht übertragen und erfassen. Es bietet auch fortschrittliche Halbleitermaterialien im Zusammenhang mit Silizium an. Das Unternehmen ist in den Vereinigten Staaten, dem übrigen amerikanischen Kontinent, Frankreich, Deutschland, Israel, dem Vereinigten Königreich, dem übrigen Europa, dem Nahen Osten, Afrika, der Volksrepublik China, Japan, Taiwan und dem übrigen asiatisch-pazifischen Raum tätig. Das Unternehmen wurde 1988 gegründet und hat seinen Hauptsitz in Cardiff, Großbritannien.",,-112.88889,0.001,,-0.37713,670891264.0,1.22,0.68,0.35
AI / Tech,Semiconductor Equipment,AIXA.DE,59.84000015258789,62.65999984741211,11.641035044555371,AIXTRON SE                    N,"Die AIXTRON SE produziert und vertreibt zusammen mit ihren Tochtergesellschaften Depositionsanlagen für die Halbleiterindustrie in Asien, Europa und den Vereinigten Staaten. Das Unternehmen bietet G10-SiC, G10-GaN, G10-AsP, AIX G5+ C, Closed Coupled Showerhead-Systeme für Forschung und Entwicklung, AIX 2800G4-TM und AIX G5 WW C an. Darüber hinaus entwickelt, produziert und installiert es Geräte für die Abscheidung von Halbleitermaterialien; und bietet Abscheidungsprozesse, Beratung, Schulung, Kundensupport und andere damit verbundene Dienstleistungen sowie Peripheriegeräte und Dienstleistungen zur Unterstützung des Betriebs seiner Systeme an. Darüber hinaus beschäftigt sich das Unternehmen mit der Lieferung von Depositionsanlagen für die Massenproduktion; sowie Forschungs- und Entwicklungsaktivitäten sowie Vorserienproduktionsaktivitäten. Seine Produkte werden in den Bereichen Laser, LED, Anzeigetechnologien, optische Datenübertragung, SiC- und GaN-Leistungselektronik und anderen Anwendungen eingesetzt. Die AIXTRON SE wurde 1983 gegründet und hat ihren Hauptsitz in Herzogenrath, Deutschland.",112.90567,47.478497,-0.472,,0.11563,6749105664.0,0.81,0.94,0.89
AI / Tech,Semiconductor Equipment,SMHN.DE,111.69999694824219,113.9000015258789,23.990199211608104,SUSS MicroTec SE              N,"Die SÜSS MicroTec SE entwickelt, produziert, vermarktet und wartet zusammen mit ihren Tochtergesellschaften Systeme zur Herstellung von Mikroelektronik, mikroelektromechanischen Systemen und verwandten Anwendungen. Das Unternehmen ist in zwei Geschäftsbereichen tätig: Advanced Backend Solutions und Photomask Solutions. Das Unternehmen bietet Maskenausrichter, Beschichter und Entwickler, UV-Projektionsscanner sowie temporäre und permanente Bonder für fortschrittliche Verpackungen, mikroelektromechanische Systeme, Verbindungshalbleiter und 3D-Integrationsmärkte. Darüber hinaus bietet das Unternehmen spezielle Systeme zur Reinigung und Bearbeitung von Fotomasken für die Halbleiterindustrie an. Das Unternehmen ist in Europa, im Nahen Osten, in Afrika, Nordamerika und im asiatisch-pazifischen Raum tätig. Das Unternehmen wurde 1949 gegründet und hat seinen Hauptsitz in Garching bei München, Deutschland.",60.378376,32.533443,-0.307,-0.852,0.06877,2135205504.0,0.93,0.98,0.95
AI / Tech,Semiconductor Materials,SOI.PA,118.5,200.5,22.6200008392334,SOITEC,"Soitec SA entwickelt und produziert Halbleitermaterialien in Asien, Europa und den Vereinigten Staaten. Das Unternehmen bietet CONNECT Radio Frequency Silicon-on-Insulator für Smartphone-Frontend-Module an; CONNECT FD SOI für technische Untergründe; CONNECT Piezoelektrische-auf-Isolator-HF-Filter für Smartphones; und CONNECT RF Galliumnitrid, das die Effizienz des Frequenzsystems und die Leistungsdichte von 5G-Mobilfunkinfrastrukturen und Mobilgeräten im Sub-6-GHz- und mmWave-Band der nächsten Generation erhöht. Darüber hinaus bietet das Unternehmen Auto Power-SOI-Produkte für den Automobil- und Industriemarkt an. Auto Smartsic zur Kostenoptimierung von Elektrofahrzeugen und Industrieanwendungen; und Photonics SOI, das photonische Komponenten auf einem Silizium-auf-Isolator-Substrat (SOI) integriert, um die optischen Kommunikationsfähigkeiten zu verbessern; sowie AUTO FD-SOI für Automotive-Radar und -Prozessoren. Darüber hinaus bietet das Unternehmen Imager-SOI an, eine kompakte Lösung für hochauflösende 3D-Bilder und kleinen Formfaktor; PD-SOI bietet komplexe Rechenfähigkeiten und Funktionalitäten im Bereich Cloud Computing und Netzwerkausrüstung; FD-SOI-Technologie, die das optimale Gleichgewicht zwischen digitaler Leistung, Mixed-Signal-/HF-Kompatibilität sowie Stromverbrauch und Kosten bietet; und MEMS-SOI, eine isolierende Oxidschicht und eine unterstützende Griffschicht. Seine Produkte werden zur Herstellung von Smartphones, Computern, Servern, industriellen und medizinischen Geräten, elektrischen und autonomen Fahrzeugen, vernetzten Objekten, Robotern oder Automatisierungssystemen verwendet. Soitec SA wurde 1992 gegründet und hat seinen Hauptsitz in Bernin, Frankreich.",,60.292763,-0.346,,-0.37146,4232818688.0,1.29,0.54,0.08
AI / Tech,Semiconductor Materials,AIXA.DE,59.84000015258789,62.65999984741211,11.641035044555371,AIXTRON SE                    N,"Die AIXTRON SE produziert und vertreibt zusammen mit ihren Tochtergesellschaften Depositionsanlagen für die Halbleiterindustrie in Asien, Europa und den Vereinigten Staaten. Das Unternehmen bietet G10-SiC, G10-GaN, G10-AsP, AIX G5+ C, Closed Coupled Showerhead-Systeme für Forschung und Entwicklung, AIX 2800G4-TM und AIX G5 WW C an. Darüber hinaus entwickelt, produziert und installiert es Geräte für die Abscheidung von Halbleitermaterialien; und bietet Abscheidungsprozesse, Beratung, Schulung, Kundensupport und andere damit verbundene Dienstleistungen sowie Peripheriegeräte und Dienstleistungen zur Unterstützung des Betriebs seiner Systeme an. Darüber hinaus beschäftigt sich das Unternehmen mit der Lieferung von Depositionsanlagen für die Massenproduktion; sowie Forschungs- und Entwicklungsaktivitäten sowie Vorserienproduktionsaktivitäten. Seine Produkte werden in den Bereichen Laser, LED, Anzeigetechnologien, optische Datenübertragung, SiC- und GaN-Leistungselektronik und anderen Anwendungen eingesetzt. Die AIXTRON SE wurde 1983 gegründet und hat ihren Hauptsitz in Herzogenrath, Deutschland.",112.90567,47.478497,-0.472,,0.11563,6749105664.0,0.81,0.94,0.89
AI / Tech,Semiconductor Materials,IQE.L,50.79999923706055,72.9000015258789,4.65500020980835,IQE PLC ORD 1P,"IQE plc entwickelt, produziert und vertreibt zusammen mit seinen Tochtergesellschaften fortschrittliche Halbleitermaterialien. Das Unternehmen ist in drei Segmenten tätig: Wireless, Photonics und CMOS++. Das Unternehmen produziert und vertreibt Verbindungshalbleitermaterialien für den Mobilfunkmarkt, zu dem Hochfrequenzgeräte für die drahtlose Kommunikation gehören, sowie für den Photonikmarkt, zu dem Anwendungen gehören, die sichtbares und infrarotes Licht übertragen und erfassen. Es bietet auch fortschrittliche Halbleitermaterialien im Zusammenhang mit Silizium an. Das Unternehmen ist in den Vereinigten Staaten, dem übrigen amerikanischen Kontinent, Frankreich, Deutschland, Israel, dem Vereinigten Königreich, dem übrigen Europa, dem Nahen Osten, Afrika, der Volksrepublik China, Japan, Taiwan und dem übrigen asiatisch-pazifischen Raum tätig. Das Unternehmen wurde 1988 gegründet und hat seinen Hauptsitz in Cardiff, Großbritannien.",,-112.88889,0.001,,-0.37713,670891264.0,1.22,0.68,0.35
Energy,Power Equipment,SIE.DE,274.5,280.20001220703125,198.0,SIEMENS AG                    N,"Die Siemens Aktiengesellschaft, ein Technologieunternehmen, konzentriert sich auf die Bereiche Automatisierung und Digitalisierung in Europa, der Gemeinschaft Unabhängiger Staaten, Afrika, dem Nahen Osten, Amerika, Asien und Australien. Das Unternehmen ist in den Segmenten Digital Industries, Smart Infrastructure, Mobility, Siemens Healthineers und Siemens Financial Services (SFS) tätig. Das Segment Digital Industries bietet Automatisierungssysteme und Software für Fabriken, numerische Steuerungssysteme, Servomotoren, Antriebe und Wechselrichter sowie integrierte Automatisierungssysteme für Werkzeugmaschinen und Produktionsmaschinen; Prozessleitsysteme, Maschine-zu-Maschine-Kommunikationsprodukte, Sensoren und Radiofrequenz-Identifikationssysteme; Software für Produktions- und Produktlebenszyklusmanagement sowie Simulation und Test mechatronischer Systeme. Das Segment „Smart Infrastructure“ bietet Produkte, Systeme, Lösungen, Dienstleistungen und Software zur Unterstützung eines nachhaltigen Übergangs von fossilen und erneuerbaren Energiequellen; nachhaltige Gebäude und Gemeinden; und Gebäude, Elektrifizierung und elektrische Produkte. Das Segment Mobilität bietet Schienenpersonen- und Gütertransporte wie U-Bahn-Systeme, Straßenbahnen und Stadtbahnen sowie Nahverkehrszüge sowie Züge und Reisezugwagen; Lokomotiven und Lösungen für automatisierten Transport und Leasing; Produkte und Lösungen für die Bahnautomatisierung und Elektrifizierung; Wartung und digitale Dienstleistungen; sowie digitale und cloudbasierte Lösungen und damit verbundene Dienstleistungen. Das Segment Siemens Healthineers entwickelt, produziert und vertreibt verschiedene diagnostische und therapeutische Produkte und Dienstleistungen; und bietet klinische Beratungs- und Schulungsdienste an. Das Segment Siemens Financial Services bietet Fremd- und Eigenkapitalinvestitionen an; Leasing, Kredite und Betriebskapital; Struktur-, Ausrüstungs- und Projektfinanzierung; und Finanzberatungsdienste. Das Unternehmen wurde 1847 gegründet und hat seinen Hauptsitz in München, Deutschland.",28.386763,21.510096,-0.0,-0.086,0.09688,209373052928.0,0.35,0.93,0.86
Energy,Power Equipment,HUBB,523.6900024414062,563.8055092962444,381.3074430398541,Hubbell Inc,"Hubbell Incorporated produziert und vertreibt zusammen mit seinen Tochtergesellschaften Elektro- und Versorgungslösungen in den Vereinigten Staaten und international. Das Unternehmen ist in zwei Segmenten tätig: Electrical Solutions und Utility Solutions. Das Segment „Utility Solution“ bietet kritische Komponenten, die es dem Netz ermöglichen, Energie zu übertragen und zu verteilen, sowie Kommunikations- und Steuerungstechnologien, einschließlich Komponenten für die Übertragung und Verteilung von Versorgungsunternehmen, wie Ableiter, Isolatoren, Steckverbinder, Anker, Durchführungen, Gehäuse, Ausschnitte und Schalter; und Lösungen, die den Rand der Versorgungsinfrastruktur bedienen und intelligente Zähler, Kommunikationssysteme sowie Schutz- und Steuergeräte umfassen. Das Unternehmen verkauft seine Produkte unter verschiedenen Marken und/oder Warenzeichen an die Märkte für Stromverteilung, Umspannwerke und Übertragung sowie an Märkte für Netzschutz und -steuerung, Verbrauchszähler und moderne Messinfrastruktur sowie an Telekommunikations- und Gasverteilungsmärkte. Das Segment Electrical Solution bietet Verkabelungsgeräte für Standard- und Spezialanwendungen, elektrische Rohbauprodukte, Verbindungs- und Erdungsprodukte sowie andere elektrische Geräte für den Einsatz in industriellen, kommerziellen und institutionellen Einrichtungen durch Elektroinstallateure, Wartungspersonal, Elektriker, Versorgungsunternehmen und Telekommunikationsunternehmen. Darüber hinaus entwickelt und fertigt das Unternehmen verschiedene Industriesteuerungen und Kommunikationssysteme für den Einsatz im privaten und industriellen Bereich sowie in der Öl- und Gasindustrie sowie im Bergbau. Dieses Segment verkauft seine Produkte über Elektro- und Industriehändler, Baumärkte, Einzelhandels- und Eisenwarengeschäfte sowie produktorientierte Internetseiten für Privathaushalte. und Spezialanwendungsprodukte hauptsächlich über Großhändler an Vertragspartner, Industriekunden und Erstausrüster. Das Unternehmen wurde 1888 gegründet und hat seinen Hauptsitz in Shelton, Connecticut.",30.914402,23.32539,0.111,0.125,0.15105,27672709120.0,0.1,0.78,0.56
Energy,Renewables,VWS.CO,182.75,203.0,92.83605359055844,Vestas Wind Systems A/S,"Vestas Wind Systems A/S beschäftigt sich mit der Entwicklung, Herstellung, Installation und Wartung von Windkraftanlagen in den USA, Dänemark und international. Das Unternehmen ist in zwei Segmenten tätig: Energielösungen und Service. Das Segment Power Solutions bietet Onshore- und Offshore-Windkraftanlagen, Windturbinen, Entwicklungsstandorte usw. Das Segment Service befasst sich mit dem Verkauf von Serviceverträgen, Ersatzteilen und damit verbundenen Aktivitäten. Vestas Wind Systems A/S wurde 1898 gegründet und hat seinen Hauptsitz in Aarhus, Dänemark.",28.779528,16.961424,0.144,15.162,0.04425,179390808064.0,0.15,0.82,0.63
Energy,Renewables,ORSTED.CO,148.1999969482422,327.5,102.82324981689453,ORSTED A/S,"Ørsted A/S besitzt, entwickelt, baut und betreibt zusammen mit seinen Tochtergesellschaften Offshore- und Onshore-Windparks, Solarparks sowie Energiespeicher- und Kraft-Wärme-Kopplungsanlagen (KWK). Das Unternehmen ist in den Segmenten Offshore, Onshore sowie Bioenergie und Sonstiges tätig. Das Offshore-Segment besitzt, entwickelt, baut und betreibt Offshore-Windparks in Europa, den Vereinigten Staaten und im asiatisch-pazifischen Raum. Das Onshore-Segment besitzt, entwickelt, baut und betreibt Onshore-Wind- und Solarparks in den Vereinigten Staaten, einschließlich integrierter Speicher. Das Segment Bioenergie & Sonstiges erzeugt Wärme und Strom und bietet Nebendienstleistungen aus KWK-Anlagen in Dänemark an; und optimiert sein Gasportfolio und verwaltet sein dänisches und schwedisches B2B-Geschäft. Das Unternehmen hieß früher DONG Energy A/S und änderte im November 2017 seinen Namen in Ørsted A/S. Ørsted A/S wurde 1972 gegründet und hat seinen Sitz in Fredericia, Dänemark.",,15.368581,0.334,-0.849,0.00211,195781394432.0,0.01,0.2,-0.6
Energy,Oil & Gas,SHEL,78.80999755859375,94.04718035075285,64.76137080789836,Shell PLC,"Shell plc ist als Energie- und Petrochemieunternehmen in Europa, Asien, Ozeanien, Afrika, den Vereinigten Staaten und anderen Teilen Amerikas tätig. Das Unternehmen ist in den folgenden Segmenten tätig: Integriertes Gas, Upstream, Marketing, Chemikalien und Produkte sowie Lösungen für erneuerbare Energien und Energie. Das Unternehmen erforscht und fördert Erdgas, um Flüssigerdgas herzustellen oder es in Gas-to-Liquids (GTL)-Kraftstoffe und andere Produkte umzuwandeln; erforscht und fördert Rohöl, Erdgas und Erdgasflüssigkeiten; und betreibt die Vermarktung und den Transport von Öl, Gas und Flüssigkeiten, unterstützt durch die Infrastruktur, die erforderlich ist, um sie auf den Markt zu bringen oder in den chemischen Produktionsanlagen und Raffinerien von Shell zu verarbeiten. Darüber hinaus ist das Unternehmen im Marketing tätig, das Mobilität, Schmierstoffe und auf Dekarbonisierung ausgerichtete Sektoren umfasst. betreibt ein Einzelhandelsnetzwerk, das das Laden von Elektrofahrzeugen, den Convenience-Einzelhandel und den Großhandel mit kommerziellen Kraftstoffen für Transport und Industrie umfasst; verkauft Produkte für den Straßentransport und Maschinen in den Bereichen Fertigung, Bergbau, Energieerzeugung, Landwirtschaft und Baugewerbe; und bietet kohlenstoffarme Energielösungen wie Biokraftstoffe für ein breites Spektrum kommerzieller Kunden an, darunter solche aus der Luftfahrt-, Schifffahrts- und Landwirtschaftsbranche. Darüber hinaus bietet das Unternehmen Chemikalien und Produkte an, darunter Chemieproduktionsanlagen mit eigenem Marketingnetzwerk sowie Raffinerien, die Rohöl und andere Rohstoffe in eine Reihe von Ölprodukten umwandeln, die weltweit für den häuslichen, industriellen und Transportgebrauch transportiert und vermarktet werden; und betreibt ein Pipeline-Geschäft sowie den Handel und die Optimierung von Rohöl, Ölprodukten und Petrochemikalien. Das Unternehmen war früher als Royal Dutch Shell plc bekannt und änderte im Januar 2022 seinen Namen in Shell plc. Shell plc wurde 1897 gegründet und hat seinen Hauptsitz in London, Vereinigtes Königreich.",12.275701,8.383115,0.007,0.266,0.07014,218461814784.0,-0.12,0.48,-0.04
Energy,Oil & Gas,TTE.PA,71.06999969482422,81.25,47.98910936864733,TOTALENERGIES,"TotalEnergies SE, ein integriertes Energieunternehmen, produziert und vermarktet Öl und Biokraftstoffe, Erdgas, Biogas und kohlenstoffarmen Wasserstoff, erneuerbare Energien und Strom in Frankreich, den Vereinigten Staaten, Europa, Brasilien, Indien und international. Das Unternehmen hieß früher TOTAL SE und änderte im Juni 2021 seinen Namen in TotalEnergies SE. TotalEnergies SE wurde 1924 gegründet und hat seinen Hauptsitz in Courbevoie, Frankreich.",12.232358,8.519239,0.034,0.571,0.08201,158122606592.0,-0.07,0.69,0.39
Finance,Fintech,ADYEN.AS,875.7999877929688,1603.5999755859375,772.4000244140625,ADYEN,"Adyen N.V. betreibt eine Zahlungsplattform in Europa, dem Nahen Osten, Afrika, Nordamerika, dem asiatisch-pazifischen Raum und Lateinamerika. Seine Plattform integriert den Zahlungsstapel, einschließlich Gateway-, Risikomanagement-, Verarbeitungs-, Acquiring- und Abwicklungsdienste. Das Unternehmen bietet eine Back-End-Infrastruktur für die Autorisierung an. Es akzeptiert Zahlungen per Online, persönliche Zahlungen, Cross-Channel und Adyen für Plattformen. Das Unternehmen bietet außerdem Optimierungsdienste an, darunter Adyen Uplift, Schutz, Authentifizierung und Tokenisierung. Darüber hinaus werden Finanzprodukte wie Konten, Kapital, Ausgabe und Auszahlung angeboten. Es bedient Unternehmen in den Bereichen Digitales, Mobilität, SaaS-Plattformen, Einzelhandel, Lebensmittel und Getränke, Abonnements sowie Reise- und Gastgewerbe. Das Unternehmen wurde 2006 gegründet und hat seinen Sitz in Amsterdam, Niederlande.",26.026745,18.515827,0.169,0.119,0.44712,27619833856.0,0.01,0.12,-0.75
Finance,Fintech,WISE.L,818.0,1164.0,754.0,WISE GROUP PLC CLS A ORD USD0.0,"Wise Group plc bietet grenzüberschreitende und inländische Finanzdienstleistungen für Privat- und Geschäftskunden im Vereinigten Königreich, im übrigen Europa, im Asien-Pazifik-Raum, in Nordamerika und international an. Es bietet internationalen Geldtransfer, Wise-Konto, internationale Debitkarte, Wise-Plattform, Geschäfts-Debitkarte und Massenzahlungsdienste. Wise Group plc wurde 2010 gegründet und hat seinen Sitz in London, Großbritannien.",22.108109,20.866283,0.092,-0.132,0.22486,8182164480.0,-0.06,0.16,-0.69
Finance,Banks,BNP.PA,101.58000183105469,101.81999969482422,63.2448373359118,BNP PARIBAS ACT.A,"BNP Paribas SA bietet verschiedene Bank- und Finanzprodukte und -dienstleistungen in Europa, dem Nahen Osten, Afrika, Amerika und dem asiatisch-pazifischen Raum an. Das Unternehmen gliedert sich in drei Geschäftsbereiche: Corporate & Institutional Banking; Kommerzielles, persönliches Banking und Dienstleistungen; und Investment- und Schutzdienstleistungen. Der Geschäftsbereich Corporate & Institutional Banking bietet Kapitalmarkt-, Wertpapier-, Finanzierungs-, Risikomanagement-, Wertpapierclearing-, Verwahrungs-, Beratungs-, Transaktionsbanking-, Cash-Management-, Investmentbanking- und Finanzberatungsdienstleistungen für Firmen- und institutionelle Kunden an. Der Geschäftsbereich Commercial, Personal Banking & Services bietet Finanzierungs- und Ausrüstungsleasingdienste, Kredite, Investitionen, finanzielle und nichtfinanzielle Dienstleistungen, Mobilität und digitale Bankdienstleistungen sowie Girokonten, Sparprodukte, Bancassurance, Versicherungsprodukte und -dienstleistungen sowie Verbraucherkredite. Der Bereich Investment & Protection Services bietet Schutz-, Spar-, Anlage- und Immobiliendienstleistungen zur Unterstützung von Privatpersonen, Fachleuten, Firmenkunden und Institutionen sowie Vermögensverwaltungs-, Versicherungs-, Schutz-, Renten- und Private-Banking-Dienstleistungen. Das Unternehmen hieß früher Banque Nationale de Paris und änderte im Mai 2000 seinen Namen in BNP Paribas SA. BNP Paribas SA wurde 1822 gegründet und hat seinen Hauptsitz in Paris, Frankreich.",9.573987,7.8888755,0.093,0.12,0.2545,111900598272.0,0.27,0.99,0.99
Finance,Banks,SAN.MC,11.802000045776367,11.989999771118164,6.623049176735981,BANCO SANTANDER S.A.,"Banco Santander, S.A. bietet Privatpersonen, kleinen und mittleren Unternehmen, Großkonzernen und öffentlichen Einrichtungen weltweit verschiedene Finanzprodukte und -dienstleistungen an. Das Unternehmen ist in fünf Segmenten tätig: Retail & Commercial Banking, Digital Consumer Bank, Corporate & Investment Banking, Wealth Management & Insurance sowie Payments. Es bietet Sicht- und Termineinlagen, Investmentfonds sowie Giro- und Sparkonten; Hypotheken, Verbraucherfinanzierungen, Kredite und verschiedene Finanzierungslösungen; und Projektfinanzierung, Fremdkapitalmärkte, globales Transaktionsbanking und Unternehmensfinanzierungsdienstleistungen. Das Unternehmen bietet außerdem Kredit- und Debitkarten, Immobilienkredite, Mikrofinanzierung und Autokredite an. Unternehmens- und Investmentbankdienstleistungen; Beratung bei Fusionen und Übernahmen; Vermögens-, Vermögens- und Risikomanagementdienste; und digitale Zahlungen und Technologielösungen. Darüber hinaus ist es in den Bereichen Verbriefung, Leasing, Portfolioverwaltung, E-Commerce, Luftverkehr, Flugzeugvermietung, Software, Beratung, Fonds- und Investmentmanagement, erneuerbare Energien, Fahrzeugvermietung, Versicherung, Werbung, Marketing, Telemarketing, Automobil, Landwirtschaft, Factoring, Wertpapiervermittlung und -investition, Pensionsfondsverwaltung, Handelsvermittler, Risikokapitalfonds, Vermietung, Restaurant, Stromerzeugung, IT, Internet sowie Finanzberatung und andere Aktivitäten tätig; Management und andere Immobilienaktivitäten; sowie Kauf und Verkauf von Fahrzeugen. Darüber hinaus bietet das Unternehmen mobile und Online-Banking-Dienste an. Banco Santander, S.A. war früher als Banco Santander Central Hispano SA bekannt und änderte seinen Namen im Februar 2007 in Banco Santander, S.A.. Das Unternehmen wurde 1856 gegründet und hat seinen Hauptsitz in Madrid, Spanien.",13.411364,9.694909,0.046,0.674,0.34098998,169479061504.0,0.29,0.96,0.93
