Main Theme,Sub Theme,Ticker,Preis,52W High,52W Low,Name,Description,Trend Score,Momentum
Industrials,Logistics & Transport,UPS,105.4800033569336,120.72640319855104,79.49033806824455,"United Parcel Service, Inc.","United Parcel Service, Inc., a package delivery and logistics provider, offers transportation and delivery services. It operates through two segments, U.S. Domestic Package and International Package. The U.S. Domestic Package segment offers time-definite delivery services for express letters, documents, packages and palletized freight through air and ground services. The International Package segment provides small package operations in Europe, the Middle East and Africa, Canada and Latin America, and Asia. The company offers a range of guaranteed day- and time-definite international transportation services; day-definite services; cross-border ground package delivery; contract-only, e-commerce solutions for non-urgent, and cross-border shipments; and international service for urgent and palletized shipments. It also provides international air and ocean freight forwarding, contract logistics, customs brokerage and insurance, mail services, healthcare logistics, distribution, and post-sales services. United Parcel Service, Inc. was founded in 1907 and is headquartered in Atlanta, Georgia.",0.63,0.26
Industrials,Logistics & Transport,FDX,387.5,399.6700134277344,199.67222950077385,FedEx Corporation,"FedEx Corporation, together with its subsidiaries, provides transportation, e-commerce, and business services in the United States and internationally. It operates through Federal Express and FedEx Freight segments. The company offers transportation services, including express, freight, less-than-truckload freight, and time-specific freight-shipping; and small-package ground delivery services. It also provides e-commerce and digital solutions; dataworks; printing and shipping management, including digital printing, professional finishing, document creation, design solutions, direct mail, signs and graphics, custom-branded boxes, copying, computer rental, free Wi-Fi, corporate print solutions, shredding, expedited U.S. passport processing and renewal, and digital notarization; packing services, as well as packing supplies and boxes; document and business services; and retail access for package transportation. In addition, the company offers logistics services, air and ocean freight-forwarding and cargo transportation, specialty transportation, customs brokerage and clearance, trade management tools and data, and door-to-door solutions; and third party logistics and supply chain management solutions, such as inbound logistics, warehousing and distribution, fulfillment, contract packaging and product configuration, systems integration, returns process and disposition, test, repair, refurbishment, and product liquidation. Further, it provides sales, marketing, administrative, information technology, and back-office support services. FedEx Corporation was founded in 1971 and is headquartered in Memphis, Tennessee.",0.94,0.88
Industrials,Logistics & Transport,XPO,224.14999389648438,231.4600067138672,93.4800033569336,"XPO, Inc.","XPO, Inc., together with its subsidiaries, provides freight transportation services in the United States, North America, France, the United Kingdom, and rest of Europe. The company operates in two segments, North American Less-Than-Truckload (LTL) and European Transportation. The North American LTL segment provides shippers with geographic density and day-definite domestic and cross-border services to the U.S., Mexico, Canada, and the Caribbean. The European Transportation segment offers dedicated truckload, LTL, truck brokerage, managed transportation, last mile, freight forwarding, and warehousing and multimodal solutions to an extensive base of customers within the consumer, trade, and industrial markets. The company was formerly known as XPO Logistics, Inc. and changed its name to XPO, Inc. in December 2022. The company was founded in 1989 and is based in Greenwich, Connecticut.",0.95,0.89
Industrials,Logistics & Transport,ODFL,221.52000427246094,227.0800018310547,125.58519533986448,"Old Dominion Freight Line, Inc.","Old Dominion Freight Line, Inc. operates as a less-than-truckload motor carrier in the United States and North America. The company offers regional, inter-regional, and national less-than-truckload services, as well as expedited transportation services. It also provides various value-added services, including container drayage, truckload brokerage, and supply chain consulting. In addition, the company operates fleet maintenance centers. As of December 31, 2025, it owned and operated 10,184 tractors, 30,824 linehaul trailers, and 14,313 pickup and delivery trailers. Old Dominion Freight Line, Inc. was founded in 1934 and is headquartered in Thomasville, North Carolina.",0.95,0.89
Industrials,Logistics & Transport,SAIA,430.81500244140625,451.9100036621094,229.1199951171875,"Saia, Inc.","Saia, Inc., together with its subsidiaries, operates as a transportation company in North America. The company provides less-than-truckload services for shipments between 100 and 10,000 pounds. It also offers other value-added services, including brokered truckload, expedited transportation, and other logistics services. As of December 31, 2025, it operated 213 owned and leased terminals; and owned approximately 7,700 tractors and 26,500 trailers. The company was formerly known as SCS Transportation, Inc. and changed its name to Saia, Inc. in July 2002. Saia, Inc. was founded in 1924 and is headquartered in Johns Creek, Georgia.",0.91,0.81
Industrials,Logistics & Transport,JBHT,249.63499450683594,256.17999267578125,124.67699822668646,"J.B. Hunt Transport Services, I","J.B. Hunt Transport Services, Inc. provides surface transportation, delivery, and logistic services in the United States. It operates through five segments: Intermodal, Dedicated Contract Services, Integrated Capacity Solutions, Final Mile Services, and Truckload. The JBI segment offers intermodal freight solutions. It operates 124,838 pieces of company-owned trailing equipment; owns and maintains its chassis fleet of 104,474 units; and manages a fleet of 5,880 company-owned tractors, 308 independent contractor trucks, and 8,704 company drivers. The DCS segment designs, develops, and executes supply chain solutions that support various transportation networks. As of December 31, 2025, it operated 11,878 company-owned trucks, 761 customer-owned trucks, and a contractor trucks. It operates 26,767 owned pieces of trailing equipment and 5,218 customer-owned trailers. The ICS segment provides freight brokerage and transportation logistics solutions; flatbed, refrigerated, expedited, and less-than-truckload, as well as dry-van and intermodal solutions; online multimodal marketplace; and logistics management services for customers to outsource their transportation functions. The FMS segment delivers services through 1,085 company-owned trucks, 169 customer-owned trucks, and 39 independent contractor trucks; and 1,091 owned pieces of trailing equipment and 98 customer-owned trailers. The JBT segment provides dry-van freight services by utilizing tractors and trailers operating over roads and highways through two company-owned tractors and 12,658 company-owned trailers. It transports or arranges for the transportation of freight, such as general merchandise, specialty consumer items, appliances, home furnishings, forest, paper, rubber, plastic products, food, beverages, building materials, apparel, accessories, soaps, cosmetics, automotive parts, agricultural products, electronics, and chemicals. The company was incorporated in 1961 and is headquartered in Lowell, Arkansas.",0.95,0.9
Industrials,Logistics & Transport,WERN,33.18000030517578,38.28365406116513,22.58989717703283,"Werner Enterprises, Inc.","Werner Enterprises, Inc., together with its subsidiaries, engages in transporting truckload shipments of general commodities in interstate and intrastate commerce in the United States, Mexico, Canada, and internationally. The company operates a fleet of medium-to-long-haul vans that transport various consumer nondurable products and other commodities in truckload quantities using dry van trailers; the expedited fleet, which provides time-sensitive truckload services using driver teams; a regional short-haul fleet for truckload van service; and temperature-controlled fleet, which offers truckload services for temperature-sensitive products using temperature-controlled trailers to retail distribution center or manufacturing facility, utilizing either dry van or specialized trailers. It also provides non-asset-based transportation and logistics services, comprising truckload logistics, which uses contracted carriers to complete shipments for brokerage customers and freight management customers, which it offers logistics management services and solutions; intermodal, which offers rail transportation through alliances with rail and drayage providers as an alternative to truck transportation; and werner final mile offers residential and commercial deliveries of large or heavy items using third-party agents and independent contractors. In addition, the company sells used trucks and trailers; and trades used trucks to original equipment manufacturers. It transports retail store merchandise, consumer products, food and beverage products and manufactured products. As of December 31, 2025, it had a fleet of 7,100 trucks, which included 6,785 that were company-operated, as well as 315 owned and operated by independent contractors; 28,780 trailers that comprised dry vans, flatbeds, and temperature-controlled, and other trailers; and 27 drayage company trucks and 170 Final Mile delivery trucks. Werner Enterprises, Inc. was founded in 1956 and is headquartered in Omaha, Nebraska.",0.67,0.35
Industrials,Logistics & Transport,KNX,63.595001220703125,66.61000061035156,37.19945530961178,Knight-Swift Transportation Hol,"Knight-Swift Transportation Holdings Inc., together with its subsidiaries, operates as a freight transportation company in the United States and Mexico. The company operates through four segments: Truckload, LTL, Logistics, and Intermodal. The Truckload segment offers irregular route, dedicated, refrigerated, flatbed, expedited, and cross-border services. The LTL segment provides regional direct service and serves its customers' national transportation needs by utilizing key partner carriers for coverage areas outside of its network. The Logistics segment provides brokerage and other freight management services utilizing third-party transportation providers and equipment. The Intermodal segment offers transportation services, including arranging the movement of customers' freight through third-party intermodal rail services on its trailing equipment; and drayage services to transport loads between the railheads and customer locations. The company also provides repair and maintenance shop services, equipment leasing, warranty services, and insurance; and trailer parts manufacturing, warehousing, and certain driving academy activities. It serves retail, food and beverage, consumer and paper products, transportation and logistics, housing and building, automotive, and manufacturing industries. The company was incorporated in 1989 and is headquartered in Phoenix, Arizona.",0.9,0.79
Industrials,Logistics & Transport,CHRW,183.64999389648438,202.64682973662678,84.9689512806132,"C.H. Robinson Worldwide, Inc.","C.H. Robinson Worldwide, Inc., together with its subsidiaries, provides freight transportation and related logistics and supply chain services in the United States and internationally. It operates in two segments, North American Surface Transportation and Global Forwarding. The company offers transportation and logistics services, such as truckload; less than truckload transportation brokerage services, which include the shipment of single or multiple pallets of freight; intermodal transportation that comprises the shipment service of freight in containers or trailers by a combination of truck and rail; and non-vessel operating common carrier and freight forwarding services, as well as organizes indirect air carrier and freight forwarder providing door-to-door services. It also provides customs brokerage services; and other logistics services, such as fee-based managed, warehousing, supply chain consulting and optimization services, and other services. In addition, the company is involved in the buying, selling, and/or marketing of fresh fruits, vegetables, and other value-added perishable items under the Robinson Fresh trade name. Further, the company offers transportation management and other surface transportation services. It provides fresh produce to grocery retailers, restaurants, produce wholesalers. C.H. Robinson Worldwide, Inc. was founded in 1905 and is headquartered in Eden Prairie, Minnesota.",0.84,0.68
Industrials,Logistics & Transport,EXPD,148.89999389648438,167.19000244140625,103.74607087678433,Expeditors International of Was,"Expeditors International of Washington, Inc., together with its subsidiaries, provides logistics services in the Americas, North Asia, South Asia, Europe, and Middle East, Africa, and India. The company offers airfreight services, such as air freight consolidation and forwarding; ocean freight and ocean services, including ocean freight consolidation, direct ocean forwarding, and order management; customs brokerage and other services, import, intra-continental ground transportation and delivery, and warehousing and distribution services; and customs clearance, purchase order management, vendor consolidation, time-definite transportation services, temperature-controlled transit, cargo insurance, specialized cargo monitoring and tracking, and other logistics solutions. It also provides optimization, trade compliance consulting, cargo insurance, cargo security, and solutions. In addition, it acts as a freight consolidator or as an agent for the airline that carries the shipment. Further, the company provides ancillary services that include preparation of shipping and customs documentation, packing, crating, insurance services, and the preparation of documentation to comply with local export and import laws. The company was incorporated in 1979 and is headquartered in Bellevue, Washington.",0.71,0.42
Industrials,Logistics & Transport,GXO,56.75,66.8499984741211,33.54999923706055,"GXO Logistics, Inc.","GXO Logistics, Inc., together with its subsidiaries, provides logistics services worldwide. It provides warehousing and distribution, order fulfilment, e-commerce, reverse logistics, and other supply chain services. As of December 31, 2025, it operated in 1,043 facilities. The company serves a range of customers in the e-commerce, omnichannel retail, technology and consumer electronics, food and beverage, industrial and manufacturing, consumer packaged goods, and other industries. GXO Logistics, Inc. was incorporated in 2021 and is headquartered in Greenwich, Connecticut.",0.7,0.39
Industrials,Logistics & Transport,DSGX,75.9000015258789,117.3499984741211,62.560001373291016,The Descartes Systems Group Inc,"The Descartes Systems Group Inc. provides global logistics technology solutions in the United States, Europe, the Middle East, Africa, Canada, and the Asia Pacific. Its Logistics Technology platform offers a range of modular, interoperable web and wireless logistics management solutions. The company offers a suite of solutions that include routing, mobile, and telematics; transportation management; ecommerce, shipping, and fulfillment; customs and regulatory compliance; global trade intelligence; broker and forwarder enterprise systems; and B2B messaging and connectivity services. It also provides its customers to use its modular and technology solutions to route, track, and measure delivery resources; plan, allocate, and execute shipments; rate, audit, and pay transportation invoices; access and analyze global trade data; research and perform trade tariff and duty calculations; file customs and security documents for imports and exports; and various other logistics processes. In addition, the company offers consulting, implementation, and training services, as well as maintenance and support services. It serves transportation providers, such as air, ocean, and truck modes; logistics service providers, including third-party logistics providers, freight forwarders, and customs brokers; and distribution-intensive companies, such as retailers, manufacturers, distributors, and mobile business service providers through subscription, transactional or perpetual license basis. The Descartes Systems Group Inc. was incorporated in 1981 and is headquartered in Waterloo, Canada.",0.24,-0.51
Industrials,Logistics & Transport,GRAB,4.054999828338623,6.619999885559082,3.4800000190734863,Grab Holdings Limited,"Grab Holdings Limited operates the Grab superapp in Cambodia, Indonesia, Malaysia, Myanmar, the Philippines, Singapore, Thailand, and Vietnam. The company offers delivery services on its platform, such as GrabFood, a food ordering and delivery booking service; Dine-Out for table reservations; GrabMart, a goods ordering and delivery booking service; GrabAds, an online advertising solution; GrabExpress, a package delivery booking service; Grab for Business platform, a unified management portal for corporate clients. It also provides GrabKios, a network of agents; GrabCar, which enables a private hire driver-partner to register with Grab and accept bookings through its driver-partner application; and GrabTaxi, which enables a taxi driver-partner to register with Grab and accept bookings through the Grab driver-partner application. In addition, the company offers JustGrab, which enables consumers to book a private car or a traditional taxi; GrabBike, a motorcycle ride-hailing offering; three-wheel vehicles for culturally localized modes; carpooling shared mobility options; GrabRentals, which facilitates vehicle rental for its driver-partners; GrabPay, a digital payments solution; and GrabCoins, a loyalty platform. Further, it provides GrabFin for financial services comprising digital and offline lending, PayLater services, white goods financing, receivables factoring, and working capital loans; GrabInsure, aprotection for rides and package deliveries, personal accident insurance, income protection insurance, critical illness insurance, vehicle insurance, and travel insurance; GrabLink, a payment gateway and acquiring service; Digibank Savings Account, a digital banking deposit account. Additionally, the company offers GX Bank debit cards; GXS FlexiCard, a fee-based credit card; and mapping services, autonomous vehicle services, and last-mile delivery infrastructure. Grab Holdings Limited was founded in 2012 and is headquartered in Singapore, Singapore.",0.18,-0.63
Industrials,Logistics & Transport,LYFT,14.4350004196167,25.540000915527344,10.975000381469727,"Lyft, Inc.","Lyft, Inc. operates multimodal transportation networks that offer access to various transportation options through platform and mobile based applications in the United States and internationally. The company facilitates peer-to-peer ridesharing by connecting drivers who have vehicles with riders who need a ride. It also operates Lyft Platform that provides a marketplace where drivers can be matched with riders via the Lyft mobile application. The company's platform provides a ridesharing marketplace that connects drivers with riders; Express Drive, a car rental program for drivers; and a network of shared bikes and scooters in various cities to address the needs of riders for short trips. In addition, it offers licensing and data access agreements; sells bikes and bike station software and hardware; and provides advertising services. The company was formerly known as Zimride, Inc. and changed its name to Lyft, Inc. in April 2013. Lyft, Inc. was incorporated in 2007 and is headquartered in San Francisco, California.",0.24,-0.52
Industrials,Logistics & Transport,UBER,75.58999633789062,101.98999786376953,68.45999908447266,"Uber Technologies, Inc.","Uber Technologies, Inc. develops and operates proprietary technology applications in the United States, Canada, Latin America, Europe, the Middle East, Africa, and the Asia Pacific. The company operates through three segments: Mobility, Delivery, and Freight. The Mobility segment connects consumers with a range of transportation modalities, such as ridesharing, carsharing, micromobility, rentals, public transit, taxis, and other modalities; and offers riders in a variety of vehicle types, as well as financial partnerships products and advertising services. The Delivery segment allows consumers to search for and discover restaurants to grocery, alcohol, convenience, and other retailers, as well as order a meal or other items, and either pick-up at the restaurant or have it delivered; and provides Uber direct, a white-label delivery-as-a-service for retailers and restaurants, as well as advertising services. The Freight segment manages transportation and logistics networks, which connects shippers and carriers in digital marketplace, including carriers upfronts, pricing, and shipment booking; and offers on-demand platform to automate logistics end-to-end transactions for small-and medium-sized businesses to global enterprises. The company was formerly known as Ubercab, Inc. and changed its name to Uber Technologies, Inc. in February 2011. Uber Technologies, Inc. was founded in 2009 and is headquartered in San Francisco, California.",0.21,-0.57
Consumer & Retail,E-Commerce,AMZN,252.7061004638672,258.6000061035156,169.35000610351562,"Amazon.com, Inc.","Amazon.com, Inc. engages in the retail sale of consumer products, advertising, and subscriptions service through online and physical stores in North America and internationally. The company operates through three segments: North America, International, and Amazon Web Services (AWS). It also manufactures and sells electronic devices, including Kindle, fire tablets, fire TVs, echo, ring, blink, and eero; and develops and produces media content. In addition, the company offers programs that enable sellers to sell their products in its stores; and programs that allow authors, independent publishers, musicians, filmmakers, Twitch streamers, skill and app developers, and others to publish and sell content. Further, it provides compute, storage, Artificial intelligence, database, analytics, machine learning, and other services, as well as advertising services through programs, such as sponsored ads, display, and video advertising. Additionally, the company offers Amazon Prime, a membership program. The company's products offered through its stores include merchandise and content purchased for resale and products offered by third-party sellers. It serves consumers, sellers, developers, enterprises, content creators, advertisers, and employees. The company was incorporated in 1994 and is headquartered in Seattle, Washington.",0.93,0.87
Consumer & Retail,E-Commerce,SHOP,132.36000061035156,182.19000244140625,81.63999938964844,Shopify Inc.,"Shopify Inc., a commerce technology company, provides tools to start, scale, market, and run a business of various sizes in Canada, the United States, Europe, the Middle East, Africa, the Asia Pacific, and Latin America. The Company offers Shopify platform that enables merchants to manage products and inventory, process orders and payments, fulfill and ship orders, build customer relationships, source products, leverage analytics, and reporting and access financing for running their business across all of their sales channels, including web and mobile storefronts, physical retail locations, social media storefronts, and marketplaces. It also provides Shopify Payments, a fully integrated payment processing service that allows merchants to accept and process payment cards online and offline. In addition, the company engages in the sale of themes and apps; shipping labels through Shopify Shipping; point-of-sale hardware; advertising on the Shopify App Store; and Shop Campaigns for buyer acquisitions, as well as registration of domain names. The company was formerly known as Jaded Pixel Technologies Inc. and changed its name to Shopify Inc. in November 2011. Shopify Inc. was incorporated in 2004 and is based in Ottawa, Canada.",0.5,0.01
Consumer & Retail,E-Commerce,MELI,1856.1900634765625,2645.219970703125,1593.2099609375,"MercadoLibre, Inc.","MercadoLibre, Inc. operates online commerce platforms in Brazil, Mexico, Argentina, and internationally. The company operates Mercado Libre Marketplace, an online commerce platform that can be accessed through mobile app or website; and Mercado Pago, a financial technology solution platform, which offers comprehensive set of financial technology services to users and other users of its e-commerce platform. It also provides Mercado Fondo that allows users to invest funds deposited in their Mercado Pago accounts; Mercado Credito, which grants loans and obtains better funding alternatives; and Mercado Mercado Envios that facilitates the shipping of goods from the Company and sellers to buyers. In addition, the company provides Mercado Libre Classifieds, where users can list vehicles, properties, and services; Mercado Ads, an advertising platform, which enables retailers and brands to promote their products and services on the platform. MercadoLibre, Inc. was incorporated in 1999 and is headquartered in Montevideo, Uruguay.",0.25,-0.5
