Main Theme,Sub Theme,Ticker,Preis,52W High,52W Low,Name,Description,Trend Score,Momentum
Healthcare,Pharma,AZN,196.1649932861328,210.51532313449323,130.05035974387212,AstraZeneca PLC,"AstraZeneca PLC, a biopharmaceutical company, focuses on the discovery, development, manufacture, and commercialization of prescription medicines. The company offers Imjudo, Datroway, Iressa, Tagrisso, Imfinzi, Lynparza, Calquence, Enhertu, Orpathys, Truqap, Zoladex, Faslodex, Crestor, Andexxa, Onglyza, Symlin, XIGDUO XR, Atacand, Atacand HCT, Atacand Plus, Farxiga/Forxiga, Plendil, Modip, Splendil, Munobal, Flodil, Tenormin, Tenormine, Prenormine, Atenol, Zestril, Brilinta/Brilique, Komboglyze, Qtern, Wainua, Byetta, Lokelma, Seloken ZOK, Toprol-XL, Betaloc ZOK, XIGDUO, Accolate, Accoleit, Vanticon, Bricanyl Respules, Eklira Genuair/Tudorza/Bretaris, Pulmicort Turbuhaler, Symbicort Turbuhaler, Airsupra, Bricanyl Turbuhaler, Fasenra, Rhinocort, Tezspire, Bevespi Aerosphere, Daliresp/Daxas, Oxis Turbuhaler, Saphnelo, Breztri Aerosphere, Duaklir Genuair, Pulmicort Respules, and Symbicort pMDI. It also provides Beyfortus, Kavigale, Evusheld, Fluenz/FluMist, Synagis, Kanuma, Ultomiris, Koselugo, Voydeya, Soliris, Strensiq, Nexium, and other medicines. The company offers its products for ocology, cardiovascular, renal and metabolism, respiratory & immunology, vaccines and immune, and therapies rare diseases. It serves primary and specialty care physicians through distributors and local representative offices in the United Kingdom, the Americas, rest of Europe, Asia, Africa, and Australasia. It has a strategic agreement with Tempus and Pathos to develop the largest multimodal foundation model in oncology; and a strategic research collaboration with CSPC Pharmaceutical Group Limited to advance the discovery and development of novel oral candidates, with the potential to treat diseases across multiple indications. The company was formerly known as Zeneca Group PLC and changed its name to AstraZeneca PLC in April 1999. AstraZeneca PLC was incorporated in 1992 and is headquartered in Cambridge, the United Kingdom.",0.82,0.64
Healthcare,Pharma,GSK,55.904998779296875,61.207211575920944,34.48189574703717,GSK plc,"GSK plc, together with its subsidiaries, engages in the research, development, and manufacture of vaccines, specialty medicines, and general medicines to prevent and treat disease in the United Kingdom, the United States, and internationally. It operates through Commercial Operations and Total R&D segments. The company offers specialty medicines that include oncology, respiratory/immunology, inflammation, and inhaled medicines for HIV, respiratory eosinophildriven diseases, lupus and lupus nephritis, ovarian cancer, and endometrial cancer. It also provides vaccines for Shingles, Meningitis, RSV, Seasonal Influenza, Hepatitis, Diphtheria, Tetanus, Acellular Pertussis, Rotavirus, Pertussis, Polio, Haemophilus, Invasive Diseases, Pneumonia, Acute Otitis Media, Measles, Mumps, Rubella and Chickenpox, and Human Papilloma Virus. Additionally, the company offers general medicines for asthma, COPD, bacterial infection, benign prostatic hyperplasia, allergic rhinitis, and inflammatory skin conditions. It also focuses on the discovery, development, and commercialization of oral small molecule therapies for patients with unmet needs in oncology and inflammatory diseases. It has a collaboration agreement with CureVac to develop mRNA vaccines for infectious diseases. The company has a strategic alliance with AN2 Therapeutics, Inc. for the development of new therapies for TB. GSK plc was formerly known as GlaxoSmithKline plc and changed its name to GSK plc in May 2022. The company was founded in 1715 and is headquartered in London, United Kingdom.",0.8,0.6
Healthcare,Pharma,RHHBY,49.939998626708984,58.98337105702357,33.99419495906019,Roche Holding Ltd,"Roche Holding AG engages in the pharmaceuticals and diagnostics businesses in Europe, North America, Latin America, Asia, Africa, Australia, and New Zealand. The company offers pharma solutions in the therapeutic areas of anaemia, blood and solid tumors, dermatology, haematology, infectious diseases, inflammatory and autoimmune, neurological disorders, ophthalmology, respiratory disorders, and transplantation. It also provides in vitro tests for the diagnosis of various diseases, such as cancer, diabetes, Covid-19, hepatitis, human papillomavirus, and others; diagnostic instruments; and digital health solutions. The company was founded in 1896 and is based in Basel, Switzerland.",0.64,0.28
Healthcare,Pharma,SNY,47.275001525878906,53.36524278749337,43.31999969482422,Sanofi,"Sanofi engages in the research, development, manufacture, and marketing of therapeutic solutions. It provides immunology and inflammation, rare diseases neurology, oncology, and other vaccines. It also offers poliomyelitis, pertussis, and haemophilus influenzae type b (Hib) pediatric vaccines; respiratory syncytial virus protection and hexavalent combination vaccines that includes hepatitis A, typhoid, yellow fever, and rabies vaccines. It has a collaboration and license agreement with Exscientia to develop up to 15 novel small-molecule for oncology and immunology; ABL Bio, Inc. to develop ABL301 for treatment of alpha-synucleinopathies; and Innate Pharma SA for cell engager program targeting B7-H3. Further, it has a collaboration agreements with Atomwise to use ATOMNET platform and Insilico Medicine to use Pharma.AI, a medicine's AI platform; Kymera Therapeutics, Inc. to develop and commercialize protein degrader therapies targeting IRAK4 in patients with immune-inflammatory diseases; Nurix Therapeutics, Inc. to develop protein degradation therapies; Denali Therapeutics Inc. to treat systemic inflammatory diseases, such as ulcerative colitis; and Adagene Inc. for development of antibody-based therapies. Additionally, it has a collaboration with Scribe Therapeutics Inc. to develop genome editing technologies; Teva Pharmaceuticals to co-develop and co-commercialize TEV'574, for treatment of ulcerative colitis and Crohn's disease; and co-promotion service agreement with Provention Bio, Inc. for the commercialization of teplizumab. The company was formerly known as Sanofi-Aventis and changed its name to Sanofi in May 2011. Sanofi was incorporated in 1994 and is headquartered in Paris, France.",0.39,-0.21
Healthcare,Pharma,NVS,147.32000732421875,165.4250050930179,101.83060672512744,Novartis AG,"Novartis AG researches, develops, manufactures, distributes, markets, and sells pharmaceutical medicines in Switzerland and internationally. The company offers Entresto, an angiotensin receptorneprilysin inhibitor to treat symptomatic chronic heart failure with reduced ejection fraction (HFrEF); Cosentyx to treat plaque psoriasis, pso riatic arthritis, ankylosing spondylitis, and nonradiographic axial spondy loarthritis; Kisqali, a selective oral cyclin dependent inhibitor of kinases 4 and 6 (CDK4/6); Promacta/Revolade to treat immune thrombocytopenia (ITP), thrombocytopenia, and patients with severe aplastic anemia (SAA); Tafinlar+Mekinist, an oral combination therapy to treat patients with certain types of cancers; and Jakavi for the treatment of myelofibrosis, polycythemia vera, and acute or chronic graftversushost disease (GvHD). It also provides Tasigna to treat philadelphia chromosomepositive chronic myeloid leukemia in the chronic and/or accelerated phase; Xolair for the treatment of allergic asthma and nasal polyps or severe chronic rhinosi nusitis with nasal polyps; Ilaris to treat fever syndromes, Still's disease, and acute gouty arthritis; Pluvicto to treat prostatespecific membrane anti genpositive metastatic castrationresistant prostate cancer; Sandostatin SC and Sandostatin LAR to treat acromegaly carcinoid tumors and other types of functional gastro intestinal and pancreatic neuroendocrine tumors; Zolgensma for the treatment of genetic root cause of spinal muscular atrophy; Lucentis; Leqvio to reduce LDL cholesterol; Lutathera; Scemblix; and Fabhalta. The company focuses on therapeutic areas, such as cardiovascular, renal and metabolic, immunology, neuroscience, oncology, and hematology. It has a license and collaboration agreement with Alnylam Pharmaceuticals, Inc. to develop, manufacture, and commercialize Leqvio (inclisiran), a therapy to reduce LDL cholesterol. Novartis AG was incorporated in 1996 and is headquartered in Basel, Switzerland.",0.72,0.43
Healthcare,Pharma,TAK,16.649999618530273,18.899999618530273,12.989999771118164,Takeda Pharmaceutical Company L,"Takeda Pharmaceutical Company Limited engages in the research, development, manufacture, marketing, and out-licensing of pharmaceutical products in Japan and internationally. It offers pharmaceutical products in the areas of gastroenterology, rare diseases, plasma-derived therapies, immunology, oncology, and neuroscience. The company provides its products under the Entyvio, Gattex/Revestive, Takecab/Vocinti, EOHILIA, Alofisel, Dexilant, Pantoloc/Controloc, Adynovate/Adynovi, Feiba Fiber, Recombinate, Hemofil, Immunate, Immunine, Takhzyro, Livtencity, ADZYNMA, Elaprase, Replagal, Advate, Flexbumin, Vpriv, Gammagard Liquid/Kiovig, Hyqvia, Cuvitru, Exkivity, FRUZAQLA, Ninlaro, Velcade, Azilva, Iclusig, Leuplin/Enantone, Adcetris, vyvanse/elvanse, Trintellix, QDENGA, and Alunbrig brands. It has in-licensing agreements with BioMarin, Luxna Biotech, GlaxoSmithKline, Halozyme, and Kamada; collaborations with Neurocrine Biosciences, Inc., Seagen Inc., Anima Biotech, Denali Therapeutics, KSQ Therapeutics, Noile-Immune Biotech, Center for iPS Cell Research Institute, Kyoto University (CiRA), and Charles River Laboratories; licensing agreement with Mirum Pharmaceuticals, UCSD/Fortis Advisors, PeptiDream, MD Anderson Cancer Center, and Teva Pharmaceutical Industries; collaboration and licensing agreement with Arrowhead Pharmaceuticals Inc., Engitix, Genevant Sciences Corporation, Sosei, Zedira/Dr. Falk Pharma, Exelixi GlaxoSmithKline, Heidelberg Pharma, HUTCHMED, KM Biologics, and Ovid Therapeutics Inc.; and collaboration with ZEDIRA GmbH and Dr. Falk Pharma GmbH. It has research collaboration and licensing agreement with Crescendo Biologics. The company was founded in 1781 and is headquartered in Tokyo, Japan.",0.62,0.24
Healthcare,Pharma,PRGO,11.760000228881836,27.476622387559622,9.229999542236328,Perrigo Company plc,"Perrigo Company plc provides over-the-counter health and wellness solutions in the United States, Europe, and internationally. The company operates through Consumer Self-Care Americas and Consumer Self-Care International segments. It offers upper respiratory products, including cough suppressants, expectorants, and sinus and allergy relief; nutrition products consisting of infant formulas and oral electrolyte beverages; digestive health products, including antacids, anti-diarrheal, and anti-heartburn; pain and sleep-aids products comprising pain relievers and fever reducers; and oral care products, which include toothbrushes, toothbrush replacement heads, floss, flossers, whitening products, and toothbrush covers. The company also offers healthy lifestyle products, such as smoking cessation and well-being products; skin care products consisting of dermatological care, scar management, lice treatment, and other products for various skin conditions; women's health products comprising feminine hygiene and contraceptives; vitamins, minerals, and supplements; and other miscellaneous self-care products. It sells its products under the Compeed, Dr. Fresh, Firefly, Good Sense, Good Start, Mederma, Nasonex, Plackers, Prevacid24HR, REACH, Rembrandt, Steripod, Opill, Solpadeine, Coldrex, Physiomer, NiQuitin, ACO, ellaOne, and Compeed brands. The company also offers contract manufacturing services. It sells its products through retail drug, supermarket, and mass merchandise chains; e-commerce stores; wholesalers; pharmacies; drug and grocery retailers; and para-pharmacies. The company was formerly known as Perrigo Company and changed its name to Perrigo Company plc in December 2013. Perrigo Company plc was founded in 1887 and is headquartered in Dublin, Ireland.",0.14,-0.72
Healthcare,AI in Healthcare,ISRG,487.5,603.8800048828125,427.8399963378906,"Intuitive Surgical, Inc.","Intuitive Surgical, Inc. develops, manufactures, and markets products that enable physicians and healthcare providers to enhance the quality of and access to minimally invasive care in the United States and internationally. It offers the da Vinci Surgical System that enables surgical procedures using a minimally invasive approach; and Ion endoluminal system, which extends its commercial offerings beyond surgery into diagnostic endoluminal procedures enabling minimally invasive biopsies in the lung. The company also provides a suite of stapling, energy, and core instrumentation for its multi-port da Vinci surgical systems; progressive learning pathways to support the use of its technology; infrastructure of customer service and support specialists, a complement of services to its customers, including installation, repair, maintenance, 24/7 technical support, and proactive system health monitoring; and integrated digital capabilities providing connected offerings, streamlining performance for hospitals with program-enhancing insights. It sells its products through direct sales organizations, such as capital and clinical sales teams. Intuitive Surgical, Inc. was incorporated in 1995 and is headquartered in Sunnyvale, California.",0.34,-0.32
Healthcare,AI in Healthcare,NVDA,201.44000244140625,212.1667169482571,97.2570779520085,NVIDIA Corporation,"NVIDIA Corporation operates as a data center scale AI infrastructure company. The company operates through two segments, Compute & Networking, and Graphics segments. The Compute & Networking segment provides data center accelerated computing and networking platforms and artificial intelligence solutions and software, and automotive platforms and autonomous and electric vehicle solutions, including software. The Graphics segment offers GeForce GPUs for gaming and PCs; Quadro/NVIDIA RTX GPUs for enterprise workstation graphics. The company's products are used in gaming, professional visualization, data center, and automotive markets. The company sells its products to original equipment manufacturers, original device manufacturers, system integrators and distributors, independent software vendors, cloud service providers, add-in board manufacturers, distributors, automotive manufacturers and tier-1 automotive suppliers, and other ecosystem participants worldwide. It has a collaboration with Tech Mahindra Limited to develop artificial intelligence powered telco network operations reasoning agent. The company has a strategic partnership with Lumentum Holdings Inc. to develop optics technologies for AI and data centers. It also has a strategic partnership with Nebius Group N.V. to develop and deploy hyperscale cloud for the artificial intelligence market. NVIDIA Corporation was incorporated in 1993 and is headquartered in Santa Clara, California.",0.91,0.81
Healthcare,AI in Healthcare,VEEV,164.7899932861328,310.5,148.0500030517578,Veeva Systems Inc.,"Veeva Systems Inc. provides cloud-based software for the life sciences industry in North America, Europe, the Asia Pacific, the Middle East, Africa, and Latin America. The company offers Veeva Commercial Cloud comprising Veeva Vault CRM Suite for pharmaceutical and biotechnology companies; Veeva Medical that provides source of medical content across multiple channels and geographies; Veeva PromoMats, an end-to-end content and digital asset management solution; and Veeva Crossix, an analytics platform for pharmaceutical brands. It also provides Veeva Data Cloud, such as Veeva OpenData, a customer reference data solution; Veeva Link, which provides deep data; Veeva Compass, which includes de-identified and longitudinal patient data; and Veeva CRM Pulse that provides access and multichannel engagement metrics. In addition, the company offers Veeva Development Cloud consisting of Veeva Clinical Platform, which advances clinical trial execution; Veeva Clinical Data Management that helps sponsors and CROs design and run trials; Veeva Safety, which unifies systems and processes; Veeva RIM that provides regulatory information management capabilities, as well as Veeva Quality Cloud, which is used by the life sciences and consumer products industries; and Veeva Business Consulting services. Further, it provides professional and support services, including implementation and deployment planning, and project management; requirements analysis, solution design, and configuration; systems environment management and deployment; services focused on advancing or transforming business and operating processes; technical consulting services on data migration and systems integrations; training; and ongoing managed services, such as outsourced systems administration. The company was formerly known as Verticals onDemand, Inc. and changed its name to Veeva Systems Inc. in April 2009. Veeva Systems Inc. was incorporated in 2007 and is headquartered in Pleasanton, California.",0.1,-0.79
Healthcare,AI in Healthcare,OMCL,35.93000030517578,55.0,22.65999984741211,"Omnicell, Inc.","Omnicell, Inc., together with its subsidiaries, provides healthcare technology in the United States and internationally. It offers hospital and health systems solutions, such as points of care for clinician workflows in patient care areas of the healthcare system; Titan XT, an automated dispensing system; XTExtend, a console swap for its XT cabinets; and Central Pharmacy Dispensing Service for the medication dispensing process. The company also provides Central Med Automation Service for medication dispensing; IV Compounding Service, an in-house compounding system; specialty pharmacy services, including turnkey solution to help health systems establish, manage, and optimize an entity-owned specialty pharmacy; EnlivenHealth platform to digitally enable retail and community pharmacies; medication adherence solutions comprising consumables and medication packaging systems; and technology implementation, customer education and training, program management, and related offerings to professional services. In addition, it offers post-installation support and maintenance via phone and/or web, on-site service, parts, and access to software upgrades; software and hardware products for full traceability of medicines and medical supplies throughout the healthcare system; OmniSphere, a cloud-based platform. The company was formerly known as Omnicell Technologies, Inc. and changed its name to Omnicell, Inc. in 2001. Omnicell, Inc. was incorporated in 1992 and is headquartered in Fort Worth, Texas.",0.41,-0.18
Healthcare,AI in Healthcare,NVCR,12.979999542236328,20.059999465942383,9.819999694824219,NovoCure Limited,"NovoCure Limited, an oncology company, engages in the development, manufacture, and commercialization of tumor treating fields (TTFields) devices for the treatment of solid tumor cancers in the United States, Germany, France, Japan, Greater China, and internationally. Its TTFields devices include Optune Gio, Optune Lua, and Optune Pax. The company also has ongoing clinical trials investigating TTFields in brain metastases, gastric cancer, glioblastoma, liver cancer, non-small cell lung cancer, pancreatic cancer, and ovarian cancer. NovoCure Limited was incorporated in 2000 and is headquartered in Baar, Switzerland.",0.31,-0.38
Healthcare,AI in Healthcare,RXRX,3.6649999618530273,7.179999828338623,2.799999952316284,"Recursion Pharmaceuticals, Inc.","Recursion Pharmaceuticals, Inc., a clinical-stage biotechnology company, engages in the decoding biology and chemistry by integrating technological innovations across biology, chemistry, automation, data science, and engineering to industrialize drug discovery in the United States and the United Kingdom. The company develops REC-4881, which is in Phase 1b/2 clinical trial to treat familial adenomatous polyposis; REC-617, which is in Phase 1/2 clinical trial to treat advanced solid tumors; REC-1245, which is in Phase 1/2 clinical trial to treat biomarker-enriched solid tumors and lymphoma; REC-3565 that is in Phase 1/2 for the treatment of relapsed or refractory B-cell malignancies; and REC-4539, a reversible, CNS penetrant, orally bioavailable, and potential best-in-class inhibitor of LSD1 for the treatment of solid tumors and hematology oncology. Its preclinical stage product includes REC-7735 for the treatment of HR+ breast cancer; and REC-102 for the treatment of hypophosphatasia. The company has collaboration and agreement with Roche & Genentech; Sanofi; Bayer AG; Tempus; and Takeda Pharmaceutical Company Limited. Recursion Pharmaceuticals, Inc. was incorporated in 2013 and is headquartered in Salt Lake City, Utah.",0.2,-0.61
Healthcare,AI in Healthcare,SDGR,12.484999656677246,27.6299991607666,10.944999694824219,"Schrodinger, Inc.","Schrödinger, Inc., together with its subsidiaries, develops physics-based computational platform that enables discovery of novel molecules for drug development and materials applications in the United States, the Asia-Pacific, Europe, Middle East, Africa, and internationally. The company operates in two segments, Software and Drug Discovery. The Software segment sells its software to transform molecular discovery for life sciences and materials science industries. The Drug Discovery segment focuses on building a portfolio of preclinical and clinical programs, internally and through collaborations. It has a research collaboration and license agreement with Novartis Pharma AG to advance multiple development candidates. Schrödinger, Inc. was incorporated in 1990 and is based in New York, New York.",0.09,-0.82
Healthcare,AI in Healthcare,ABCL,4.085000038146973,6.514999866485596,1.940000057220459,AbCellera Biologics Inc.,"AbCellera Biologics Inc. engages in discovering and developing antibody-based medicines for indications with unmet medical need in the United States. Its lead product is ABCL635, an non-hormonal medicine, which is in Phase 2 clinical trial to treat moderate-to-severe vasomotor symptoms; and ABCL575, a fully human, half-life extended monoclonal antibody, which is in in a Phase 1 clinical trial for treating T-cell-mediated autoimmune conditions, such as atopic dermatitis. The company has a research collaboration and license agreement with Eli Lilly and Company; AbbVie Inc.; and partnership agreement with Viking Global Investors & ArrowMark Partners and Biogen Inc. AbCellera Biologics Inc. was incorporated in 2012 and is headquartered in Vancouver, Canada.",0.47,-0.06
Healthcare,AI in Healthcare,INVA,23.329999923706055,25.149999618530273,16.520000457763672,"Innoviva, Inc.","Innoviva, Inc. operates as a biopharmaceutical company in the United States and internationally. Its royalty portfolio includes RELVAR/BREO ELLIPTA, a once-daily combination medicine consisting of a LABA, vilanterol, and an inhaled corticosteroid, and fluticasone furoate; ANORO ELLIPTA, a once-daily medicine combining a long-acting muscarinic antagonist, umeclidinium bromide, and ABA, VI. The company also markets GIAPREZA for increasing blood pressure in adults with septic or other distributive shock; XACDURO, a co-packaged for intravenous use for the treatment of hospital-acquired and ventilator-associated bacterial pneumonia caused by Acinetobacter; XERAVA for the treatment of complicated intra-abdominal infections in adults; ZEVTERA an advanced-generation cephalosporin antibiotic for the treatment of staphylococcus aureus bacteremia, as well as with right-sided endocarditis, acute bacterial skin and skin structure infections, and community-acquired bacterial pneumonia; NUZOLVENCE for the treatment of uncomplicated urogenital gonorrhea in adults and adolescents. In addition, the company develops bacteriophages with potential use in a range of infectious and other serious diseases. It has a strategic partnership with Sarissa Capital Management LP; and LABA Collaboration Agreement with Glaxo Group Limited to develop and commercialize once-daily products for the treatment of chronic obstructive pulmonary disease and asthma. The company was formerly known as Theravance, Inc. and changed its name to Innoviva, Inc. in January 2016. Innoviva, Inc. was incorporated in 1996 and is headquartered in Burlingame, California.",0.79,0.58
Healthcare,AI in Healthcare,TVTX,38.459999084472656,43.310001373291016,13.880000114440918,"Travere Therapeutics, Inc.","Travere Therapeutics, Inc., a biopharmaceutical company, identifies, develops, and delivers therapies to people living with rare kidney and metabolic diseases in the United States. The company's products include FILSPARI (sparsentan), a once-daily, oral medication designed to target two critical pathways in the disease progression of IgA Nephropathy (endothelin 1 and angiotensin-II); and Thiola and Thiola EC (tiopronin tablets) for the treatment of cystinuria, a rare genetic cystine transport disorder that causes high cystine levels in the urine and the formation of recurring kidney stones. Its clinical-stage programs consist of Sparsentan, a novel investigational product candidate, which has been granted Orphan Drug Designation for the treatment of focal segmental glomerulosclerosis in the U.S. and Europe; and Pegtibatinase, a novel investigational human enzyme replacement candidate being evaluated for the treatment of classical homocystinuria. It has a collaboration agreement with PharmaKrysto Limited for the pre-clinical activities associated with the cystinuria program. Travere Therapeutics, Inc. was formerly known as Retrophin, Inc. and changed its name to Travere Therapeutics, Inc. in November 2020. The company is headquartered in San Diego, California.",0.84,0.67
