Main Theme,Sub Theme,Ticker,Preis,52W High,52W Low,Name,Description,PE,Forward PE,Revenue Growth,Earnings Growth,Profit Margin,Market Cap,3M Momentum,Trend Score,Momentum
AI / Tech,AI Compute,000660.KS,2673000.0,2987000.0,243980.46875,SK hynix,"SK hynix Inc. betreibt über seine Tochtergesellschaften Forschung, Entwicklung, Herstellung, Vertrieb und Verkauf von Halbleiterbauelementen in Korea, China, dem übrigen Asien, den Vereinigten Staaten, Europa und international. Es bietet DRAM, wie Serverspeicher, Grafikspeicher, mobiler Speicher, PC-Speicher, Verbraucherspeicher; NAND-Flash-Speicher; SSD; und MCP-Produkte. Darüber hinaus ist das Unternehmen im Gießereigeschäft tätig und produziert Nicht-Speicher-Halbleiter. Das Unternehmen bietet seine Produkte für Server-, Netzwerk-, Mobil-, Personalcomputer-, Verbraucher- und Automobilanwendungen an. Das Unternehmen war früher als Hynix Semiconductor Inc. bekannt und änderte seinen Namen im März 2012 in SK hynix Inc.. SK hynix Inc. wurde 1949 gegründet und hat seinen Hauptsitz in Icheon-si, Südkorea.",,6.1599183,1.981,3.966,0.5689,1897442194751488.0,1.87,0.89,0.77
AI / Tech,AI Compute,005930.KS,339500.0,374500.0,58861.82454318937,SamsungElec,"Samsung Electronics Co., Ltd. ist weltweit in den Bereichen Unterhaltungselektronik, Informationstechnologie und Mobilkommunikation sowie Gerätelösungen tätig. Das Unternehmen ist in vier Geschäftsbereichen tätig: Device eXperience (DX), Device Solutions (DS), SDC und Harman. Das Unternehmen bietet Smartphones, Tablets, Audio-Sounds, Uhren, Schalter und Zubehör; Fernseher und Tongeräte; Geräte, einschließlich Kühlschränke, Waschmaschinen und Trockner, Staubsauger, Kochgeräte, Geschirrspüler, Klimaanlagen und Luftreiniger; Monitore und Speicherprodukte; Displays sowie intelligente und LED-Beschilderungen; und anderes Zubehör. Darüber hinaus ist das Unternehmen in den Bereichen Risikokapitalinvestitionen, Cloud-Dienste, Installation von Netzwerkgeräten, Dienstleistungen für Halbleiterausrüstung, digitale Werbeplattformen, Marketing, Beratung, Anbieter vernetzter Dienste, Logistik, Finanzierung und Softwaredesign tätig. Darüber hinaus bietet das Unternehmen Lohnverarbeitung und Vertrieb von Halbleitern und Anzeigetafeln an; Entwicklung und Verkauf von Netzwerklösungen; Herstellung von Halbleitern und Lebensmitteln; die Erbringung von Reparaturdienstleistungen für elektronische Geräte; und Entwicklung und Lieferung von Software zur Fehler- und Qualitätskontrolle bei Halbleiterprozessen sowie von digitalen Fernsehgeräten, Gießereien und System-Großintegration (LSI). Darüber hinaus bietet das Unternehmen vernetzte Fahrzeugsysteme, Audio- und Videoprodukte, Unternehmensautomatisierungslösungen und vernetzte Dienste. Samsung Electronics Co., Ltd. wurde 1969 gegründet und hat seinen Sitz in Suwon-si, Südkorea.",,5.4560003,0.692,4.921,0.21459,2229348274798592.0,0.89,0.89,0.78
AI / Tech,Photonics,SIVE.ST,63.349998474121094,110.0,2.8499999046325684,Sivers Semiconductors AB,"Sivers Semiconductors AB (publ) entwickelt, produziert und vertreibt über seine Tochtergesellschaften Chips, Komponenten, Module und Subsysteme in Nordamerika, Europa und Asien. Das Unternehmen ist in den Segmenten Wireless und Photonics tätig. Es bietet Produkte auf Basis der Halbleitertechnologie für 5G-mmWave-Netzwerke sowie optische Halbleiter für Glasfasernetzwerke, drahtlose optische Netzwerke und Sensoren. Darüber hinaus bietet das Unternehmen integrierte Hochfrequenzschaltkreise, Evaluierungskits und 5G-RFICs für verschiedene Anwendungen an, wie z. B. festen drahtlosen Zugang, 5G Open RAN, Radar, Zugverfolgung und Satellitenkommunikation. Darüber hinaus III-V-Verbindungshalbleiterlaser für optische Kommunikation, Erfassung/Sensoren und drahtlose Netzwerke. Sivers Semiconductors AB (publ) hat eine Partnerschaftsvereinbarung mit LioniX International zur Entwicklung der Lasertechnologie. Darüber hinaus besteht eine strategische Partnerschaft mit O-Net Technologies und Enablence Technologies Inc. zur Entwicklung eines fortschrittlichen externen Lichtquellenmoduls für KI-Rechenzentren und HPC-Systeme; Tachyon Networks Inc. für die Entwicklung von 28-GHz- und 60-GHz-mmWave-Transceivern für den Markt für festen drahtlosen Zugang; und mit GLOBALFOUNDRIES Inc. zur Entwicklung von Silizium-Photonik-Lösungen für den KI-Infrastrukturmarkt. Das Unternehmen wurde 1951 gegründet und hat seinen Sitz in Kista, Schweden.",,-316.75,-0.215,,-0.74379,18714763264.0,3.38,0.56,0.13
AI / Tech,Photonics,IQE.L,46.79999923706055,72.9000015258789,4.65500020980835,IQE PLC ORD 1P,"IQE plc entwickelt, produziert und vertreibt zusammen mit seinen Tochtergesellschaften fortschrittliche Halbleitermaterialien. Das Unternehmen ist in drei Segmenten tätig: Wireless, Photonics und CMOS++. Das Unternehmen produziert und vertreibt Verbindungshalbleitermaterialien für den Mobilfunkmarkt, zu dem Hochfrequenzgeräte für die drahtlose Kommunikation gehören, sowie für den Photonikmarkt, zu dem Anwendungen gehören, die sichtbares und infrarotes Licht übertragen und erfassen. Es bietet auch fortschrittliche Halbleitermaterialien im Zusammenhang mit Silizium an. Das Unternehmen ist in den Vereinigten Staaten, dem übrigen amerikanischen Kontinent, Frankreich, Deutschland, Israel, dem Vereinigten Königreich, dem übrigen Europa, dem Nahen Osten, Afrika, der Volksrepublik China, Japan, Taiwan und dem übrigen asiatisch-pazifischen Raum tätig. Das Unternehmen wurde 1988 gegründet und hat seinen Hauptsitz in Cardiff, Großbritannien.",,-104.0,0.001,,-0.37713,619605312.0,0.76,0.62,0.24
AI / Tech,Semiconductor Equipment,AIXA.DE,52.119998931884766,62.65999984741211,11.641035044555371,AIXTRON SE                    N,"Die AIXTRON SE produziert und vertreibt zusammen mit ihren Tochtergesellschaften Depositionsanlagen für die Halbleiterindustrie in Asien, Europa und den Vereinigten Staaten. Das Unternehmen bietet G10-SiC, G10-GaN, G10-AsP, AIX G5+ C, Closed Coupled Showerhead-Systeme für Forschung und Entwicklung, AIX 2800G4-TM und AIX G5 WW C an. Darüber hinaus entwickelt, produziert und installiert es Geräte für die Abscheidung von Halbleitermaterialien; und bietet Abscheidungsprozesse, Beratung, Schulung, Kundensupport und andere damit verbundene Dienstleistungen sowie Peripheriegeräte und Dienstleistungen zur Unterstützung des Betriebs seiner Systeme an. Darüber hinaus beschäftigt sich das Unternehmen mit der Lieferung von Depositionsanlagen für die Massenproduktion; sowie Forschungs- und Entwicklungsaktivitäten sowie Vorserienproduktionsaktivitäten. Seine Produkte werden in den Bereichen Laser, LED, Anzeigetechnologien, optische Datenübertragung, SiC- und GaN-Leistungselektronik und anderen Anwendungen eingesetzt. Die AIXTRON SE wurde 1983 gegründet und hat ihren Hauptsitz in Herzogenrath, Deutschland.",98.33962,40.156246,-0.472,,0.11563,5878398464.0,0.54,0.79,0.59
AI / Tech,Semiconductor Equipment,SMHN.DE,92.1500015258789,118.4000015258789,23.990199211608104,SUSS MicroTec SE              N,"Die SÜSS MicroTec SE entwickelt, produziert, vermarktet und wartet zusammen mit ihren Tochtergesellschaften Systeme zur Herstellung von Mikroelektronik, mikroelektromechanischen Systemen und verwandten Anwendungen. Das Unternehmen ist in zwei Geschäftsbereichen tätig: Advanced Backend Solutions und Photomask Solutions. Das Unternehmen bietet Maskenausrichter, Beschichter und Entwickler, UV-Projektionsscanner sowie temporäre und permanente Bonder für fortschrittliche Verpackungen, mikroelektromechanische Systeme, Verbindungshalbleiter und 3D-Integrationsmärkte. Darüber hinaus bietet das Unternehmen spezialisierte Systeme zur Reinigung und Bearbeitung von Fotomasken für die Halbleiterindustrie. Das Unternehmen ist in Europa, im Nahen Osten, in Afrika, Nordamerika und im asiatisch-pazifischen Raum tätig. Das Unternehmen wurde 1949 gegründet und hat seinen Hauptsitz in Garching bei München, Deutschland.",49.81081,25.787838,-0.307,-0.852,0.06877,1761496832.0,0.77,0.72,0.44
AI / Tech,Semiconductor Materials,SOI.PA,114.3499984741211,200.5,22.6200008392334,SOITEC,"Soitec SA entwickelt und produziert Halbleitermaterialien in Asien, Europa und den Vereinigten Staaten. Das Unternehmen bietet CONNECT Radio Frequency Silicon-on-Insulator für Smartphone-Frontend-Module an; CONNECT FD SOI für KI-Anwendungen; CONNECT Piezoelektrische-auf-Isolator-HF-Filter für Smartphones; Photonik- und optische Sensorlösung für die Integration optischer Siliziumkomponenten in Rechenzentren; und CONNECT RF Galliumnitrid, das die Effizienz des Frequenzsystems und die Leistungsdichte von 5G-Mobilfunkinfrastrukturen und mobilen Geräten im Sub-6-GHz- und mmWave-Band der nächsten Generation erhöht. Darüber hinaus bietet das Unternehmen Power-SOI-Produkte für leistungselektronische Geräte im Automobil- und Industriebereich an. Auto Smartsic zur Kostenoptimierung von Elektrofahrzeugen und Industrieanwendungen; und Photonics SOI, das photonische Komponenten auf einem Silizium-auf-Isolator-Substrat (SOI) integriert, um die optischen Kommunikationsfähigkeiten zu verbessern, sowie AUTO FD-SOI für Automobilradar und -prozessoren. Darüber hinaus bietet das Unternehmen Imager-SOI an, eine kompakte Lösung für hochauflösende 3D-Bilder und kleinen Formfaktor; PD-SOI bietet komplexe Rechenfähigkeiten und Funktionalitäten im Bereich Cloud Computing und Netzwerkausrüstung; FD-SOI-Technologie, die das optimale Gleichgewicht zwischen digitaler Leistung, Mixed-Signal-/HF-Kompatibilität sowie Stromverbrauch und Kosten bietet; und MEMS-SOI, eine isolierende Oxidschicht und eine unterstützende Griffschicht. Es bedient die Märkte Mobilkommunikation, Automobil, Industrie, Edge-KI und Internet der Dinge sowie Cloud-KI und Netzwerkinfrastruktur. Soitec SA wurde 1992 gegründet und hat seinen Hauptsitz in Bernin, Frankreich.",,58.526974,-0.346,,-0.37146,4084580608.0,1.13,0.52,0.03
AI / Tech,Semiconductor Materials,000660.KS,2673000.0,2987000.0,243980.46875,SK hynix,"SK hynix Inc. betreibt über seine Tochtergesellschaften Forschung, Entwicklung, Herstellung, Vertrieb und Verkauf von Halbleiterbauelementen in Korea, China, dem übrigen Asien, den Vereinigten Staaten, Europa und international. Es bietet DRAM, wie Serverspeicher, Grafikspeicher, mobiler Speicher, PC-Speicher, Verbraucherspeicher; NAND-Flash-Speicher; SSD; und MCP-Produkte. Darüber hinaus ist das Unternehmen im Gießereigeschäft tätig und produziert Nicht-Speicher-Halbleiter. Das Unternehmen bietet seine Produkte für Server-, Netzwerk-, Mobil-, Personalcomputer-, Verbraucher- und Automobilanwendungen an. Das Unternehmen war früher als Hynix Semiconductor Inc. bekannt und änderte seinen Namen im März 2012 in SK hynix Inc.. SK hynix Inc. wurde 1949 gegründet und hat seinen Hauptsitz in Icheon-si, Südkorea.",,6.1599183,1.981,3.966,0.5689,1897442194751488.0,1.87,0.89,0.77
AI / Tech,Semiconductor Materials,005930.KS,339500.0,374500.0,58861.82454318937,SamsungElec,"Samsung Electronics Co., Ltd. ist weltweit in den Bereichen Unterhaltungselektronik, Informationstechnologie und Mobilkommunikation sowie Gerätelösungen tätig. Das Unternehmen ist in vier Geschäftsbereichen tätig: Device eXperience (DX), Device Solutions (DS), SDC und Harman. Das Unternehmen bietet Smartphones, Tablets, Audio-Sounds, Uhren, Schalter und Zubehör; Fernseher und Tongeräte; Geräte, einschließlich Kühlschränke, Waschmaschinen und Trockner, Staubsauger, Kochgeräte, Geschirrspüler, Klimaanlagen und Luftreiniger; Monitore und Speicherprodukte; Displays sowie intelligente und LED-Beschilderungen; und anderes Zubehör. Darüber hinaus ist das Unternehmen in den Bereichen Risikokapitalinvestitionen, Cloud-Dienste, Installation von Netzwerkgeräten, Dienstleistungen für Halbleiterausrüstung, digitale Werbeplattformen, Marketing, Beratung, Anbieter vernetzter Dienste, Logistik, Finanzierung und Softwaredesign tätig. Darüber hinaus bietet das Unternehmen Lohnverarbeitung und Vertrieb von Halbleitern und Anzeigetafeln an; Entwicklung und Verkauf von Netzwerklösungen; Herstellung von Halbleitern und Lebensmitteln; die Erbringung von Reparaturdienstleistungen für elektronische Geräte; und Entwicklung und Lieferung von Software zur Fehler- und Qualitätskontrolle bei Halbleiterprozessen sowie von digitalen Fernsehgeräten, Gießereien und System-Großintegration (LSI). Darüber hinaus bietet das Unternehmen vernetzte Fahrzeugsysteme, Audio- und Videoprodukte, Unternehmensautomatisierungslösungen und vernetzte Dienste. Samsung Electronics Co., Ltd. wurde 1969 gegründet und hat seinen Sitz in Suwon-si, Südkorea.",,5.4560003,0.692,4.921,0.21459,2229348274798592.0,0.89,0.89,0.78
AI / Tech,Semiconductor Materials,AIXA.DE,52.119998931884766,62.65999984741211,11.641035044555371,AIXTRON SE                    N,"Die AIXTRON SE produziert und vertreibt zusammen mit ihren Tochtergesellschaften Depositionsanlagen für die Halbleiterindustrie in Asien, Europa und den Vereinigten Staaten. Das Unternehmen bietet G10-SiC, G10-GaN, G10-AsP, AIX G5+ C, Closed Coupled Showerhead-Systeme für Forschung und Entwicklung, AIX 2800G4-TM und AIX G5 WW C an. Darüber hinaus entwickelt, produziert und installiert es Geräte für die Abscheidung von Halbleitermaterialien; und bietet Abscheidungsprozesse, Beratung, Schulung, Kundensupport und andere damit verbundene Dienstleistungen sowie Peripheriegeräte und Dienstleistungen zur Unterstützung des Betriebs seiner Systeme an. Darüber hinaus beschäftigt sich das Unternehmen mit der Lieferung von Depositionsanlagen für die Massenproduktion; sowie Forschungs- und Entwicklungsaktivitäten sowie Vorserienproduktionsaktivitäten. Seine Produkte werden in den Bereichen Laser, LED, Anzeigetechnologien, optische Datenübertragung, SiC- und GaN-Leistungselektronik und anderen Anwendungen eingesetzt. Die AIXTRON SE wurde 1983 gegründet und hat ihren Hauptsitz in Herzogenrath, Deutschland.",98.33962,40.156246,-0.472,,0.11563,5878398464.0,0.54,0.79,0.59
AI / Tech,Semiconductor Materials,IQE.L,46.79999923706055,72.9000015258789,4.65500020980835,IQE PLC ORD 1P,"IQE plc entwickelt, produziert und vertreibt zusammen mit seinen Tochtergesellschaften fortschrittliche Halbleitermaterialien. Das Unternehmen ist in drei Segmenten tätig: Wireless, Photonics und CMOS++. Das Unternehmen produziert und vertreibt Verbindungshalbleitermaterialien für den Mobilfunkmarkt, zu dem Hochfrequenzgeräte für die drahtlose Kommunikation gehören, sowie für den Photonikmarkt, zu dem Anwendungen gehören, die sichtbares und infrarotes Licht übertragen und erfassen. Es bietet auch fortschrittliche Halbleitermaterialien im Zusammenhang mit Silizium an. Das Unternehmen ist in den Vereinigten Staaten, dem übrigen amerikanischen Kontinent, Frankreich, Deutschland, Israel, dem Vereinigten Königreich, dem übrigen Europa, dem Nahen Osten, Afrika, der Volksrepublik China, Japan, Taiwan und dem übrigen asiatisch-pazifischen Raum tätig. Das Unternehmen wurde 1988 gegründet und hat seinen Hauptsitz in Cardiff, Großbritannien.",,-104.0,0.001,,-0.37713,619605312.0,0.76,0.62,0.24
AI / Tech,Robotics & Automation,6954.T,7026.0,8880.0,3619.31635286877,FANUC CORPORATION,"Die Fanuc Corporation beschäftigt sich mit der Entwicklung, Herstellung, dem Verkauf und der Wartung von Produkten, die in automatisierten Produktionssystemen in Japan, den Vereinigten Staaten, Europa, China, dem übrigen Asien und international eingesetzt werden. Es bietet CNC-Serien, Roboter und Robomaschinenprodukte an, wie z. B. kompakte Bearbeitungszentren, elektrische Spritzgießmaschinen, Drahterosionsmaschinen; und Feldsystem-Basispaket und AI-Servomonitore sowie Servomotoren und Laser. Das Unternehmen wurde 1950 gegründet und hat seinen Hauptsitz in Yamanashi, Japan.",39.370167,40.58691,0.106,0.11,0.19414,6556370862080.0,0.21,0.65,0.3
Energy,Power Equipment,SIE.DE,267.5,280.20001220703125,198.0,SIEMENS AG                    N,"Die Siemens Aktiengesellschaft, ein Technologieunternehmen, konzentriert sich auf die Bereiche Automatisierung und Digitalisierung in Europa, der Gemeinschaft Unabhängiger Staaten, Afrika, dem Nahen Osten, Amerika, Asien und Australien. Das Unternehmen ist in den Segmenten Digital Industries, Smart Infrastructure, Mobility, Siemens Healthineers und Siemens Financial Services (SFS) tätig. Das Segment Digital Industries bietet Automatisierungssysteme und Software für Fabriken, numerische Steuerungssysteme, Servomotoren, Antriebe und Wechselrichter sowie integrierte Automatisierungssysteme für Werkzeugmaschinen und Produktionsmaschinen; Prozessleitsysteme, Maschine-zu-Maschine-Kommunikationsprodukte, Sensoren und Radiofrequenz-Identifikationssysteme; Software für Produktions- und Produktlebenszyklusmanagement sowie Simulation und Test mechatronischer Systeme. Das Segment „Smart Infrastructure“ bietet Produkte, Systeme, Lösungen, Dienstleistungen und Software zur Unterstützung eines nachhaltigen Übergangs von fossilen und erneuerbaren Energiequellen; nachhaltige Gebäude und Gemeinden; und Gebäude, Elektrifizierung und elektrische Produkte. Das Segment Mobilität bietet Schienenpersonen- und Gütertransporte wie U-Bahn-Systeme, Straßenbahnen und Stadtbahnen sowie Nahverkehrszüge sowie Züge und Reisezugwagen; Lokomotiven und Lösungen für automatisierten Transport und Leasing; Produkte und Lösungen für die Bahnautomatisierung und Elektrifizierung; Wartung und digitale Dienstleistungen; sowie digitale und cloudbasierte Lösungen und damit verbundene Dienstleistungen. Das Segment Siemens Healthineers entwickelt, produziert und vertreibt verschiedene diagnostische und therapeutische Produkte und Dienstleistungen; und bietet klinische Beratungs- und Schulungsdienste an. Das Segment Siemens Financial Services bietet Fremd- und Eigenkapitalinvestitionen an; Leasing, Kredite und Betriebskapital; Struktur-, Ausrüstungs- und Projektfinanzierung; und Finanzberatungsdienste. Das Unternehmen wurde 1847 gegründet und hat seinen Hauptsitz in München, Deutschland.",27.691511,20.942432,-0.0,-0.086,0.09688,204033851392.0,0.31,0.85,0.69
Energy,Power Equipment,HUBB,517.02001953125,563.8055092962444,397.2450309206467,Hubbell Inc,"Hubbell Incorporated produziert und vertreibt zusammen mit seinen Tochtergesellschaften Elektro- und Versorgungslösungen in den Vereinigten Staaten und international. Das Unternehmen ist in zwei Segmenten tätig: Electrical Solutions und Utility Solutions. Das Segment „Utility Solution“ bietet kritische Komponenten, die es dem Netz ermöglichen, Energie zu übertragen und zu verteilen, sowie Kommunikations- und Steuerungstechnologien, einschließlich Komponenten für die Übertragung und Verteilung von Versorgungsunternehmen, wie Ableiter, Isolatoren, Steckverbinder, Anker, Durchführungen, Gehäuse, Ausschnitte und Schalter; und Lösungen, die den Rand der Versorgungsinfrastruktur bedienen und intelligente Zähler, Kommunikationssysteme sowie Schutz- und Steuergeräte umfassen. Das Unternehmen verkauft seine Produkte unter verschiedenen Marken und/oder Warenzeichen an die Märkte für Stromverteilung, Umspannwerke und Übertragung sowie an Märkte für Netzschutz und -steuerung, Verbrauchszähler und moderne Messinfrastruktur sowie an Telekommunikations- und Gasverteilungsmärkte. Das Segment Electrical Solution bietet Verkabelungsgeräte für Standard- und Spezialanwendungen, elektrische Rohbauprodukte, Verbindungs- und Erdungsprodukte sowie andere elektrische Geräte für den Einsatz in industriellen, kommerziellen und institutionellen Einrichtungen durch Elektroinstallateure, Wartungspersonal, Elektriker, Versorgungsunternehmen und Telekommunikationsunternehmen. Darüber hinaus entwickelt und fertigt das Unternehmen verschiedene Industriesteuerungen und Kommunikationssysteme für den Einsatz im privaten und industriellen Bereich sowie in der Öl- und Gasindustrie sowie im Bergbau. Dieses Segment verkauft seine Produkte über Elektro- und Industriehändler, Baumärkte, Einzelhandels- und Eisenwarengeschäfte sowie produktorientierte Internetseiten für Privathaushalte. und Spezialanwendungsprodukte hauptsächlich über Großhändler an Vertragspartner, Industriekunden und Erstausrüster. Das Unternehmen wurde 1888 gegründet und hat seinen Hauptsitz in Shelton, Connecticut.",30.57481,22.266151,0.111,0.125,0.15105,27320256512.0,0.08,0.72,0.44
Energy,Renewables,VWS.CO,172.5,203.0,92.83605359055844,Vestas Wind Systems A/S,"Vestas Wind Systems A/S beschäftigt sich mit der Entwicklung, Herstellung, Installation und Wartung von Windkraftanlagen in den USA, Dänemark und international. Das Unternehmen ist in zwei Segmenten tätig: Energielösungen und Service. Das Segment Power Solutions bietet Onshore- und Offshore-Windkraftanlagen, Windturbinen, Entwicklungsstandorte usw. Das Segment Service befasst sich mit dem Verkauf von Serviceverträgen, Ersatzteilen und damit verbundenen Aktivitäten. Vestas Wind Systems A/S wurde 1898 gegründet und hat seinen Hauptsitz in Aarhus, Dänemark.",27.165356,16.008207,0.144,15.162,0.04425,169220538368.0,0.11,0.72,0.45
Energy,Renewables,ORSTED.CO,144.6999969482422,327.5,102.82324981689453,ORSTED A/S,"Ørsted A/S besitzt, entwickelt, baut und betreibt zusammen mit seinen Tochtergesellschaften Offshore- und Onshore-Windparks, Solarparks sowie Energiespeicher- und Kraft-Wärme-Kopplungsanlagen (KWK). Das Unternehmen ist in den Segmenten Offshore, Onshore sowie Bioenergie und Sonstiges tätig. Das Offshore-Segment besitzt, entwickelt, baut und betreibt Offshore-Windparks in Europa, den Vereinigten Staaten und im asiatisch-pazifischen Raum. Das Onshore-Segment besitzt, entwickelt, baut und betreibt Onshore-Wind- und Solarparks in den Vereinigten Staaten, einschließlich integrierter Speicher. Das Segment Bioenergie & Sonstiges erzeugt Wärme und Strom und bietet Nebendienstleistungen aus KWK-Anlagen in Dänemark an; und optimiert sein Gasportfolio und verwaltet sein dänisches und schwedisches B2B-Geschäft. Das Unternehmen hieß früher DONG Energy A/S und änderte im November 2017 seinen Namen in Ørsted A/S. Ørsted A/S wurde 1972 gegründet und hat seinen Sitz in Fredericia, Dänemark.",,15.005625,0.334,-0.849,0.00211,191157665792.0,0.05,0.19,-0.63
Energy,Oil & Gas,SHEL,76.52999877929688,94.04718035075285,66.65364469592573,Shell PLC,"Shell plc ist als Energie- und Petrochemieunternehmen in Europa, Asien, Ozeanien, Afrika, den Vereinigten Staaten und anderen Teilen Amerikas tätig. Das Unternehmen ist in den folgenden Segmenten tätig: Integriertes Gas, Upstream, Marketing, Chemikalien und Produkte sowie Lösungen für erneuerbare Energien und Energie. Das Unternehmen erforscht und fördert Erdgas, um Flüssigerdgas herzustellen oder es in Gas-to-Liquids (GTL)-Kraftstoffe und andere Produkte umzuwandeln; erforscht und fördert Rohöl, Erdgas und Erdgasflüssigkeiten; und betreibt die Vermarktung und den Transport von Öl, Gas und Flüssigkeiten, unterstützt durch die Infrastruktur, die erforderlich ist, um sie auf den Markt zu bringen oder in den chemischen Produktionsanlagen und Raffinerien von Shell zu verarbeiten. Darüber hinaus ist das Unternehmen im Marketing tätig, das Mobilität, Schmierstoffe und auf Dekarbonisierung ausgerichtete Sektoren umfasst. betreibt ein Einzelhandelsnetzwerk, das das Laden von Elektrofahrzeugen, den Convenience-Einzelhandel und den Großhandel mit kommerziellen Kraftstoffen für Transport und Industrie umfasst; verkauft Produkte für den Straßentransport und Maschinen in den Bereichen Fertigung, Bergbau, Energieerzeugung, Landwirtschaft und Baugewerbe; und bietet kohlenstoffarme Energielösungen wie Biokraftstoffe für ein breites Spektrum kommerzieller Kunden an, darunter solche aus der Luftfahrt-, Schifffahrts- und Landwirtschaftsbranche. Darüber hinaus bietet das Unternehmen Chemikalien und Produkte an, darunter Chemieproduktionsanlagen mit eigenem Marketingnetzwerk sowie Raffinerien, die Rohöl und andere Rohstoffe in eine Reihe von Ölprodukten umwandeln, die weltweit für den häuslichen, industriellen und Transportgebrauch transportiert und vermarktet werden; und betreibt ein Pipeline-Geschäft sowie den Handel und die Optimierung von Rohöl, Ölprodukten und Petrochemikalien. Das Unternehmen war früher als Royal Dutch Shell plc bekannt und änderte im Januar 2022 seinen Namen in Shell plc. Shell plc wurde 1897 gegründet und hat seinen Hauptsitz in London, Vereinigtes Königreich.",11.920561,8.268257,0.007,0.266,0.07014,212141654016.0,-0.16,0.36,-0.28
Energy,Oil & Gas,TTE.PA,68.36000061035156,81.25,47.98910563062345,TOTALENERGIES,"TotalEnergies SE, ein integriertes Energieunternehmen, produziert und vermarktet Öl und Biokraftstoffe, Erdgas, Biogas und kohlenstoffarmen Wasserstoff, erneuerbare Energien und Strom in Frankreich, den Vereinigten Staaten, Europa, Brasilien, Indien und international. Das Unternehmen hieß früher TOTAL SE und änderte im Juni 2021 seinen Namen in TotalEnergies SE. TotalEnergies SE wurde 1924 gegründet und hat seinen Hauptsitz in Courbevoie, Frankreich.",11.527825,8.02178,0.034,0.571,0.08201,151973543936.0,-0.12,0.61,0.22
