Main Theme,Sub Theme,Ticker,Preis,52W High,52W Low,Name,Description,Trend Score,Momentum
AI / Tech,Robotics & Automation,TER,382.1700134277344,390.79998779296875,70.14999343039852,"Teradyne, Inc.","Teradyne, Inc. engages in the design, development, manufacture, and sale of automated test systems and robotics products in the United States, Asia Pacific, Europe, the Middle East, and Africa. The company operates through Semiconductor Test, Robotics, and Other segments. The Semiconductor Test segment offers products and services for wafer level and device package testing, and system level testing of semiconductor devices in automotive, industrial, communications, consumer, smartphones, cloud, computer and electronic game, and other applications. This segment also provides FLEX test platform systems; J750 test system to address the volume semiconductor devices, including microcontrollers; Magnum platform that tests memory devices, such as flash memory and DRAM; and ETS platform for semiconductor manufacturers, and assembly and test subcontractors in the analog/mixed signal markets. It serves integrated device manufacturers that integrate the fabrication of silicon wafers into their business; fabless companies that outsource the manufacturing of silicon wafers; foundries; and semiconductor assembly and test providers. The Robotics segment provides collaborative robotic arms and autonomous mobile robots for manufacturing, logistics, and industrial customers. It also provides product test instruments which includes operations related to the design, manufacturing and marketing of products and services for defense/aerospace test, circuit-board test, wireless test systems, and silicon photonics testing. Teradyne, Inc. was incorporated in 1960 and is headquartered in North Reading, Massachusetts.",0.97,0.95
AI / Tech,Robotics & Automation,ISRG,487.0199890136719,603.8800048828125,427.8399963378906,"Intuitive Surgical, Inc.","Intuitive Surgical, Inc. develops, manufactures, and markets products that enable physicians and healthcare providers to enhance the quality of and access to minimally invasive care in the United States and internationally. It offers the da Vinci Surgical System that enables surgical procedures using a minimally invasive approach; and Ion endoluminal system, which extends its commercial offerings beyond surgery into diagnostic endoluminal procedures enabling minimally invasive biopsies in the lung. The company also provides a suite of stapling, energy, and core instrumentation for its multi-port da Vinci surgical systems; progressive learning pathways to support the use of its technology; infrastructure of customer service and support specialists, a complement of services to its customers, including installation, repair, maintenance, 24/7 technical support, and proactive system health monitoring; and integrated digital capabilities providing connected offerings, streamlining performance for hospitals with program-enhancing insights. It sells its products through direct sales organizations, such as capital and clinical sales teams. Intuitive Surgical, Inc. was incorporated in 1995 and is headquartered in Sunnyvale, California.",0.34,-0.33
AI / Tech,Robotics & Automation,PATH,10.8100004196167,19.84000015258789,9.279999732971191,"UiPath, Inc.","UiPath, Inc. provides an automation platform that offers a range of robotic process automation (RPA) solutions primarily in the United States, Romania, the United Kingdom, the Netherlands, and internationally. It offers the UiPath platform, an integrated enterprise software platform that enables AI agents, robots, people, and models to work together in coordinated workflows. The company's UiPath platform includes the UiPath Maestro process orchestration and process intelligence; UiPath agent builder; RPA and API automation; UiPath intelligent xtraction and processing; UiPath test cloud for testing and quality assurance; UiPath packaged and prebuilt agentic solutions; and centralized governance capabilities that apply across automations, AI agents, and manual tasks. It serves the financial services, healthcare, manufacturing, retail, and public sectors. The company was founded in 2005 and is headquartered in New York, New York.",0.14,-0.71
AI / Tech,Robotics & Automation,AZTA,26.469999313354492,41.72999954223633,19.8700008392334,"Azenta, Inc.","Azenta, Inc. provides biological and chemical compound sample exploration and management solutions for the life sciences industry in the United States, China, the United Kingdom, rest of Europe, the Asia Pacific, and internationally. It operates through Sample Management Solutions and Multiomics segments. The Sample Management Solutions segment provides sample management products and services, including automated stores, cryogenic systems, automated sample tubes, consumables and instruments, and controlled rate thawing devices, as well as sample repository services. This segment also offers consultation services to clients throughout their experimental design and implementation processes. The Multiomics segment provides genomic and other sample analysis services comprising gene sequencing, gene synthesis, and related services. The company has a strategic partnership with Frontier Space Ltd to conduct scientific experiments in space. The company was formerly known as Brooks Automation, Inc. and changed its name to Azenta, Inc. in December 2021. Azenta, Inc. was founded in 1978 and is headquartered in Burlington, Massachusetts.",0.3,-0.4
AI / Tech,Robotics & Automation,NNDM,1.7949999570846558,2.319999933242798,1.309999942779541,Nano Dimension Ltd.,"Nano Dimension Ltd., together with its subsidiaries, provides industrial manufacturing solutions for design-to-manufacturing of electronics and mechanical parts in the Americas, the Asia Pacific, Europe, the Middle East, and Africa. Its product groups include advanced hydraulic systems; resins; dental parts services; binder jetting products for metal and sandcasting; additively manufactured electronics; additive manufacturing digital light processing-based systems for industrial and health applications; surface-mount technology products; digital printing sub-components hardware and software; and desktop and industrial fused filament fabrication solutions. The company sells its products to aerospace, defense, automotive, electronics, medical, research, and academia, as well as government organizations. Nano Dimension Ltd. is headquartered in Waltham, Massachusetts.",0.48,-0.04
AI / Tech,Robotics & Automation,XONE,49.48500061035156,49.5,47.63331302530299,BondBloxx Bloomberg One Year Ta,"Under normal circumstances, the fund will invest at least 80% of its net assets (plus the amount of any borrowings for investment purposes) in a portfolio of U.S. Treasury securities that collectively have an average duration of approximately 1 year, either directly or indirectly (e.g., through derivatives). The index is comprised of certain U.S. Treasury notes and bonds that are included in the Bloomberg U.S. Treasury Index. It is non-diversified.",0.99,0.98
AI / Tech,Robotics & Automation,TRMB,68.83000183105469,87.5,56.33000183105469,Trimble Inc.,"Trimble Inc. offers technology solutions and platform that enable office professionals and field workers to connect workflows and industry lifecycles in North America, Europe, the Asia Pacific, and internationally. The company provides architecture and interior design; building information modeling, engineering, and virtual design and construction; and construction and owner software products. It also offers field and office software for estimating and job cost management, and project design and visualization; software for 3D design and data sharing; systems to guide and control construction equipment, such as excavators, bulldozers, wheel loaders, motor graders, and paving equipment; systems to monitor, track, and manage assets, equipment, and workers; and software to facilitate the management of the construction process and for sharing and communication of data in real time. In addition, it provides positioning services comprising VRSNow; CenterPoint RTX; FieldPoint RTX; Rangepoint RTX; ViewPoint RTX; and Trimble xFill services. Further, it offers transportation and logistics solutions for shippers, carriers, retailers, and intermediaries, such as carrier transportation management software (TMS) and maintenance solutions to manage core transportation operations and maintenance workflows; transporeon solutions to provide a cloud-based ecosystem that manages the transportation lifecycle from freight sourcing and procurement through transport execution, dock and yard management, and auditing; and MAPS, a mapping and routing solutions that provide the industry standard for truck-specific routing, mileage, and navigation. It sells its technology solutions directly to end users and through software integrations. The company was formerly known as Trimble Navigation Limited and changed its name to Trimble Inc. in October 2016. Trimble Inc. was founded in 1978 and is headquartered in Westminster, Colorado.",0.4,-0.2
Energy,Grid Infrastructure,NEE,91.37999725341797,96.20999908447266,62.035073574638794,"NextEra Energy, Inc.","NextEra Energy, Inc., through its subsidiaries, generates, stores, transmits, distributes, and sells electric power to retail and wholesale customers in North America. It operates through Florida Power & Light Company (FPL) and NEER segments. The company generates electricity from wind, solar, nuclear, natural gas, and other clean energy assets. It also invests in generation, storage, transmission, and distribution facilities; owns, develops, constructs, manages, and operates generation facilities, including renewables, nuclear and natural gas, and battery storage facilities in the wholesale energy market in the United States and Canada, as well as electric and gas transmission assets, and natural gas pipelines; provides full energy and capacity requirement services; markets and trades in energy-related commodities; and participates in the production of natural gas, natural gas liquids, and oil. As of December 31, 2025, the company had approximately 35,963 megawatts of net generating capacity; approximately 93,000 circuit miles of transmission and distribution lines; and 932 substations. It serves approximately 12 million people through approximately 6 million customer accounts on the east and lower west coasts of Florida. The company was formerly known as FPL Group, Inc. and changed its name to NextEra Energy, Inc. in 2010. NextEra Energy, Inc. was founded in 1925 and is headquartered in Juno Beach, Florida.",0.86,0.72
Energy,Grid Infrastructure,DUK,126.08999633789062,134.49000549316406,107.41640702855703,Duke Energy Corporation (Holdin,"Duke Energy Corporation, through its subsidiaries, operates as an energy company in the United States. The company operates through two segments: Electric Utilities and Infrastructure (EU&I); and Gas Utilities and Infrastructure (GU&I). The EU&I segment generates, transmits, distributes, and sells electricity to customers in the Southeast and Midwest regions. It generates electricity through coal, hydroelectric, natural gas, oil, renewables, and nuclear fuel. This segment also engages in the wholesale of electricity to municipalities, electric cooperative utilities, and other load-serving entities. The GU&I segment distributes natural gas to customers in the residential, commercial, industrial, and power generation natural gas sectors; and invests in pipeline transmission projects, renewable natural gas projects, and natural gas storage facilities. The company was formerly known as Duke Energy Holding Corp. and changed its name to Duke Energy Corporation in April 2006. Duke Energy Corporation was founded in 1904 and is headquartered in Charlotte, North Carolina.",0.69,0.38
Energy,Grid Infrastructure,SO,92.41999816894531,99.58000183105469,80.44973906216417,Southern Company (The),"The Southern Company, through its subsidiaries, engages in the sale of electricity. The company offers electric service to retail customers and wholesale customers; and energy-related products and services to natural gas choice markets. It also develops, constructs, acquires, owns, operates, and manages power generation assets, as well as battery energy storage projects; sells electricity at market-based rates in the wholesale market; and deploys microgrids for commercial, industrial, governmental, and utility customers. In addition, the company is involved in the distribution of natural gas in Illinois, Georgia, Virginia, and Tennessee; distributes energy and resilience solutions; and invests in telecommunications. The Southern Company was incorporated in 1945 and is headquartered in Atlanta, Georgia.",0.63,0.25
Energy,Grid Infrastructure,EXC,46.38999938964844,50.650001525878906,40.63604677740564,Exelon Corporation,"Exelon Corporation, a utility services holding company, engages in the energy distribution and transmission businesses in the United States. The company is involved in the purchase and regulated retail sale of electricity and natural gas; transmission and distribution of electricity; and distribution of natural gas to retail customers. It serves residential, commercial, industrial, and public authorities and electric railroads customers. Exelon Corporation was incorporated in 1999 and is headquartered in Chicago, Illinois.",0.57,0.15
Energy,Grid Infrastructure,AEP,132.32000732421875,137.74000549316406,95.15443263188477,American Electric Power Company,"American Electric Power Company, Inc., an electric public utility holding company, engages in the generation, transmission, and distribution of electricity for sale to retail and wholesale customers in the United States. It operates through Vertically Integrated Utilities, Transmission and Distribution Utilities, AEP Transmission Holdco, and Generation & Marketing segments. The company generates electricity using coal and lignite, nuclear, natural gas, renewable, hydro, solar, wind, and other energy sources; owns, operates, maintains, and invests in transmission infrastructure; and engages in the retail supply, and wholesale energy trading and marketing businesses. It operates approximately 252,000 circuit miles of distribution lines; 38,000 circuit miles of transmission lines; and 25,000 MWs of regulated owned generating capacity. American Electric Power Company, Inc. was incorporated in 1906 and is headquartered in Columbus, Ohio.",0.87,0.75
Energy,Grid Infrastructure,CEG,287.2300109863281,411.6752956060286,194.86226682619923,Constellation Energy Corporatio,"Constellation Energy Corporation produces and sells energy products and services in the United States. The company operates through five segments: Mid-Atlantic, Midwest, New York, ERCOT, and Other Power Regions. It offers electricity, natural gas, energy-related products, and sustainable solutions. The company has approximately 31,676 megawatts of generating capacity consisting of nuclear, wind, solar, natural gas, and hydroelectric assets. It serves distribution utilities, municipalities, cooperatives, and commercial, industrial, public sector, and residential customers. The company was incorporated in 2021 and is headquartered in Baltimore, Maryland.",0.43,-0.15
Energy,Grid Infrastructure,VST,156.15499877929688,219.21490839115506,108.03769130116714,Vistra Corp.,"Vistra Corp., together with its subsidiaries, operates as an integrated retail electricity and power generation company in the United States. The company operates through five segments: Retail, Texas, East, West, and Asset Closure. The company retails electricity and natural gas to residential, commercial, and industrial customers across states in the United States and the District of Columbia. It is also involved in electricity generation, wholesale energy purchases and sales, commodity risk management, fuel procurement, and fuel logistics management activities. In addition, the company engages in decommissioning and reclamation of retired generation facilities, including mines, and battery removal and remediation activities. It serves approximately 5 million customers with a generation capacity of approximately 44,000 megawatts with a portfolio of natural gas, nuclear, coal, solar, and battery energy storage facilities. The company was formerly known as Vistra Energy Corp. and changed its name to Vistra Corp. in July 2020. Vistra Corp. was founded in 1882 and is based in Irving, Texas.",0.43,-0.13
Energy,Grid Infrastructure,XEL,78.98999786376953,83.61198499872275,63.73657148334318,Xcel Energy Inc.,"Xcel Energy Inc., through its subsidiaries, operates as an electric and natural gas delivery company in the United States. It operates through Regulated Electric Utility and Regulated Natural Gas Utility segments. The company generates, purchases, transmits, distributes, and sells electricity through its energy portfolio, including wind, nuclear, hydroelectric, biomass, and solar power from both owned generation facilities and PPAs, as well as its fossil fuel energy portfolio, such as coal and natural gas; sale and resale of wholesale transmission service; and engages in wholesale commodity and trading operations. It also purchases, transports, stores, distributes, and sells natural gas; develops and leases natural gas pipelines and storage facilities; operates interstate natural gas pipeline; and invests in rental housing projects, energy technology companies, and community solar garden nonregulated assets. It serves electric and natural gas customers in portions of Colorado, Michigan, Minnesota, New Mexico, North Dakota, South Dakota, Texas, and Wisconsin. The company was formerly known as Northern States Power company. Xcel Energy Inc. was incorporated in 1909 and is headquartered in Minneapolis, Minnesota.",0.77,0.53
Energy,Grid Infrastructure,ED,108.86499786376953,116.2300033569336,93.73677607441256,"Consolidated Edison, Inc.","Consolidated Edison, Inc., through its subsidiaries, engages in the regulated electric, gas, and steam delivery businesses in the United States. The company offers electric services to approximately 3.7 million customers in New York City and Westchester County; gas to approximately 1.1 million customers in Manhattan, the Bronx, parts of Queens, and Westchester County; and steam to approximately 1,490 customers in parts of Manhattan. It also supplies electricity to approximately 0.3 million customers in southeastern New York and northern New Jersey; and gas to approximately 0.1 million customers in southeastern New York. In addition, the company operates 552 circuit miles of transmission lines; 16 transmission substations; 63 distribution substations; 89,675 in-service line transformers; 3,764 pole miles of overhead distribution lines; and 2,417 miles of underground distribution lines, as well as 4,374 miles of mains and 379, 939 service lines for natural gas distribution. Further, it invests in electric and gas transmission projects. The company primarily sells electricity to industrial, commercial, residential, and government customers. Consolidated Edison, Inc. was founded in 1823 and is based in New York, New York.",0.67,0.35
Energy,Grid Infrastructure,D,60.880001068115234,66.85750096621835,50.108906035070724,"Dominion Energy, Inc.","Dominion Energy, Inc. provides regulated electricity and natural gas services in the United States. It operates through Dominion Energy Virginia, Dominion Energy South Carolina, and Contracted Energy segments. The Dominion Energy Virginia segment engages in the generation, distribution, and transmission of electricity to approximately 2.8 million residential, commercial, industrial, and governmental customers in Virginia and North Carolina. The Dominion Energy South Carolina segment generates, transmits, and distributes electricity to approximately 0.8 million customers in the central, southern, and southwestern portions of South Carolina; and distributes natural gas to approximately 0.5 million residential, commercial, and industrial customers in South Carolina. The Contracted Energy segment is involved in the nonregulated long-term contracted renewable electric generation fleet and renewable natural gas facilities. As of December 31, 2025, the company's portfolio of assets included approximately 30.7 GW of electric generating capacity, 10,800 miles of electric transmission lines, and 80,400 miles of electric distribution lines. The company was formerly known as Dominion Resources, Inc. Dominion Energy, Inc. was incorporated in 1983 and is headquartered in Richmond, Virginia.",0.64,0.29
Energy,Grid Infrastructure,PCG,17.03499984741211,19.105194123926452,12.871283934834956,Pacific Gas & Electric Co.,"PG&E Corporation, through its subsidiary, Pacific Gas and Electric Company, engages in the sale and delivery of electricity and natural gas to customers in northern and central California, the United States. It generates electricity using nuclear, hydroelectric, fossil fuel-fired, fuel cells, and photovoltaic sources. The company owns and operates interconnected transmission lines; electric transmission substations, distribution lines, switching and distribution substations; and natural gas transmission, storage, and distribution systems consisting of distribution pipelines, backbone and local transmission pipelines, and various storage facilities. It serves residential, commercial, industrial, and agricultural customers, as well as natural gas-fired electric generation facilities. The company was incorporated in 1995 and is based in Oakland, California.",0.67,0.34
Energy,Grid Infrastructure,AWK,132.3300018310547,146.81540803367855,120.46324992609382,"American Water Works Company, I","American Water Works Company, Inc., through its subsidiaries, provides water and wastewater services in the United States. It offers water and wastewater services on military installations; and undertakes contracts with municipal customers, primarily to operate and manage water and wastewater facilities, as well as offers other related services. The company also operates approximately 80 surface water treatment plants; 520 groundwater treatment plants; 170 wastewater treatment plants; 55,000 miles of transmission, distribution, and collection mains and pipes; 1,200 groundwater wells; 1,800 water and wastewater pumping stations; 1,100 treated water storage facilities; and 75 dams. In addition, it offers water and wastewater services to 14 states serving approximately 3.6 million active customers. The company serves residential customers; commercial customers, including food and beverage providers, commercial property developers and proprietors, and energy suppliers; fire service and private fire customers; industrial customers, such as large-scale manufacturers, mining, and production operations; public authorities comprising government buildings and other public sector facilities, such as schools and universities; and other utilities and community water and wastewater systems. The company was founded in 1886 and is headquartered in Camden, New Jersey.",0.45,-0.1
Energy,Grid Infrastructure,PPL,38.279998779296875,40.11000061035156,32.09851087101883,PPL Corporation,"PPL Corporation provides electricity and natural gas to approximately 3.6 million customers in the United States. It operates in three segments: Kentucky Regulated, Pennsylvania Regulated, and Rhode Island Regulated. The company engages in the transmission and distribution of electricity in eastern and central Pennsylvania; generation, transmission, distribution, and sale of electricity in Kentucky, Virginia, and Rhode Island; distribution and sale of natural gas in Kentucky and Rhode Island; sale of wholesale electricity in Kentucky; and generation of electricity from power plants in Kentucky. It generates electricity from coal, gas, hydro, and solar sources. The company was formerly known as PP&L Resources, Inc. and changed its name to PPL Corporation in 2000. PPL Corporation was founded in 1920 and is headquartered in Allentown, Pennsylvania.",0.77,0.54
Energy,Grid Infrastructure,WEC,113.7300033569336,119.62000274658203,98.16791390609171,"WEC Energy Group, Inc.","WEC Energy Group, Inc., through its subsidiaries, provides regulated natural gas and electricity, and renewable and nonregulated renewable energy services in the United States. The company operates through Wisconsin, Illinois, Other States, Electric Transmission, and Non-Utility Energy Infrastructure segments. It generates and distributes electricity from coal, natural gas, oil, and nuclear, as well as renewable energy resources, including wind, solar, hydroelectric, and biomass; and distributes and hydroelectric natural gas. The company also owns, maintains, monitors, and operates electric transmission systems; and generates, distributes, and sells steam. As of December 31, 2025, the company operated approximately 35,200 miles of overhead distribution lines and 37,600 miles of underground distribution cables, as well as 420 electric distribution substations and 649,500 line transformers; approximately 47,200 miles of natural gas distribution mains; 1,300 miles of natural gas transmission mains; 2.4 million natural gas lateral services; 510 natural gas distribution and transmission gate stations; and 67.0 billion cubic feet of working gas capacities in underground natural gas storage fields. The company was formerly known as Wisconsin Energy Corporation and changed its name to WEC Energy Group, Inc. in June 2015. WEC Energy Group, Inc. was founded in 1896 and is headquartered in Milwaukee, Wisconsin.",0.73,0.45
