Main Theme,Sub Theme,Ticker,Preis,52W High,52W Low,Name,Description,PE,Forward PE,Revenue Growth,Earnings Growth,Profit Margin,Market Cap,3M Momentum,1M Momentum,20D Momentum,MA50,MA200,MA50 Abstand,MA200 Abstand,Preis ueber MA50,Preis ueber MA200,Volume,Avg Volume,Volume Ratio,Trend Score,Momentum
Energy,Grid Infrastructure,EXC,47.880001068115234,50.178108900420135,40.99098606629294,Exelon Corporation,"Exelon Corporation, eine Holdinggesellschaft für Versorgungsdienstleistungen, ist in den Vereinigten Staaten im Energieverteilungs- und -übertragungsgeschäft tätig. Das Unternehmen beschäftigt sich mit dem Kauf und dem regulierten Einzelhandelsverkauf von Strom und Erdgas; Übertragung und Verteilung von Elektrizität; und Vertrieb von Erdgas an Privatkunden. Es bedient Privat-, Gewerbe-, Industrie- und Behördenkunden sowie Kunden von Elektrobahnen. Die Exelon Corporation wurde 1999 gegründet und hat ihren Hauptsitz in Chicago, Illinois.",17.538462,15.760732,0.079,-0.003,0.11212,48991207424.0,-0.02,0.07,0.07,45.48,45.33,0.05,0.06,True,True,12709500.0,9146655.0,1.39,0.75,0.5
Energy,Grid Infrastructure,AEP,138.50999450683594,139.3300018310547,99.24703759535312,American Electric Power Company,"American Electric Power Company, Inc., eine Holdinggesellschaft für öffentliche Elektrizitätsversorgungsunternehmen, beschäftigt sich mit der Erzeugung, Übertragung und Verteilung von Strom zum Verkauf an Einzel- und Großhandelskunden in den Vereinigten Staaten. Das Unternehmen ist in den Segmenten Vertically Integrated Utilities, Transmission and Distribution Utilities, AEP Transmission Holdco und Generation & Marketing tätig. Das Unternehmen erzeugt Strom aus Kohle und Braunkohle, Kernkraft, Erdgas, erneuerbaren Energien, Wasserkraft, Sonne, Wind und anderen Energiequellen. besitzt, betreibt, wartet und investiert in die Übertragungsinfrastruktur; und ist im Einzelhandels- und Großhandelsgeschäft mit Energiehandel und -marketing tätig. Das Unternehmen betreibt etwa 252.000 Kreismeilen an Verteilungsleitungen. 38.000 Meilen an Übertragungsleitungen; und 25.000 MW regulierter eigener Erzeugungskapazität. American Electric Power Company, Inc. wurde 1906 gegründet und hat seinen Hauptsitz in Columbus, Ohio.",20.489643,20.192139,0.102,0.067,0.16289,75363983360.0,0.05,0.1,0.08,131.08,122.77,0.06,0.13,True,True,8802800.0,6177835.0,1.42,0.98,0.96
Energy,Grid Infrastructure,CEG,239.25,411.03669506377406,228.6300048828125,Constellation Energy Corporatio,"Constellation Energy Corporation produziert und vertreibt Energieprodukte und -dienstleistungen in den Vereinigten Staaten. Das Unternehmen ist in fünf Segmenten tätig: Mittelatlantik, Mittlerer Westen, New York, ERCOT und andere Energieregionen. Es bietet Strom, Erdgas, energiebezogene Produkte und nachhaltige Lösungen. Das Unternehmen verfügt über eine Erzeugungskapazität von rund 31.676 Megawatt, bestehend aus Kern-, Wind-, Solar-, Erdgas- und Wasserkraftanlagen. Es beliefert Versorgungsunternehmen, Kommunen, Genossenschaften sowie gewerbliche, industrielle, öffentliche und private Kunden. Das Unternehmen wurde 2021 gegründet und hat seinen Hauptsitz in Baltimore, Maryland.",20.786272,17.61389,0.638,10.91,0.12693,85436653568.0,-0.12,-0.1,-0.1,278.67,316.09,-0.14,-0.24,False,False,4267000.0,4135280.0,1.03,0.06,-0.88
Energy,Grid Infrastructure,VST,151.0500030517578,218.90834935343653,132.47448547608124,Vistra Corp.,"Vistra Corp. ist zusammen mit seinen Tochtergesellschaften als integriertes Einzelhandelsunternehmen für Strom und Stromerzeugung in den Vereinigten Staaten tätig. Das Unternehmen ist in fünf Segmenten tätig: Einzelhandel, Texas, Ost, West und Anlagenschließung. Das Unternehmen vertreibt Strom und Erdgas an Privat-, Gewerbe- und Industriekunden in den gesamten US-Bundesstaaten und im District of Columbia. Darüber hinaus ist das Unternehmen in den Bereichen Stromerzeugung, Energieeinkauf und -verkauf im Großhandel, Rohstoffrisikomanagement, Kraftstoffbeschaffung und Kraftstofflogistikmanagement tätig. Darüber hinaus befasst sich das Unternehmen mit der Stilllegung und Sanierung stillgelegter Erzeugungsanlagen, einschließlich Bergwerken, sowie mit der Entfernung und Sanierung von Batterien. Das Unternehmen versorgt rund 5 Millionen Kunden mit einer Erzeugungskapazität von rund 44.000 Megawatt und verfügt über ein Portfolio aus Erdgas-, Atom-, Kohle-, Solar- und Batteriespeicheranlagen. Das Unternehmen war früher als Vistra Energy Corp. bekannt und änderte seinen Namen im Juli 2020 in Vistra Corp.. Vistra Corp. wurde 1882 gegründet und hat seinen Sitz in Irving, Texas.",25.259197,13.977233,0.434,,0.11525,50931412992.0,0.0,-0.02,-0.02,154.24,168.13,-0.02,-0.1,False,False,4254100.0,4440050.0,0.96,0.21,-0.57
Energy,Grid Infrastructure,XEL,81.95999908447266,83.22233542225167,64.56908092076111,Xcel Energy Inc.,"Xcel Energy Inc. ist über seine Tochtergesellschaften als Strom- und Erdgaslieferunternehmen in den Vereinigten Staaten tätig. Das Unternehmen ist in den Segmenten regulierter Stromversorger und regulierter Erdgasversorger tätig. Das Unternehmen erzeugt, kauft, überträgt, verteilt und verkauft Strom über sein Energieportfolio, einschließlich Wind-, Atom-, Wasserkraft-, Biomasse- und Solarenergie aus eigenen Erzeugungsanlagen und PPAs, sowie über sein Energieportfolio aus fossilen Brennstoffen wie Kohle und Erdgas; Verkauf und Weiterverkauf von Großhandelsübertragungsdiensten; und ist im Großhandel mit Rohstoffen und Handelsgeschäften tätig. Darüber hinaus kauft, transportiert, lagert, verteilt und verkauft das Unternehmen Erdgas; entwickelt und vermietet Erdgaspipelines und Speicheranlagen; betreibt eine zwischenstaatliche Erdgaspipeline; und investiert in Mietwohnungsprojekte, Energietechnologieunternehmen und nicht regulierte Gemeinschaftssolargärten. Das Unternehmen beliefert Strom- und Erdgaskunden in Teilen von Colorado, Michigan, Minnesota, New Mexico, North Dakota, South Dakota, Texas und Wisconsin. Das Unternehmen war früher als Northern States Power Company bekannt. Xcel Energy Inc. wurde 1909 gegründet und hat seinen Hauptsitz in Minneapolis, Minnesota.",23.619596,18.082933,0.029,0.06,0.14144,51165134848.0,0.02,0.07,0.06,79.2,77.74,0.03,0.05,True,True,4250700.0,6336555.0,0.67,0.93,0.86
Energy,Grid Infrastructure,ED,113.98999786376953,115.26450276939326,92.95812863357024,"Consolidated Edison, Inc.","Consolidated Edison, Inc. ist über seine Tochtergesellschaften im regulierten Strom-, Gas- und Dampfliefergeschäft in den Vereinigten Staaten tätig. Das Unternehmen bietet Stromdienstleistungen für rund 3,7 Millionen Kunden in New York City und Westchester County an; Gas für etwa 1,1 Millionen Kunden in Manhattan, der Bronx, Teilen von Queens und Westchester County; und Dampf an rund 1.490 Kunden in Teilen von Manhattan. Darüber hinaus beliefert das Unternehmen rund 0,3 Millionen Kunden im Südosten von New York und im Norden von New Jersey mit Strom. und Gas an rund 0,1 Millionen Kunden im Südosten von New York. Darüber hinaus betreibt das Unternehmen Übertragungsleitungen mit einer Gesamtlänge von 552 Meilen. 16 Umspannwerke; 63 Umspannwerke; 89.675 in Betrieb befindliche Netztransformatoren; 3.764 Mastmeilen an Freileitungsleitungen; und 2.417 Meilen unterirdischer Verteilungsleitungen sowie 4.374 Meilen Hauptleitungen und 379.939 Versorgungsleitungen für die Erdgasverteilung. Darüber hinaus investiert das Unternehmen in Strom- und Gasübertragungsprojekte. Das Unternehmen verkauft Strom hauptsächlich an Industrie-, Gewerbe-, Privat- und Regierungskunden. Consolidated Edison, Inc. wurde 1823 gegründet und hat seinen Sitz in New York, New York.",19.222597,17.570955,0.062,0.129,0.12524,42008698880.0,-0.0,0.1,0.1,107.57,103.68,0.06,0.1,True,True,2172100.0,2394670.0,0.91,0.94,0.89
Energy,Grid Infrastructure,D,69.75,70.16999816894531,53.01844538826359,"Dominion Energy, Inc.","Dominion Energy, Inc. bietet regulierte Strom- und Erdgasdienstleistungen in den Vereinigten Staaten an. Das Unternehmen ist in den Segmenten Dominion Energy Virginia, Dominion Energy South Carolina und Contracted Energy tätig. Das Segment Dominion Energy Virginia beschäftigt sich mit der Erzeugung, Verteilung und Übertragung von Strom an etwa 2,8 Millionen Privat-, Gewerbe-, Industrie- und Regierungskunden in Virginia und North Carolina. Das Segment Dominion Energy South Carolina erzeugt, überträgt und verteilt Strom an etwa 0,8 Millionen Kunden in den zentralen, südlichen und südwestlichen Teilen von South Carolina; und verteilt Erdgas an etwa 0,5 Millionen Privat-, Gewerbe- und Industriekunden in South Carolina. Das Segment Contracted Energy ist an der nicht regulierten, langfristig vertraglich vereinbarten Stromerzeugungsflotte aus erneuerbaren Energien und erneuerbaren Erdgasanlagen beteiligt. Zum 31. Dezember 2025 umfasste das Vermögensportfolio des Unternehmens etwa 30,7 GW Stromerzeugungskapazität, 10.800 Meilen Stromübertragungsleitungen und 80.400 Meilen Stromverteilungsleitungen. Das Unternehmen war früher als Dominion Resources, Inc. bekannt. Dominion Energy, Inc. wurde 1983 gegründet und hat seinen Hauptsitz in Richmond, Virginia.",20.57522,18.283188,0.231,-0.102,0.16929,61345996800.0,0.12,0.07,0.05,65.48,61.19,0.07,0.14,True,True,4301400.0,6787525.0,0.63,0.98,0.95
Energy,Grid Infrastructure,PCG,17.049999237060547,19.04978410131586,12.833953821609121,Pacific Gas & Electric Co.,"Die PG&E Corporation beschäftigt sich über ihre Tochtergesellschaft Pacific Gas and Electric Company mit dem Verkauf und der Lieferung von Strom und Erdgas an Kunden in Nord- und Zentralkalifornien, USA. Es erzeugt Strom aus Kernkraft, Wasserkraft, fossilen Brennstoffen, Brennstoffzellen und Photovoltaik. Das Unternehmen besitzt und betreibt miteinander verbundene Übertragungsleitungen. Umspannwerke, Verteilerleitungen, Schalt- und Verteilerstationen; und Erdgasübertragungs-, Speicher- und Verteilungssysteme, bestehend aus Verteilungspipelines, Backbone- und lokalen Transportpipelines sowie verschiedenen Speicheranlagen. Es beliefert Privat-, Gewerbe-, Industrie- und Landwirtschaftskunden sowie erdgasbetriebene Stromerzeugungsanlagen. Das Unternehmen wurde 1995 gegründet und hat seinen Sitz in Oakland, Kalifornien.",13.217054,9.458926,0.15,0.398,0.110089995,37547929600.0,-0.04,0.01,0.02,16.53,16.41,0.03,0.04,True,True,12403100.0,18528545.0,0.67,0.68,0.36
Energy,Grid Infrastructure,AWK,136.86000061035156,144.9005255760631,119.60763801505318,"American Water Works Company, I","American Water Works Company, Inc. bietet über seine Tochtergesellschaften Wasser- und Abwasserdienstleistungen in den Vereinigten Staaten an. Es bietet Wasser- und Abwasserdienstleistungen für militärische Anlagen an; und schließt Verträge mit kommunalen Kunden ab, vor allem für den Betrieb und die Verwaltung von Wasser- und Abwasseranlagen, und bietet darüber hinaus weitere damit verbundene Dienstleistungen an. Das Unternehmen betreibt außerdem etwa 80 Oberflächenwasseraufbereitungsanlagen; 520 Grundwasseraufbereitungsanlagen; 170 Kläranlagen; 55.000 Meilen Übertragungs-, Verteilungs- und Sammelleitungen und -rohre; 1.200 Grundwasserbrunnen; 1.800 Wasser- und Abwasserpumpstationen; 1.100 Speicheranlagen für aufbereitetes Wasser; und 75 Dämme. Darüber hinaus bietet das Unternehmen Wasser- und Abwasserdienstleistungen für 14 Bundesstaaten an und bedient rund 3,6 Millionen aktive Kunden. Das Unternehmen bedient Privatkunden; gewerbliche Kunden, darunter Lebensmittel- und Getränkeanbieter, Entwickler und Eigentümer von Gewerbeimmobilien sowie Energieversorger; Feuerwehr und private Feuerwehrkunden; Industriekunden wie Großhersteller, Bergbau- und Produktionsbetriebe; öffentliche Behörden, darunter Regierungsgebäude und andere Einrichtungen des öffentlichen Sektors, wie Schulen und Universitäten; und andere Versorgungsunternehmen sowie kommunale Wasser- und Abwassersysteme. Das Unternehmen wurde 1886 gegründet und hat seinen Hauptsitz in Camden, New Jersey.",24.265959,20.866621,0.057,-0.048,0.21172,26726092800.0,-0.0,0.11,0.12,126.72,130.33,0.08,0.05,True,True,3269200.0,2446955.0,1.34,0.68,0.36
Energy,Grid Infrastructure,PPL,36.88999938964844,39.79024203043266,32.18821053546635,PPL Corporation,"Die PPL Corporation versorgt etwa 3,6 Millionen Kunden in den Vereinigten Staaten mit Strom und Erdgas. Das Unternehmen ist in drei Segmenten tätig: Kentucky Regulated, Pennsylvania Regulated und Rhode Island Regulated. Das Unternehmen beschäftigt sich mit der Übertragung und Verteilung von Strom in Ost- und Zentral-Pennsylvania; Erzeugung, Übertragung, Verteilung und Verkauf von Strom in Kentucky, Virginia und Rhode Island; Vertrieb und Verkauf von Erdgas in Kentucky und Rhode Island; Verkauf von Großhandelsstrom in Kentucky; und Stromerzeugung aus Kraftwerken in Kentucky. Es erzeugt Strom aus Kohle-, Gas-, Wasser- und Solarquellen. Das Unternehmen war früher als PP&L Resources, Inc. bekannt und änderte seinen Namen im Jahr 2000 in PPL Corporation. PPL Corporation wurde 1920 gegründet und hat seinen Hauptsitz in Allentown, Pennsylvania.",22.6319,17.431778,0.108,0.073,0.13091,27754203136.0,-0.04,0.06,0.06,36.12,36.08,0.02,0.02,True,True,10498700.0,11682090.0,0.9,0.62,0.24
Energy,Grid Infrastructure,WEC,118.83000183105469,119.05999755859375,99.17223304993398,"WEC Energy Group, Inc.","WEC Energy Group, Inc. bietet über seine Tochtergesellschaften reguliertes Erdgas und Strom sowie erneuerbare und nicht regulierte erneuerbare Energiedienstleistungen in den Vereinigten Staaten an. Das Unternehmen ist in den Segmenten Wisconsin, Illinois, Andere Staaten, Stromübertragung und Nicht-Versorgungsenergieinfrastruktur tätig. Es erzeugt und verteilt Strom aus Kohle, Erdgas, Öl und Kernkraft sowie erneuerbaren Energiequellen, einschließlich Wind, Sonne, Wasserkraft und Biomasse. und verteilt und hydroelektrisches Erdgas. Das Unternehmen besitzt, wartet, überwacht und betreibt außerdem elektrische Übertragungssysteme. und erzeugt, verteilt und verkauft Dampf. Zum 31. Dezember 2025 betrieb das Unternehmen etwa 35.200 Meilen Freileitungsleitungen und 37.600 Meilen unterirdische Verteilungskabel sowie 420 Umspannwerke und 649.500 Leitungstransformatoren; etwa 47.200 Meilen Erdgasverteilungsnetze; 1.300 Meilen Erdgasübertragungsleitungen; 2,4 Millionen Erdgas-Nebendienstleistungen; 510 Erdgasverteilungs- und Übertragungstorstationen; und 67,0 Milliarden Kubikfuß Arbeitsgaskapazitäten in unterirdischen Erdgasspeicherfeldern. Das Unternehmen war früher als Wisconsin Energy Corporation bekannt und änderte seinen Namen im Juni 2015 in WEC Energy Group, Inc.. WEC Energy Group, Inc. wurde 1896 gegründet und hat seinen Hauptsitz in Milwaukee, Wisconsin.",23.81363,19.796686,0.09,0.079,0.16239001,38705979392.0,0.02,0.08,0.07,113.27,110.9,0.05,0.07,True,True,1186700.0,2309215.0,0.51,0.99,0.98
Energy,Grid Infrastructure,ES,74.44000244140625,74.7235825882655,58.835829398082765,Eversource Energy (D/B/A),"Eversource Energy, eine Holdinggesellschaft für öffentliche Versorgungsunternehmen, ist im Energieliefergeschäft tätig. Das Unternehmen ist in den Segmenten Stromverteilung, Stromübertragung, Erdgasverteilung und Wasserverteilung tätig. Es ist an der Übertragung und Verteilung von Elektrizität beteiligt; Solarenergieanlagen; und Verteilung von Erdgas. Das Unternehmen betreibt außerdem regulierte Wasserversorgungsunternehmen, die Wasserdienstleistungen für Privat-, Gewerbe-, Industrie-, Kommunal- und Brandschutzkunden sowie für andere Kunden in Connecticut, Massachusetts und New Hampshire bereitstellen. Das Unternehmen hieß früher Northeast Utilities und änderte im April 2015 seinen Namen in Eversource Energy. Eversource Energy wurde 1927 gegründet und hat seinen Hauptsitz in Springfield, Massachusetts.",15.940043,15.199592,0.094,0.074,0.12549,27995398144.0,0.08,0.09,0.07,69.14,68.57,0.08,0.09,True,True,2344100.0,3050535.0,0.77,0.98,0.96
Energy,Grid Infrastructure,FE,48.529998779296875,51.80568416902121,37.80419405872213,FirstEnergy Corp.,"FirstEnergy Corp. beschäftigt sich zusammen mit seinen Tochtergesellschaften mit der Erzeugung, Verteilung und Übertragung von Strom in den Vereinigten Staaten. Das Unternehmen ist in den Segmenten Verteilung, integrierte Übertragung und eigenständige Übertragung tätig. Das Unternehmen besitzt und betreibt Kohle-, Kern-, Wasser-, Wind- und Solarkraftwerke. Das Unternehmen betreibt 252.959 Meilen Verteilungsleitungen und 24.157 Meilen Übertragungsleitungen, darunter Freileitungen und unterirdische Leitungen für Primär-, Sekundär- und Straßenbeleuchtungskreise. Das Unternehmen beliefert Kunden in Ohio, Pennsylvania, New Jersey, West Virginia, Maryland und New York. FirstEnergy Corp. wurde 1996 gegründet und hat seinen Hauptsitz in Akron, Ohio.",26.374998,16.468376,0.116,0.129,0.06944,28071264256.0,-0.04,0.07,0.06,46.48,46.43,0.04,0.05,True,True,4336300.0,4394345.0,0.99,0.77,0.53
Energy,Power Equipment,GE,377.5199890136719,382.9700012207031,242.41226148308326,GE Aerospace,"Die General Electric Company, firmierend als GE Aerospace, entwickelt und produziert Triebwerke für Verkehrs- und Verteidigungsflugzeuge, integrierte Triebwerkskomponenten, elektrische Energie und Flugzeugsysteme. Das Unternehmen ist in zwei Segmenten tätig: Commercial Engines & Services sowie Defense & Propulsion Technologies. Das Segment Commercial Engines & Services entwirft, entwickelt, fertigt, wartet, repariert und überholt (MRO) Dienstleistungen für Strahltriebwerke und verkauft Ersatzteile für Verkehrsflugzeuge, Geschäftsluftfahrt und aeroderivative Anwendungen. Der Bereich Verteidigungs- und Antriebstechnologien entwirft, entwickelt, fertigt und wartet Düsentriebwerke sowie Avionik- und Antriebssysteme für Regierungen, Militärs und kommerzielle Flugzeughersteller sowie die Instandhaltung von Triebwerken und den Verkauf von Ersatzteilen. Dieses Segment bietet unter den Marken Avio Aero, Unison, Dowty Propellers und Colibrium Additive auch Flugzeugkomponenten und -systeme wie kleine Turboprop-Triebwerke, mechanische Getriebe für Flugtriebwerke, Turbinen, Brennkammern und Steuerungen, additive Fertigung, Propellersysteme, Zündsysteme, Sensoren und Triebwerkszubehör für Starrflügel- und Drehflügleranwendungen für kommerzielle und militärische Endverbraucher. Das Unternehmen ist in den Vereinigten Staaten, Europa, Asien, Amerika, dem Nahen Osten und Afrika tätig. Die General Electric Company wurde 1892 gegründet und hat ihren Sitz in Evendale, Ohio.",46.955223,43.55189,0.247,-0.018,0.17863001,394444079104.0,0.34,0.2,0.15,318.93,309.0,0.18,0.22,True,True,3274700.0,5139400.0,0.64,0.96,0.92
Energy,Power Equipment,SIE.DE,284.1000061035156,284.6499938964844,198.0,SIEMENS AG                    N,"Die Siemens Aktiengesellschaft, ein Technologieunternehmen, konzentriert sich auf die Bereiche Automatisierung und Digitalisierung in Europa, der Gemeinschaft Unabhängiger Staaten, Afrika, dem Nahen Osten, Amerika, Asien und Australien. Das Unternehmen ist in den Segmenten Digital Industries, Smart Infrastructure, Mobility, Siemens Healthineers und Siemens Financial Services (SFS) tätig. Das Segment Digital Industries bietet Automatisierungssysteme und Software für Fabriken, numerische Steuerungssysteme, Servomotoren, Antriebe und Wechselrichter sowie integrierte Automatisierungssysteme für Werkzeugmaschinen und Produktionsmaschinen; Prozessleitsysteme, Maschine-zu-Maschine-Kommunikationsprodukte, Sensoren und Radiofrequenz-Identifikationssysteme; Software für Produktions- und Produktlebenszyklusmanagement sowie Simulation und Test mechatronischer Systeme. Das Segment „Smart Infrastructure“ bietet Produkte, Systeme, Lösungen, Dienstleistungen und Software zur Unterstützung eines nachhaltigen Übergangs von fossilen und erneuerbaren Energiequellen; nachhaltige Gebäude und Gemeinden; und Gebäude, Elektrifizierung und elektrische Produkte. Das Segment Mobilität bietet Schienenpersonen- und Gütertransporte wie U-Bahn-Systeme, Straßenbahnen und Stadtbahnen sowie Nahverkehrszüge sowie Züge und Reisezugwagen; Lokomotiven und Lösungen für automatisierten Transport und Leasing; Produkte und Lösungen für die Bahnautomatisierung und Elektrifizierung; Wartung und digitale Dienstleistungen; sowie digitale und cloudbasierte Lösungen und damit verbundene Dienstleistungen. Das Segment Siemens Healthineers entwickelt, produziert und vertreibt verschiedene diagnostische und therapeutische Produkte und Dienstleistungen; und bietet klinische Beratungs- und Schulungsdienste an. Das Segment Siemens Financial Services bietet Fremd- und Eigenkapitalinvestitionen an; Leasing, Kredite und Betriebskapital; Struktur-, Ausrüstungs- und Projektfinanzierung; und Finanzberatungsdienste. Das Unternehmen wurde 1847 gegründet und hat seinen Hauptsitz in München, Deutschland.",29.409939,22.122137,-0.0,-0.086,0.09688,216695390208.0,0.35,0.06,0.06,267.26,241.99,0.06,0.17,True,True,707250.0,1129938.0,0.63,0.99,0.99
Energy,Power Equipment,ETN,398.5199890136719,436.739990234375,310.09348561011313,"Eaton Corporation, PLC","Eaton Corporation plc ist als Energiemanagementunternehmen in den Vereinigten Staaten, Kanada, Lateinamerika, Europa und im asiatisch-pazifischen Raum tätig. Das Unternehmen ist in den Segmenten Electrical Americas, Electrical Global, Luft- und Raumfahrt, Fahrzeuge und E-Mobilität tätig. Das Unternehmen bietet elektrische und industrielle Komponenten, Stromverteilung und -baugruppen, Produkte für Privathaushalte, ein- und dreiphasige Stromqualitäts- und Konnektivitätsprodukte, Verkabelungsgeräte, Stromkreisschutzprodukte, Produkte zur Stromverteilung für Versorgungsunternehmen und Geräte zur Stromversorgungszuverlässigkeit. und gefährliche elektrische Geräte, Notbeleuchtung, Branderkennung, eigensichere explosionsgeschützte Instrumente und strukturelle Unterstützungssysteme. Darüber hinaus werden Pumpen, Motoren, Hydraulikaggregate, Schläuche und Armaturen sowie elektrohydraulische Pumpen angeboten. Ventile, Zylinder, elektronische Steuerungen, elektromechanische Aktuatoren, Sensoren, Klappen- und Vorflügelsysteme für Flugzeuge und Bugradlenksysteme; Schlauch- und thermoplastische Rohrprodukte, Fittings, Adapter, Kupplungen sowie Dichtungs- und Leitungsprodukte; Luft-Luft-Betankungssysteme, Kraftstoffpumpen, Kraftstoffinertisierungsprodukte, Sensoren sowie Adapter und Regler; Sauerstofferzeugungssysteme, Nutzlastwagen und Wärmemanagementprodukte; Verdrahtungsanschlüsse und Kabel; sowie Hydraulik- und Taschenfilter, Siebe und Patronen sowie Golfgriffe für Hersteller von Verkehrs- und Militärflugzeugen, zugehörige Aftermarket-Kunden und industrielle Anwendungen. Darüber hinaus bietet das Unternehmen Getriebe, Kupplungen, Hybridantriebssysteme, Kompressoren, Motorventile und Ventilbetätigungssysteme, Sperr- und Sperrdifferentiale, Getriebesteuerungen und Kraftstoffdampfkomponenten für die Fahrzeugindustrie an; und Spannungswechselrichter, Konverter, Sicherungen, Schaltkreisschutzeinheiten, Fahrzeugsteuerungen, Stromverteilungssysteme, Kraftstofftank-Absperrventile und Nutzfahrzeug-Hybridsysteme. Das Unternehmen war früher als Abeiron Limited bekannt. Das Unternehmen wurde 1911 gegründet und hat seinen Sitz in Dublin, Irland.",39.070587,25.277819,0.168,-0.094,0.13986,154745307136.0,0.11,-0.05,-0.05,406.69,369.71,-0.02,0.08,False,True,2601600.0,2580235.0,1.01,0.7,0.4
Energy,Power Equipment,SU,55.04999923706055,69.82669123549735,37.01590357010626,Suncor Energy  Inc.,"Suncor Energy Inc. ist als integriertes Energieunternehmen in Kanada, den Vereinigten Staaten und international tätig. Das Unternehmen ist über Oil Sands tätig; Exploration und Produktion; und Raffinerie- und Marketingsegmente. Das Segment Ölsande produziert Bitumen; und vermarktet, liefert, transportiert und verwaltet Rohöl, Strom und Nebenprodukte. Das Segment Exploration und Produktion ist an den Offshore-Aktivitäten an der Ostküste Kanadas sowie an Onshore-Anlagen in Libyen und Syrien beteiligt; sowie Marketing und Risikomanagement von Rohöl. Das Segment Raffinierung und Marketing raffiniert und liefert Rohöl und Zwischenrohstoffe zu einer Reihe von Erdöl- und petrochemischen Produkten und verkauft raffinierte Erdölprodukte an Einzelhandelskunden. Dieses Segment ist auch im Handel mit Rohöl und raffinierten Produkten, Erdgas und Strom tätig. Das Unternehmen war früher als Suncor Inc. bekannt und änderte seinen Namen im April 1997 in Suncor Energy Inc.. Suncor Energy Inc. wurde 1917 gegründet und hat seinen Hauptsitz in Calgary, Kanada.",14.878378,10.042934,0.175,0.299,0.12394,65000022016.0,-0.16,-0.15,-0.16,62.51,52.37,-0.12,0.05,False,True,5150300.0,5158950.0,1.0,0.55,0.1
