Main Theme,Sub Theme,Ticker,Preis,52W High,52W Low,Name,Description,PE,Forward PE,Revenue Growth,Earnings Growth,Profit Margin,Market Cap,3M Momentum,1M Momentum,20D Momentum,MA50,MA200,MA50 Abstand,MA200 Abstand,Preis ueber MA50,Preis ueber MA200,Volume,Avg Volume,Volume Ratio,Trend Score,Momentum
AI / Tech,Cybersecurity,QLYS,148.1199951171875,155.47000122070312,74.51000213623047,"Qualys, Inc.","Qualys, Inc. bietet eine cloudbasierte Plattform zur Bereitstellung von Informationstechnologie (IT), Sicherheit und Compliance-Lösungen in den Vereinigten Staaten und international. Das Unternehmen bietet Qualys Cloud-Apps an, darunter Cybersicherheits-Asset-Management; TruRisk-Management für Unternehmen; Schwachstellenmanagement, Erkennung und Reaktion; absolute Anwendungssicherheit; Patch-Management; kundenspezifische Bewertung und Sanierung; Multi-Vektor-Endpunkterkennung und -reaktion; Richtlinienprüfung; und Überwachung der Dateiintegrität. Es bietet TotalCloud, eine Cloud-native Anwendungsschutzplattform, die Cloud-Workload-Schutz, Cloud-Erkennung und -Reaktion, Cloud-Sicherheitsstatusmanagement, Infrastruktur als Code, SaaS-Sicherheitsstatusmanagement, Cloud-Infrastruktur- und Berechtigungsmanagement sowie Kubernetes- und Containersicherheit umfasst. Darüber hinaus vermarktet und vertreibt das Unternehmen IT-, Sicherheits- und Compliance-Lösungen; bietet die Enterprise TruRisk-Plattform von Qualys an, die es Kunden ermöglicht, IT- und betriebliche Technologieressourcen zu identifizieren und zu verwalten; Sammeln und Analysieren von IT-Sicherheitsdaten; Schwachstellen entdecken und priorisieren; Quantifizierung der Cyber-Risiken; Abhilfemaßnahmen empfehlen und umsetzen; und überprüfen Sie die Umsetzung solcher Maßnahmen. Darüber hinaus bietet es Asset-Tagging und -Management; Berichterstattung und Dashboards; Fragebögen und Zusammenarbeit; Behebung und Arbeitsablauf; Big-Data-Korrelations- und Analyse-Engine; sowie Warnungen und Benachrichtigungen. Das Unternehmen bietet seine Lösungen über seine Vertriebsteams sowie über Sicherheitsberatungsorganisationen, Managed Service Provider, Wiederverkäufer, Cloud-Anbieter und Beratungsunternehmen Unternehmen, Regierungsbehörden sowie kleinen und mittleren Unternehmen in verschiedenen Branchen an, darunter Bildung, Finanzdienstleistungen, Regierung, Gesundheitswesen, Versicherungen, Fertigung, Medien, Einzelhandel, Technologie und Versorgungsunternehmen. Qualys, Inc. wurde 1999 gegründet und hat seinen Hauptsitz in Foster City, Kalifornien.",26.592459,17.908117,0.098,0.101,0.29412,5216343040.0,0.68,0.33,0.33,104.25,117.2,0.42,0.26,True,True,1043100.0,822105.0,1.27,0.91,0.82
AI / Tech,Cybersecurity,VRNS,42.86000061035156,63.900001525878906,19.700000762939453,"Varonis Systems, Inc.","Varonis Systems, Inc. bietet Softwareprodukte und -dienstleistungen an, die mit KI-gestützter Technologie in Nordamerika, Europa, APAC und dem Rest der Welt kontinuierlich kritische Daten erkennen und klassifizieren, Gefährdungen beseitigen und fortschrittliche Bedrohungen erkennen. Das Unternehmen bietet Varonis Data Security Platform an, eine Software-as-a-Service-Lösung, die Datensicherheitsstatusmanagement, Datenzugriffsinformationen, Datenerkennung und -klassifizierung, Discovery-Richtlinienbibliothek, Least-Privilege-Automatisierung, Datenaktivitätsüberwachung, Datenerkennung und -reaktion sowie Benutzer- und Entitätsverhaltensanalysen umfasst. Es bietet außerdem Schutzpakete wie Microsoft 365, Windows und NAS, Hybrid- und Cloud-Umgebungen sowie Datenbank- und E-Mail-Sicherheitsfunktionen und lokale Abonnementprodukte. Es beliefert die Branchen Finanzdienstleistungen, Öffentlichkeit, Gesundheitswesen, Industrie, Versicherungen, Energie und Versorgung, Technologie, Bauwesen und Ingenieurwesen, Bildung sowie Verbraucher- und Einzelhandel. Varonis Systems, Inc. wurde 2004 gegründet und hat seinen Hauptsitz in Miami, Florida.",,112.137314,0.269,,-0.1975,5033809920.0,0.9,0.28,0.29,31.65,34.42,0.35,0.25,True,True,1333200.0,2300720.0,0.58,0.52,0.05
AI / Tech,AI Software & Platforms,MSFT,390.489990234375,551.0484742016899,349.20001220703125,Microsoft Corporation,"Die Microsoft Corporation entwickelt und unterstützt weltweit Software, Dienste, Geräte und Lösungen. Das Segment Produktivität und Geschäftsprozesse bietet Microsoft 365 Commercial, Enterprise Mobility + Security, Windows Commercial, Power BI, Exchange, Sharepoint, Microsoft Teams, Sicherheit und Compliance sowie Copilot; Kommerzielle Microsoft 365-Produkte, wie kommerzielle lokale Windows- und Office-lizenzierte Dienste; Microsoft 365-Verbraucherprodukte und Cloud-Dienste, einschließlich Microsoft 365-Verbraucherabonnements, lokal lizenzierte Office-Lösungen und andere Verbraucherdienste; LinkedIn; Dynamics-Produkte und Cloud-Dienste wie Dynamics 365, cloudbasierte Anwendungen sowie lokale ERP- und CRM-Anwendungen. Das Segment Intelligent Cloud bietet Serverprodukte und Cloud-Dienste, darunter Azure und andere Cloud-Dienste, GitHub, Nuance Healthcare, virtuelle Desktop-Angebote und andere Cloud-Dienste. Serverprodukte, einschließlich SQL- und Windows-Server-, Visual Studio- und System Center-bezogene Clientzugriffslizenzen sowie andere lokale Angebote; Unternehmens- und Partnerdienste wie Enterprise Support und Nuance Professional Services, Branchenlösungen, Microsoft-Partnernetzwerk und Lernerfahrung. Das Personal Computing-Segment bietet Windows und Geräte, wie z. B. Windows-OEM-Lizenzen und -Geräte sowie Oberflächen- und PC-Zubehör; Gaming-Dienste und -Lösungen wie Xbox-Hardware, -Inhalte und -Dienste, Xbox-Game-Pass-Inhalte von Erst- und Drittanbietern, Abonnements sowie Cloud-Gaming, Werbung und andere Cloud-Dienste; Such- und Nachrichtenwerbedienste. Das Unternehmen verkauft seine Produkte über OEMs, Distributoren und Wiederverkäufer. sowie Online- und Einzelhandelsgeschäfte. Das Unternehmen unterhält eine strategische Zusammenarbeit mit Mayo Clinic, Inc. zur Entwicklung eines bahnbrechenden KI-Modells für das Gesundheitswesen; und Global Objects, Inc., um ein auf Abruf basierendes generatives KI-Weltmodell zu erstellen. Das Unternehmen wurde 1975 gegründet und hat seinen Hauptsitz in Redmond, Washington.",23.257294,20.160732,0.183,0.234,0.39341998,2900729528320.0,0.05,-0.09,-0.09,407.22,443.78,-0.04,-0.12,False,False,42128900.0,48915315.0,0.86,0.2,-0.59
AI / Tech,AI Software & Platforms,GOOGL,359.9100036621094,408.36608091552193,172.27853009035698,Alphabet Inc.,"Alphabet Inc. bietet verschiedene Produkte und Plattformen in den Vereinigten Staaten, Europa, dem Nahen Osten, Afrika, dem asiatisch-pazifischen Raum, Kanada und Lateinamerika an. Das Unternehmen ist über die Segmente Google Services, Google Cloud und Other Bets tätig. Das Segment Google Services bietet Produkte und Dienste an, darunter Anzeigen, Android, Chrome, Geräte, Gmail, Google Drive, Google Maps, Google Fotos, Google Play, Suche und YouTube. Darüber hinaus ist es am Verkauf von Apps und In-App-Käufen sowie digitalen Inhalten bei Google Play und YouTube beteiligt; und Geräte sowie die Bereitstellung von YouTube-Abonnementdiensten für Verbraucher, wie YouTube TV, YouTube Music und Premium, NFL Sunday Ticket und Google One. Das Google Cloud-Segment bietet verbrauchsabhängige Gebühren und Abonnements für KI-Lösungen, einschließlich KI-Infrastruktur, Vertex AI-Plattform und Gemini Enterprise. Darüber hinaus bietet das Unternehmen Cybersicherheit sowie Daten- und Analysedienste an. Google Workspace mit cloudbasierten Kommunikations- und Kollaborationstools für Unternehmen wie Kalender, Gmail, Docs, Drive und Meet; und andere Unternehmensdienstleistungen. Das Segment „Andere Wetten“ verkauft Transport- und Internetdienstleistungen. Alphabet Inc. wurde 1998 gegründet und hat seinen Hauptsitz in Mountain View, Kalifornien.",27.474045,24.722982,0.218,0.82,0.37919,4391827931136.0,0.22,0.0,-0.03,370.83,315.81,-0.03,0.14,False,True,25974800.0,38320065.0,0.68,0.79,0.59
AI / Tech,AI Software & Platforms,META,582.9000244140625,793.6488143059948,519.7782492802263,"Meta Platforms, Inc.","Meta Platforms, Inc. beschäftigt sich mit der Entwicklung von Produkten, die es Menschen ermöglichen, über mobile Geräte, PCs, Virtual-Reality-Headsets (VR) und KI-Brillen in den USA, Kanada, Europa, im asiatisch-pazifischen Raum und international mit Freunden und Familie in Kontakt zu treten und Inhalte zu teilen. Das Unternehmen ist in zwei Segmenten tätig: Family of Apps (FoA) und Reality Labs (RL). Das FoA-Segment bietet Facebook, das es Menschen ermöglicht, über Feeds, Reels, Stories, Gruppen, Marktplatz und anderes eine Community aufzubauen; Instagram, das Menschen durch Instagram-Feeds, Stories, Reels, Live und Messaging einander näher bringt; Messenger, eine Messaging-Anwendung, mit der Menschen plattform- und geräteübergreifend über Text-, Audio- und Videoanrufe mit Freunden, Familie, Communities und Unternehmen in Kontakt treten können; Meta AI, ein Assistent, der appübergreifend, als eigenständige App, auf KI-Brillen und im Web verfügbar ist; Threads, eine Anwendung für textbasierte Updates und öffentliche Gespräche; und WhatsApp, eine Messaging-Anwendung, die von Menschen und Unternehmen zur Kommunikation und Transaktion genutzt wird. Das RL-Segment bietet Virtual- und Augmented-Reality-Produkte, darunter Verbraucherhardware, -software und -inhalte, die den Menschen helfen, sich verbunden zu fühlen, sowie Meta Quest-Geräte, die soziale Erlebnisse in den Bereichen Gaming, Fitness, Unterhaltung und mehr ermöglichen. Das Segment umfasst auch Wearables wie KI-Brillen wie Ray Ban Meta- und Oakley Meta-Brillen; und das Meta Ray Ban Display, das eine KI-Brille mit einem integrierten Linsendisplay kombiniert, und das Meta Neural Band, ein am Handgelenk getragenes Gerät mit Elektromyographie, mit dem Menschen ihre KI-Brille über neuromuskuläre Signale steuern können. Meta Platforms, Inc. arbeitet mit Microsoft Corporation, NVIDIA Corporation, Advanced Micro Devices, Inc., Broadcom Inc. und OpenAI, L.L.C. zusammen. Das Unternehmen hieß früher Facebook, Inc. und änderte im Oktober 2021 seinen Namen in Meta Platforms, Inc.. Das Unternehmen wurde 2004 gegründet und hat seinen Hauptsitz in Menlo Park, Kalifornien.",21.18866,15.82777,0.331,0.624,0.32837,1479647035392.0,0.02,-0.06,-0.07,604.81,645.41,-0.04,-0.1,False,False,21705900.0,19702150.0,1.1,0.23,-0.54
AI / Tech,AI Software & Platforms,AMZN,242.6699981689453,278.55999755859375,196.0,"Amazon.com, Inc.","Amazon.com, Inc. beschäftigt sich mit dem Einzelhandelsverkauf von Konsumgütern, Werbung und Abonnementdiensten über Online- und physische Geschäfte in Nordamerika und international. Das Unternehmen ist in drei Segmenten tätig: Nordamerika, International und Amazon Web Services (AWS). Darüber hinaus werden elektronische Geräte hergestellt und verkauft, darunter Kindle, Fire-Tablets, Fire-TVs, Echo, Ring, Blink und Eero. und entwickelt und produziert Medieninhalte. Darüber hinaus bietet das Unternehmen Programme an, die es Verkäufern ermöglichen, ihre Produkte in seinen Filialen zu verkaufen; und Programme, die es Autoren, unabhängigen Verlegern, Musikern, Filmemachern, Twitch-Streamern, Skill- und App-Entwicklern und anderen ermöglichen, Inhalte zu veröffentlichen und zu verkaufen. Darüber hinaus bietet das Unternehmen Rechen-, Speicher-, künstliche Intelligenz-, Datenbank-, Analyse-, maschinelles Lern- und andere Dienste sowie Werbedienste über Programme wie gesponserte Anzeigen, Display- und Videowerbung. Darüber hinaus bietet das Unternehmen Amazon Prime an, ein Mitgliedschaftsprogramm. Zu den in seinen Geschäften angebotenen Produkten des Unternehmens gehören Waren und Inhalte, die zum Weiterverkauf erworben wurden, sowie Produkte, die von Drittanbietern angeboten werden. Es bedient Verbraucher, Verkäufer, Entwickler, Unternehmen, Content-Ersteller, Werbetreibende und Mitarbeiter. Das Unternehmen wurde 1994 gegründet und hat seinen Hauptsitz in Seattle, Washington.",31.638851,24.505909,0.166,0.748,0.12224,2610427854848.0,0.16,-0.03,-0.04,255.42,232.98,-0.05,0.04,False,True,48246400.0,63454630.0,0.76,0.57,0.13
AI / Tech,AI Software & Platforms,ORCL,140.27000427246094,343.01316637944586,134.57000732421875,Oracle Corporation,"Oracle Corporation bietet Produkte und Dienstleistungen an, die weltweit Frameworks für Unternehmensinformationstechnologie erstellen, ausführen und unterstützen. Das Oracle Cloud-Software-as-a-Service-Angebot umfasst verschiedene Cloud-Softwareanwendungen, darunter Oracle Fusion Cloud Enterprise Resource Planning ERP, Oracle Fusion Cloud Enterprise Performance Management EPM, Oracle Fusion Cloud Supply Chain and Manufacturing Management SCM, Oracle Fusion Cloud Human Capital Management HCM und NetSuite Applications Suite, Oracle Health-Anwendungen sowie Oracle Fusion Sales, Service und Marketing. Darüber hinaus bietet das Unternehmen cloudbasierte Branchenlösungen für verschiedene Branchen an; Oracle Cloud-Lizenz und On-Premise-Lizenz; und Oracle-Lizenzunterstützungsdienste. Darüber hinaus stellt das Unternehmen Infrastrukturtechnologien für Cloud- und Lizenzunternehmen bereit, beispielsweise die Oracle-Datenbank und die MySQL-Datenbank. Java, eine Softwareentwicklungssprache; und Middleware, einschließlich Entwicklungstools und anderen. Die Infrastrukturtechnologien des Cloud- und Lizenzgeschäfts des Unternehmens umfassen auch cloudbasierte Rechen-, Speicher- und Netzwerkfunktionen; und autonome Oracle-Datenbank sowie KI, Internet der Dinge, maschinelles Lernen, digitaler Assistent und Blockchain. Darüber hinaus bietet das Unternehmen Hardwareprodukte und andere hardwarebezogene Softwareangebote an, darunter von Oracle entwickelte Systeme, Unternehmensserver, Speicherlösungen, branchenspezifische Hardware, Virtualisierungssoftware, Betriebssysteme, Verwaltungssoftware und zugehörige Hardware-Supportdienste sowie Beratung und erweiterte Kundendienste. Das Unternehmen vermarktet und verkauft seine Cloud-, Lizenz-, Hardware-, Support- und Serviceangebote direkt an Unternehmen verschiedener Branchen, Regierungsbehörden und Bildungseinrichtungen sowie über indirekte Kanäle. Oracle Corporation hat eine strategische Allianz mit Metron, Inc. Das Unternehmen wurde 1977 gegründet und hat seinen Hauptsitz in Austin, Texas.",24.018835,12.843356,0.206,0.219,0.25368,404043694080.0,-0.04,-0.39,-0.41,186.37,199.07,-0.25,-0.3,False,False,44166700.0,32260575.0,1.37,0.03,-0.95
AI / Tech,AI Software & Platforms,SNOW,260.1499938964844,284.989990234375,118.30000305175781,Snowflake Inc.,"Snowflake Inc. bietet eine cloudbasierte Datenplattform für verschiedene Organisationen in den USA und international. Die Plattform des Unternehmens umfasst die Data Cloud mit künstlicher Intelligenz (KI), die es Kunden ermöglicht, Daten in einer einzigen Quelle der Wahrheit zu konsolidieren, um aussagekräftige Geschäftseinblicke zu gewinnen, Datenanwendungen zu erstellen und Daten und Datenprodukte zu teilen, sowie KI zur Lösung von Geschäftsproblemen einzusetzen. Es bedient Finanzdienstleistungen, Werbung, Medien und Unterhaltung, Einzelhandel und Konsumgüter, Gesundheitswesen und Biowissenschaften, Fertigung, Technologie, Telekommunikation, Reisen und Gastgewerbe sowie die Regierungs- und Verteidigungsindustrie sowie den öffentlichen Sektor. Das Unternehmen arbeitet mit OpenAI, L.L.C. zusammen. für die Entwicklung von KI-Lösungen für gemeinsame Unternehmenskunden, die einen spürbaren Return on Investment liefern. Das Unternehmen war früher als Snowflake Computing, Inc. bekannt und änderte seinen Namen im April 2019 in Snowflake Inc.. Snowflake Inc. wurde 2012 gegründet und hat seinen Sitz in Menlo Park, Kalifornien.",,96.83062,0.335,,-0.23786,90167984128.0,0.71,0.08,0.07,198.41,206.51,0.31,0.26,True,True,8093200.0,7332115.0,1.1,0.85,0.7
AI / Tech,AI Software & Platforms,PLTR,129.3000030517578,207.52000427246094,106.37000274658203,Palantir Technologies Inc.,"Palantir Technologies Inc. entwickelt und implementiert Softwareplattformen für die Geheimdienstgemeinschaft, um Ermittlungen und Operationen zur Terrorismusbekämpfung in den Vereinigten Staaten, im Vereinigten Königreich und auf der ganzen Welt zu unterstützen. Es ermöglicht die Integration von Palantir Gotham in andere Plattformen für Verteidigungsangebote, wodurch Benutzer das moderne Schlachtfeld sehen, verstehen und handeln können. Einsatzzentralen bis zur taktischen Grenze; Integration von Daten aus Domänen und Sensoren nahezu in Echtzeit; und Situationsbewusstsein und beschleunigt die operative Entscheidungsfindung und erleichtert die Übergabe zwischen Analysten und operativen Benutzern, wodurch Betreiber bei der Planung und Umsetzung realer Reaktionen auf Bedrohungen, die innerhalb der Plattform identifiziert wurden, unterstützt werden. Das Unternehmen bietet außerdem Palantir Foundry an, eine Plattform, die Unternehmen bei der Arbeit unterstützt, indem sie ein zentrales Betriebssystem für ihre Daten erstellt. und ermöglicht es einzelnen Benutzern, die benötigten Daten an einem Ort zu integrieren und zu analysieren. Darüber hinaus stellt das Unternehmen Palantir Apollo bereit, eine Software, die unternehmensweit Software und Updates bereitstellt und es Kunden ermöglicht, ihre Software praktisch in jeder Umgebung bereitzustellen; und die Palantir Artificial Intelligence Platform, die einen einheitlichen Zugriff auf Open-Source-, selbstgehostete und kommerzielle Large Language Models (LLMs) bietet, die strukturierte und unstrukturierte Daten in LLM-verständliche Objekte umwandeln und die Aktionen und Prozesse von Organisationen in Werkzeuge für Menschen und LLM-gesteuerte Agenten umwandeln können. Das Unternehmen unterhält außerdem eine strategische Partnerschaft mit Ondas Inc. zur Entwicklung und Bereitstellung KI-gestützter operativer Fähigkeiten zur Skalierung stratosphärischer, luft- und landgestützter ISR-Missionen. Das Unternehmen wurde 2003 gegründet und hat seinen Hauptsitz in Aventura, Florida.",145.2809,61.7337,0.847,3.25,0.43673,309972434944.0,-0.13,-0.09,-0.09,134.58,157.91,-0.04,-0.18,False,False,60641000.0,43585275.0,1.39,0.23,-0.55
AI / Tech,AI Software & Platforms,AI,9.0600004196167,30.110000610351562,7.675000190734863,"C3.ai, Inc.","C3.ai, Inc. ist als Unternehmen für Anwendungssoftware für künstliche Intelligenz in Nordamerika, Europa, dem Nahen Osten, Afrika, dem asiatisch-pazifischen Raum und international tätig. Es bietet die C3-Agenten-KI-Plattform, eine Anwendungsentwicklungs- und Laufzeitumgebung, die es Kunden ermöglicht, Unternehmens-KI-Anwendungen zu entwerfen, zu entwickeln und bereitzustellen; C3 AI Studio, eine integrierte Entwicklungsumgebung in der C3 Agentic AI Platform, die es Ingenieuren, Datenwissenschaftlern und Geschäftsanalysten ermöglicht, KI-Anwendungen zu entwerfen, zu erstellen, zu testen und bereitzustellen; C3 AI Applications, ein Portfolio branchenspezifischer KI-Anwendungen für Unternehmen, das die digitale Transformation von Organisationen weltweit ermöglicht; und C3 Generative AI, eine Bibliothek agentischer KI-Anwendungen zum Abrufen von Daten, zur Analyse von Informationen, zur Gewinnung von Erkenntnissen und zur Orchestrierung von Arbeitsabläufen. Das Unternehmen bietet außerdem C3 Code an, eine Lösung, die es Benutzern ermöglicht, automatisch vollständige und produktionstaugliche KI-Anwendungen für Unternehmen zu erstellen, zu konfigurieren und bereitzustellen, einschließlich Datenpipelines, KI-Modellen, Geschäftslogik, Sicherheitskontrollen und Benutzeroberflächen. Das Unternehmen unterhält strategische Partnerschaften mit Microsoft, AWS, Google Cloud, McKinsey & Company und Baker Hughes. Das Unternehmen war früher als C3 IoT, Inc. bekannt und änderte seinen Namen im Juni 2019 in C3.ai, Inc.. C3.ai, Inc. wurde 2009 gegründet und hat seinen Hauptsitz in Redwood City, Kalifornien.",,-20.104742,-0.525,,-1.87946,1408370560.0,0.05,-0.15,-0.14,9.67,12.39,-0.06,-0.27,False,False,5210600.0,7406620.0,0.7,0.06,-0.88
AI / Tech,AI Software & Platforms,SOUN,6.550000190734863,22.170000076293945,5.829999923706055,"SoundHound AI, Inc.","SoundHound AI, Inc. bietet unabhängige Sprachlösungen für künstliche Intelligenz (KI), die es Unternehmen in der Automobil-, TV-, IoT- und Kundendienstbranche ermöglichen, Kunden in den USA, Korea, Frankreich, Japan, Deutschland und international Gesprächserlebnisse zu bieten. Das Unternehmen bietet die Houndify-Plattform an, die eine Reihe von Houndify-Tools bereitstellt, um Marken bei der Entwicklung von Sprachassistenten für Konversationen zu unterstützen, wie z. B. Anwendungsprogrammierschnittstellen (API) für Text- und Sprachabfragen, Unterstützung für benutzerdefinierte Befehle, umfangreiche Bibliothek von Inhaltsdomänen, inklusive Plattformen für Software-Entwicklungskits, Funktionen für die Zusammenarbeit, Diagnosetools und integrierte Analysen; SoundHound Chat AI, ein Sprachassistent mit integrierter generativer KI, der sich in Wissensdomänen integriert und Echtzeitdaten wie Wetter, Sport, Aktien, Flugstatus, Restaurants und andere Daten abruft; und SoundHound Smart Answering, das Kundeneinrichtungen die Möglichkeit bietet, einen benutzerfreundlichen, benutzerdefinierten KI-gestützten Sprachassistenten zu erstellen. Es bietet außerdem CaiNET-Software, die maschinelles Lernen nutzt, um die Zusammenarbeit von Domänen zur Bearbeitung komplexer Abfragen zu verbessern. CaiLAN-Software, die Antworten vermittelt, sodass Benutzer Antworten aus der richtigen Domäne erhalten; Dynamic Interaction, eine multimodale Echtzeit-Kundendienstschnittstelle; Smart Ordering, das einen leicht verständlichen Sprachassistenten für Restaurants bietet; automatische Spracherkennung; Verständnis natürlicher Sprache; Weckwörter; benutzerdefinierte Domänen; Text-zu-Sprache; Mitarbeiterassistenz; und Edge- und Cloud-Konnektivität, einschließlich eingebetteter Sprachlösungen. Darüber hinaus bietet das Unternehmen die Amelia-Plattform an, die KI-Agenten für Unternehmen entwickelt; Chat-KI für die Automobilindustrie; Dynamisches Drive-Thru für GenAI; Voice Commerce, das Fahrer und Händler mit Voice AI verbindet; Autonomics-Plattform; Benutzerdefinierte Sprach-KI-Lösungen; Sprach-KI-Plattform; und SoundHound Musik-App. SoundHound AI, Inc. wurde 2005 gegründet und hat seinen Hauptsitz in Santa Clara, Kalifornien.",,-54.583336,0.517,,-0.91836,2834641152.0,-0.03,-0.19,-0.18,7.86,10.6,-0.17,-0.38,False,False,18310300.0,25472885.0,0.72,0.04,-0.91
AI / Tech,AI Software & Platforms,NBIS,215.6199951171875,299.8599853515625,43.88999938964844,Nebius Group N.V.,"Nebius Group N.V., ein Technologieunternehmen, beschäftigt sich mit dem Aufbau einer Full-Stack-Infrastruktur, um die globale KI-Industrie in den Vereinigten Staaten, im Vereinigten Königreich und international zu bedienen. Es bietet Nebius den Aufbau einer Full-Stack-Infrastruktur für KI, einschließlich großer GPU-Cluster, Cloud-Plattformen sowie Tools und Dienste für Entwickler. Das Unternehmen bietet außerdem TripleTen an, eine Edtech-Plattform zur Umschulung von Personen für Karrieren in der Technologiebranche. und Avride, das autonome Fahrtechnologie für selbstfahrende Autos und Lieferrobotik entwickelt. Es besteht eine strategische Allianz mit der NVIDIA Corporation, um den Ausbau der KI-Cloud-Infrastruktur des Unternehmens zu unterstützen. Das Unternehmen war früher als Yandex N.V. bekannt und änderte seinen Namen im August 2024 in Nebius Group N.V.. Nebius Group N.V. wurde 1989 gegründet und hat seinen Sitz in Schiphol, Niederlande.",83.25097,596.9215,6.839,,0.93086,54745526272.0,0.98,-0.14,-0.17,215.09,132.94,0.0,0.62,True,True,24804700.0,18404660.0,1.35,0.67,0.34
AI / Tech,AI Software & Platforms,CPNG,18.559999465942383,34.07500076293945,14.920000076293945,"Coupang, Inc.","Coupang, Inc. besitzt und betreibt zusammen mit seinen Tochtergesellschaften Einzelhandelsgeschäfte über seine mobilen Anwendungen und Internet-Websites in Südkorea und international. Das Unternehmen ist in den Segmenten Produkthandel und Angebotsentwicklung tätig. Das Segment Product Commerce umfasst koreanische Einzelhandels- und Marktplatzangebote; Rocket Fresh, ein frisches Lebensmittelangebot; und Werbeartikel. Das Segment Developing Offerings bietet Eats, einen Bestell- und Lieferservice für Restaurants; Play, ein Online-Content-Streaming-Dienst; Fintech-Aktivitäten; und Farfetch, ein Marktplatz für Luxusmode. Darüber hinaus führt das Unternehmen Betriebs- und Supportdienstleistungen in den Vereinigten Staaten, Südkorea, Taiwan, Singapur, China, Japan, Europa, dem Vereinigten Königreich und Indien durch. Coupang, Inc. wurde 2010 gegründet und hat seinen Hauptsitz in Seattle, Washington.",,67.97289,0.075,,-0.0047,33316390912.0,-0.02,0.13,0.12,17.46,22.65,0.06,-0.18,True,False,16106500.0,27673070.0,0.58,0.19,-0.62
